text,DA_prediction,DA,emo_prediction,emotion
"Oh, ain't that nice? The three of you trying on slutty lingerie together.",q,o,hap,dis
That's not what we're gonna do!,dag,dag,dis,dis
"Why would you ruin it, who was that hurtin'?",q,q,dis,dis
"Julie hi! Chandler Bing, I, I guess you remember me.",g,g,hap,hap
Hello Skidmark.,g,g,neu,neu
"It's a nickname, I'll explain later.",s,s,neu,neu
It's pretty clear.,s,o,neu,neu
"Ah, uh, I owe you a long overdue apology. I never should have broken up with you because you were overweight.",o,o,neu,neu
That's why you broke up with me?,q,q,sur,sur
"You-you-you didn't know that. Well, I guess my work here is done!",s,ans,sur,sad
Ni-chou chi-ma!,oth,oth,hap,hap
"Ross! Excuse me, pardon me, excuse me....",g,g,sur,sur
Hi everyone.,g,g,neu,neu
"I just, I wanted to thank you for our uh, our little talk before.",g,g,neu,neu
"Well, I was going to, but after I talked to you, I talked to Joey.",ans,o,neu,neu
"What did, what did he say?",q,q,fea,fea
"Basically he told me to get over myself and just do it, ya know.",ans,ans,neu,neu
"So I though about what you said and I though about what he said and, well, his way I get to have sex tonight so.",o,o,neu,neu
"Oh, great!",ag,oth,hap,hap
"We couldn't keep our eyes off each other all night and then every once and a while y'know, he'd kinda lean over and stroke my hair and touch my neck.",s,s,hap,hap
"Okay, stop it Phoebe, you're getting me all tingly.",c,c,hap,hap
"All I could think of was y'know, ""Is he gonna kiss me? Is he gonna kiss me?""",s,s,hap,hap
And did he?,q,q,neu,neu
"I'm a lady Monica, I don't kiss and tell. But this hickey speaks for itself.",ans,ans,hap,hap
"Okay-okay, I got it. I got it.",s,s,neu,neu
I just like him so much that I just feel like I've had 10 drinks today and I've only had six.,s,s,hap,hap
"Oh, I haven't had that feeling since I first started going out with Chandler.",s,s,hap,hap
"Wow, I'm never gonna have that feeling again, am I?",q,q,sad,sad
You sound like a guy.,o,o,dis,dis
"No, a guy would be saying, ""I'm never gonna get to sleep with anyone else.""",o,o,dis,dis
Oh my God!,oth,oth,sur,sur
I'm never gonna get to sleep with anyone else!,o,o,sad,sad
I've been so busy planning the wedding that I forgot about all the things that I'd be giving up!,s,s,sur,sur
"I mean, I I'm never gonna have a first kiss again.",s,s,sad,sad
You'll have a last kiss.,s,s,neu,neu
Thank you so much for coming back over.,s,s,hap,hap
"Oh good, you're here. Yeah, and I was worried that it was going to be uncomfortable.",s,s,sad,sad
"I know Mona, just hear me out.",s,s,neu,neu
"First of all, I'm so sorry about my father yelling at you, but I heard you totally held your own.",ap,ap,neu,neu
You're gonna have to tell me how you did that.,c,c,neu,neu
Focus.,c,c,neu,neu
"Okay. Um But Okay, yes Ross and I used to date. And yes we are gonna have a baby. But we are",s,s,neu,neu
All right where's that turkey!,q,q,neu,neu
Joey! Those are my maternity pants!,s,s,sur,sur
Not now! These are my Thanksgiving pants!,s,s,hap,hap
No.,ans,dag,neu,neu
No!,ans,dag,ang,ang
"Oh, would you look at that Monica?",q,q,ang,hap
"I just knocked off all of your top scores, how sad.",s,o,hap,hap
"Okay, I'm next. Don't! Don't start another game! I said I'm next! Phoebe!",c,c,ang,ang
"Oh, I'm sorry. I didn't hear you over all the winning.",ap,ap,hap,hap
Chandler! Phoebe's hogging the game!,s,s,ang,ang
Remember I had to leave the room the other day when you had that roast chicken?,s,q,neu,neu
Yeah. But I thought that was because I put the whole thing on my hand and made it walk across the table.,ans,ans,neu,neu
"Anyway, it just doesn't seem worth it to make a whole turkey for just three people. Okay? It's a lot of work.",o,o,neu,neu
But you gotta have turkey on Thanksgiving!,s,s,hap,hap
"I mean, Thanksgiving with no turkey is like-like Fourth of July with no apple pie!",o,o,sad,sad
Or Friday with no two pizzas!,o,o,sad,sad
All right fine! If it means that much to you! But just there's gonna be a ton left over.,ag,ag,sad,sad
No there won't! I promise I will finish that turkey!,s,s,hap,hap
"All right, you're telling me you can eat an entire turkey in just one sitting?",q,q,neu,neu
That's right!,ag,ans,hap,hap
 Cause I'm a Tribbiani!,s,s,hap,hap
And this is what we do!,s,s,neu,neu
We can eat!,s,s,hap,hap
"Wow! It's huge! It's so much bigger than the cubicle. Oh, this is a cube.",o,o,sur,sur
Look at this!,c,c,hap,hap
Oh! You have a window!,s,s,sur,sur
Yes indeedy! With a beautiful view of...,ag,ag,hap,hap
Oh look! That guy's peeing!,s,s,sur,sur
Hi.,g,g,neu,neu
Hi.,g,g,neu,neu
"Y'know what? I cannot do this with my left hand! Would you please, help me with this too?",s,s,ang,ang
Okay. Let's use this brush.,ag,ag,neu,neu
Okay. This stuff?,q,q,neu,neu
Yeah.,ans,ans,neu,neu
All right.,ag,ag,neu,neu
"Careful. Light. Okay, do you know how, just sweep it across the lid. Okay? Just sweep it.",s,s,neu,neu
Okay-Dokey,ag,ag,sad,sad
Where exactly is your zoo?,q,q,neu,neu
"Well, it's technically not a zoo per se, it's more of an interactive wildlife experience.",ans,ans,neu,neu
"Let me ask you some questions about, is it, uh, Marcel?",s,s,neu,neu
Yes.,ans,ag,neu,neu
"Does he, uh, fight with other animals?",q,q,neu,neu
"No-no, he's, he's very docile.",ans,ans,neu,neu
Even if he were... cornered?,q,q,neu,neu
"Well I, I don't know. Why?",ans,ans,neu,neu
"Uh, how is he at handling small objects?",q,q,neu,neu
"He can hold a banana, if that's whatcha mean...",ans,ans,neu,neu
"How about a hammer, or a small blade?",q,q,neu,neu
Otherwise it's just cruel.,o,o,neu,neu
"He- he- he got in, he- he got in to San Diego.",s,s,hap,hap
"We, we come back from our walk and the- the phone was ringing...",s,s,neu,neu
...He's in.,s,s,neu,neu
"He's in! Oh, did you hear that, Marcel? San Diego. San Diego!",s,s,hap,hap
You're making a big mistake here.,o,o,ang,dis
"I mean, San Diego's all well and good, but if you give him to me, I'll start him off against a blind rabbit and give you twenty percent of the gains.",o,o,neu,neu
My specimen is in the room and I just want to thank whoever knocked on the door while I was in there.,s,s,neu,neu
Really helped speed the process along!,o,o,hap,hap
Janice!,oth,oth,sur,sur
You're not... gone?,q,q,sur,sur
Sid is still in his room.,ans,ans,neu,neu
I don't allow porn at home so this is like a vacation for him.,s,s,hap,hap
So did you do it?,q,q,sur,sur
Did you make your deposit?,q,q,neu,neu
Yeah! yeah... The hard part is over!,ans,ans,hap,hap
"That's not the hard part honey! The hard part is what comes next, I mean aren't you worried about the results?",q,q,fea,fea
I haven't... I haven't even thought about the results yet... I just assumed that everything was gonna be ok.,o,ans,sur,hap
"Oh! Well, you know what? It probably is.",o,o,neu,neu
"Phoebe, where's your purse?",q,q,neu,fea
"No, no! Give it to me!",c,c,ang,ang
You can't have it.,o,o,ang,ang
Give it to me!,c,c,ang,ang
No,dag,dag,ang,ang
I'll go in there.,s,s,neu,ang
Oh yeah.,ans,ag,neu,ang
Phoebe come here,c,c,neu,neu
Haha!,oth,oth,hap,hap
Damn you Monica Geller hyphen Bing!,oth,oth,ang,ang
"What we did was wrong. Oh god, I just had sex with somebody that wasn't alive during the Bicentennial.",s,s,dis,dis
I just had sex.,s,s,neu,neu
"Ethan, focus. How could you not tell me?",q,q,sur,sur
"Well, you never told me how old you were.",ans,ans,neu,neu
"Well, that's different. My lie didn't make one of us a felon in 48 states. What were you thinking?",q,q,dis,dis
I wasn't thinking. I was too busy fallin'...,ans,ans,hap,hap
Don't say it.,c,c,fea,fea
...in love with you.,s,s,hap,hap
Really?,q,q,sur,sur
Sorry.,ap,ap,sad,sad
"Well,fall out of it.",s,s,ang,ang
"You know, you shouldn't even be here, it's a school night.",o,o,ang,ang
"Oh god, oh god.",oth,oth,hap,hap
I'm like those women that you see with shiny guys named Chad.,s,s,dis,dis
I'm Joan Collins.,s,s,hap,dis
Who?,q,q,neu,neu
"That's right, still no baby! Come on people! Please make some room!",s,s,sad,sad
"Uh sweetie, maybe you'd be more comfortable here?",o,o,neu,neu
You. Like you haven't done enough.,o,o,ang,ang
"Look, I-I know how miserable you are, I wish there was something I can do.",s,s,neu,neu
I mean I wish I were a seahorse.,o,o,neu,neu
"Because with seahorses it's the male, they carry the babies.",s,s,neu,neu
"And then also umm, I'd be far away in the sea.",s,s,ang,ang
God. I have never been so uncomfortable in my entire life!,s,s,hap,hap
"Oh I know, I've been there. I remember toward the end",s,s,neu,neu
"Oh Phoebe, that's a great story.",o,o,neu,neu
Can you tell it to me when you're getting me some iced tea?,q,q,neu,sad
"Oh God, get out!",c,c,ang,ang
Get out!!,c,c,ang,ang
Get out!!,c,c,ang,ang
Get out!,c,c,ang,ang
Let's.,oth,oth,neu,neu
"All right, I know! I know. Yeah, it'll be okay.",s,s,hap,hap
Oh my God .What's he gonna do now?,q,q,fea,fea
I can't watch!,s,s,fea,fea
Oh.,b,oth,neu,neu
"Seriously, how can you watch this?",q,q,sur,sad
Aren't you scared?,q,q,fea,fea
Terrified.,ans,ans,fea,fea
Oh-hey-hey-hey! There you are!,g,g,hap,hap
"Umm, listen there's something I think you should know.",o,o,neu,neu
"Oh, is this about you-you dating the nurse?",q,q,neu,sur
"Yeah, Joey already told me, and I am so-so fine.",ans,ans,neu,neu
"I mean, you and I we're just, y'know, we're nothing, we're goofin' around.",s,s,neu,neu
"Umm, actually I was about to tell you that I was, I was going to get out of it, but hey, if we're just goofing around then uh, maybe I",s,o,neu,neu
Fine! Maybe I will too!,ag,o,ang,hap
"Well, it was quite large. I-I-I-I-I had to throw most of it away.",s,s,fea,fea
You-you-you-you threw my sandwich away!,q,q,fea,fea
MY SANDWICH?!!!,q,q,ang,ang
MY SANDWICH!!!!!!,s,q,ang,ang
"What's the matter, Pheebs?",q,q,neu,neu
She cancelled! My namesake cancelled on me!,ans,ans,ang,ang
What?!,q,q,sur,sur
"Yeah, she clamed she had to go out of town suddenly.",ans,ans,sad,sad
"She's avoiding me, she doesn't want to tell me where my Father is.",s,s,sad,sad
"She knows, and she won't tell me.",s,s,neu,sad
"Aww Pheebs, that sucks!",o,o,dis,sad
"Yeah, well, don't  Aww Pheebs, that sucks!  me yet.",o,s,hap,sad
Where ya going?,q,q,neu,neu
"Well, she's out of town so, there's gotta be something in her house that tells me where my Father is.",ans,ans,neu,neu
"Uh, Pheebs, some people call that breaking and entering.",s,s,fea,fea
"Well, are any of those people here?!",q,q,ang,ang
"Oh my God, so do I!",ag,ag,sur,sur
"I knew it, wow!!",s,s,sur,sur
"Wait-wait-wait, wait! Puppies. Cute or ugly?",q,q,neu,neu
"Ohh, so cute.",ans,ans,hap,hap
"Uh-huh, well! But umm, still I'm-I'm mad at you.",s,s,ang,ang
I know. I'm mad at me too.,ag,ag,ang,ang
"Well umm, do you wanna get something to eat? I'm kinda hungry.",q,q,neu,neu
Hey! Me too!,g,ag,hap,sur
"All right, stop it. Now you're just doing it to freak me out.",c,c,sad,sad
"Ok, you can do this.",s,s,neu,neu
It's just like pulling off a Band-aid.,s,s,neu,neu
"Just do it really fast, and then the wound is exposed.",s,s,neu,neu
"Janice. Hi, Janice. Ok, here we go. I don't think we should go out anymore. Janice.",o,o,sad,sad
"All right. Well, there you go. Stop it, stop it, stop it.",c,c,ang,ang
Oh my God! That guy at the counter is totally checking you out!,s,s,sur,sur
"Really? My God, he's really cute.",o,o,sur,sur
Go for it.,c,c,neu,neu
"Phoebe, I'm engaged!",ans,dag,sur,sur
"I'm just saying, get his number just in case.",s,s,neu,neu
But no: Chandler is in an accident and can't perform sexually and he would want you to take a lover to satisfy the needs that he can no longer fulfill.,ans,o,neu,neu
"Op, can I just tell you something? Very flattered but umm, I'm engaged.",s,s,hap,hap
Well you should be embarrassed.,o,o,dis,dis
"I did, but that was really fun.",ans,o,hap,hap
Hey.,g,g,neu,neu
Chandler. I sensed it was you.,s,s,neu,neu
What?!,q,q,sur,sur
Unagi. I'm always aware.,s,s,neu,neu
"Okay, are you aware unagi is an eel?",q,q,hap,hap
What's up?,q,q,neu,neu
I can't figure out what to make Monica.,s,s,neu,neu
"Oh, why don't you make her one of your little jokes.",o,o,ang,ang
I'm going crazy! Okay? Do you have any thing around here that looks homemade?,q,q,ang,fea
Y'know what?,q,q,neu,neu
She'd-she'd love this.,s,s,neu,neu
"Uh, it's an exact replica of Apollo 8.",s,s,neu,neu
I made it in the sixth grade.,s,s,neu,neu
"Yeah, I guess I could use that. I could say that your love sends me to the moon.",o,o,neu,neu
"Yeah-yeah, except Apollo 8 didn't actually land on the moon.",s,s,neu,neu
"But you-you-you could write that umm, your love lets me orbit the moon twice and return safely.",s,s,hap,hap
"Wait a minute, I can't give this to her.",o,o,neu,neu
Why not?,q,q,neu,neu
"Because it says ""Captain Ross"" on the side and ""I hate Monica"" on the bottom.",ans,ans,neu,neu
Oh. Oh I just cannot believe Clark stood me up!,o,o,ang,ang
He might still show up.,s,s,neu,neu
"Oh, what are you, stupid? It's been three hours.",s,s,ang,ang
Is that all?,q,q,neu,neu
"I should just go on to happier things, okay? Umm, why don't you tell about your lovely wedding?",s,s,sad,sad
"Well actually uh, there was something we wanted to tell you about the wedding.",s,s,neu,neu
"Um, it's going to be a small ceremony.",s,s,neu,neu
"Uh, tiny!",ans,s,hap,sur
We're not even sure why we're having it.,s,s,neu,neu
It's actually going to be just family.,s,s,neu,neu
"Oh wait you two think of me as family?! Oh, I have to ask you something now and be honest; do you want me to sing",q,q,sur,sur
"Come here to me. No-no, you come here to me.",c,c,neu,neu
Hey Ross! I brought reinforcements.,s,g,neu,hap
"Oh great! What, you brought Joey?",q,q,hap,hap
"Well, I brought the next best thing.",ans,ans,neu,neu
Whoa! Y'know what Katie? I gotta tell ya I-I-I-I think you are the one who is too much.,o,o,sur,sur
"Ohh, Joey has the nicest friends!",s,s,hap,hap
"Ohh, and the nicest girlfriend!",s,s,hap,hap
You're so sweet!,o,o,hap,hap
"Ohh, you're so sweet!",o,o,hap,hap
"Oww!!!! Joey, she just kicked me.",s,s,sur,sur
Huh.,b,b,neu,neu
Well? Aren't you gonna do something?,q,q,fea,neu
Uhh .,b,b,neu,neu
"You'd better do something, or I'm gonna walk out that door right now! Well? Are you gonna?",q,q,ang,ang
Nah.,ans,ans,neu,neu
"How could you pick up a hitchhiker?! He could be a rape , a rapist or a killer or something!",q,q,fea,fea
Don't you think I asked him that before he got in?!,q,q,sur,sur
"Y'know what? I'm not talking to you! You go back to sleep! And you, are you a rapist?!",q,q,ang,ang
No!,ans,ans,ang,ang
Do you like car games?,q,q,neu,neu
"Yeah, y'know the license plate game?",q,q,neu,neu
I,oth,oth,neu,neu
"Ooh, I'll play! I'll play!",s,s,hap,hap
No-No! You need your sleep. Night-night! Shh!,dag,dag,ang,ang
"Pheebs, can you help me pick out an engagement ring for Monica?",q,q,neu,neu
I can't figure this out!,s,s,ang,ang
It's so hard!,s,s,sad,sad
Should I get her a Tiffany cut or a Princess cut or a ah-ah!,q,q,sad,sad
Paper cut!,ans,ans,sad,sad
"Now, have you told anyone else?",q,q,neu,neu
"No, I don't want to tell anybody else because I don't want Monica to find out.",ans,ans,neu,neu
You told me.,s,s,sur,sur
"Well, it's because I trust you, you're one of my best friends, and you walked in on me when I was looking at ring brochures.",o,o,ang,ang
"Yeah well, once again not knocking pays off. I only wish you hadn't been on the toilet.",s,s,sur,sur
Me too.,ag,s,neu,neu
Hey.,g,g,neu,neu
Hey.,g,g,neu,neu
"Hey! So Chandler, wanna go to the coffeehouse?",q,q,hap,hap
Oh all right.,ag,ans,neu,neu
"Oh perfect, we were just gonna see if you wanted to go.",s,s,neu,neu
"Oh well, we don't because we got the other pl-place.",s,s,neu,neu
How rude.,o,o,dis,dis
"Oh, I'm sorry. You wanna bite?",ap,q,neu,sur
"The stripper stole the ring!! The stripper stole the ring!! Chandler! Chandler, get up! Get up! The stripper stole the ring!",s,s,sur,sur
What?,q,q,sur,sur
The ring is gone!,ans,ans,sur,sur
Ugh.,b,b,dis,dis
"Just a sec, give me a minute to wake up for this Ah-ha-ha!!",s,s,neu,neu
You lost the ring!,s,s,hap,hap
You're the worst best man ever!,o,o,ang,ang
"Dude, this isn't funny!",o,o,ang,ang
What am I gonna do?!,q,q,fea,fea
"I go to bed last night, everything's cool!",s,s,hap,hap
"I wake up this morning, the stripper's gone and the ring is gone!",s,s,fea,fea
You slept with the stripper?,q,q,sur,sur
Of course!!,ans,ans,fea,fea
What difference does that make?!,q,q,ang,ang
"Well, I'm just if the paste matches the pants, you can make yourself a pair of paste pants and she won't know the difference!",ans,ans,ang,ang
"Joey, do you have a minute?",q,q,neu,neu
"Dude, what am I gonna",q,q,fea,fea
"Uh, Rachel's here, so good luck man, let me know how it works out.",s,s,neu,ang
"Oh, Joey, I have such a problem!",s,s,sad,fea
"Oh well, you're timing couldn't be better. I am putting out fires all over the place.",s,s,neu,neu
"Okay. Okay. Okay. Joey, I have",oth,oth,neu,neu
"What-what is it, what is it?",q,q,neu,neu
"Oh my God, it's so huge, but you just have to promise me that you cannot tell anyone.",s,ans,sur,sur
"Oh no, no-no-no-no! I don't want to know!",s,s,fea,fea
"Yes! Yes! Yes, you do want to know! This is unbelievable!",s,dag,hap,ang
"I don't care, Rach! Look, I am tired of being the guy who knows all the secrets but can't tell anyone!",s,s,dis,dis
What? What secrets? You know secrets? What are they?,q,q,sur,sur
And you're not supposed to be gossiping!!,dag,s,ang,dis
"I know, I know! I just can't keep this one in, so I pick up the phone",s,s,fea,fea
I'm not listening to you!,s,s,ang,ang
Oh! Yay! Look! There's a piece that doesn't have floor on it!,s,s,hap,hap
"Hey, come on now!",c,s,ang,ang
"All right, what are we havin'?",q,q,neu,neu
"Uhh, I don't believe in these crazy diets y'know, just everything in moderation.",ans,o,neu,neu
I'll take those to go. For the kids.,s,s,neu,neu
"Oh, I know what I wanted to ask you. You were on the show years ago and then they killed you off. What happened there?",q,q,neu,neu
"It was so stupid, I said some stuff in an interview that I shouldn't have said.",o,o,ang,ang
"But believe me, that's not gonna happen today.",o,o,neu,neu
"Understood. So, what'd you say back then?",q,q,neu,neu
"Well, I said that I",ans,ans,neu,neu
Ha!,oth,s,ang,neu
So you like the drums!,s,s,hap,hap
"That's, that's great!",o,o,hap,hap
"Y'know, I was worried, that, you know, they would maybe an unbearable living situation.",o,o,neu,neu
"All right, okay, well, apparently not!",s,s,sad,sad
"So, yay!",oth,oth,hap,hap
"Hey-hey, Pheebs, check it out, we already learned a song. Ready? One, two, three, four...",c,c,neu,neu
Tequila!!,oth,oth,hap,hap
That's fun.,o,o,hap,hap
"Whoa-whoa, Treeger made you cry?",q,q,sur,sur
Yes! And he said really mean things that were only partly true.,ans,ans,sad,sad
I'm gonna go down there and teach that guy a lesson.,s,s,hap,ang
"Joey, please don't do that. I think it's best that we just forget about it.",o,o,fea,fea
"That's easy for you to say, you weren't almost just killed.",s,s,ang,ang
"All right that's it, school is in session!",s,s,neu,neu
My God! Is this a gym card?,q,q,sur,sur
"Oh yeah, gym member. I try to go four times a week, but I've missed the last 1200 times.",ans,ans,neu,neu
So why don't you quit?,q,q,neu,neu
You don't think I've tried? You think I,ans,ans,hap,hap
Who is Maria?,q,q,neu,neu
"Oh Maria. You can't say no to her, she's like this lycra spandex covered gym treat.",ans,ans,hap,hap
You need me to go down there with you and hold your hand?,q,q,neu,neu
No!,ans,ans,ang,ang
So you're strong enough to face her on your own?,q,q,neu,neu
"Oh no, you'll have to come.",ans,ans,fea,fea
"Pheebs, I don't think anyone's mad about that.",o,o,neu,neu
Exactly! Because it's in the past!,ag,ag,ang,ang
Anybody gonna eat that?,q,q,neu,neu
Pheebs!,oth,oth,hap,hap
Hey!,g,g,hap,hap
"Listen, you know how uh, when you're wearing pants and you lean forward I check out your underwear?",s,s,neu,neu
Yeah!,ans,b,hap,neu
"Well, when Jake did it I saw that he was wearing women's underwear!",s,s,sur,sur
I know. They were mine.,s,s,neu,neu
"Oh. No! No wait, that's weird!",o,o,dis,dis
"No, it's not! We were just goofing around and I dared him to try them on.",s,s,neu,neu
That's weird!,o,o,dis,dis
I'm wearing his briefs right now.,ans,s,neu,neu
That's kinda hot.,o,o,hap,sur
I think so too. And that little flap? Great for holding my lipstick.,ag,ag,hap,hap
"Yeah, I wouldn't know about that.",s,s,neu,neu
And! Y'know what Jake says? That women's underwear is actually more comfortable. And he loves the way the silk feels against his skin.,s,s,hap,hap
"Yeah well next thing you know, he'll be telling you that your high heels are good for his posture!",s,s,dis,dis
There is nothing wrong with Jake! Okay? He is all man! I'm thinking even more than you.,s,s,neu,neu
"Oh yeah, he looked like a real lumberjack in those pink lacys.",s,s,dis,dis
I'm just saying that only a man completely secure with his masculinity could walk around in women's underwear!,s,s,neu,neu
I don't think you could ever do that.,o,o,hap,neu
Hey! I,g,g,neu,neu
"Okay, whatever.",oth,oth,dis,dis
Lusts of the flesh.,o,o,neu,neu
What?,q,q,sur,neu
I don't know. A cowboy theme?,ans,ans,neu,neu
"Hey uh, is it okay to come in?",q,q,neu,neu
"Of course! Oh Joey, this ring I its beautiful I love it!",s,ans,hap,hap
"Yeah uh look Rach, theres something I gotta tell ya.",s,s,neu,neu
Hey!,g,g,hap,hap
Hey! Are you ready to try nursing again?,q,q,neu,neu
"Yeah! Hi Emma. Hey, why do you think she wont take my breast?",q,q,hap,neu
"Its all right honey, it takes some babies a while to get it, but dont worry. Itll happen.",s,ans,fea,neu
Yowza,oth,oth,ang,ang
"Okay sweetie, you can do it. Just open up and put it in your mouth.",c,c,neu,neu
Dear Lord.,oth,oth,sur,sur
"Im sorry honey, what were you saying?",q,q,neu,neu
"Oh uh-uh yeah, I think that ",ans,ans,neu,neu
Do you think my nipples are too big for her mouth?,q,q,neu,neu
She looks scared.,s,o,fea,neu
Doesnt she look scared?,q,q,fea,neu
"Yknow, I dont really know her.",ans,ans,neu,neu
Can you see my nipples through this shirt?,q,q,neu,neu
"No. But don't worry, I'm sure they're still there.",ans,ans,neu,neu
"Where are you going, Mr. Suity-Man?",q,q,neu,neu
"Well, I have an appointment to see Dr. Robert Pillman, career counselor a-gogo. I added the ""a-gogo.""",s,ans,neu,neu
"Actually, tomorrow night kinda depends on how tonight goes.",s,s,neu,neu
"Oh, uh, listen, about tonight...",s,s,sad,sad
"No, no, no, don't you dare bail on me.",dag,c,fea,ang
The only reason she's goin' out with me is because I said I could bring a friend for her friend.,s,s,neu,neu
"Yes, I know, but her friend sounds like such a...",s,s,ang,ang
Pathetic mess?,o,o,neu,neu
"I know, but come on, man, she's needy, she's vulnerable.",o,o,neu,neu
"I'm thinkin', cha-ching!",oth,oth,hap,hap
Thanks.,g,g,neu,neu
"Look, you have not been out with a woman since Janice.",s,s,neu,neu
You're doin' this.,s,s,neu,neu
Hi. She said yes.,s,s,neu,neu
"Yes! Way to go, man! Still got the egg, huh?",ans,ap,hap,hap
"""Happy birthday to you!""",g,g,hap,hap
You're paying for that.,s,s,neu,neu
What? No-no it's her birthday!,dag,dag,sur,sur
You've sung Happy Birthday to 20 different women today!,s,s,sur,sur
But it really,s,s,neu,neu
You are no longer authorized to distribute birthday muffins.,s,s,neu,neu
Damnit!,oth,oth,ang,ang
Rach? Hi!,g,g,hap,hap
Hi!,g,g,hap,hap
Did you tell your sister to ask me out?,q,q,neu,neu
Well yeah,ans,ans,neu,neu
Oh wow!,b,b,sur,sur
"I mean, wow!",s,b,sur,sur
"I mean, I-I-I think she's cute but I-I would never have thought of going out with her, never!",o,o,neu,neu
Really?!,q,q,sur,sur
"Yeah but after you said it was okay, I figured, ""Why not?!""",ans,ans,hap,hap
Oh so-so not really never.,s,s,neu,neu
I have to say you are a much bigger person than I am.,o,o,neu,neu
"I mean after all we've been through, I just y'know I wish I had a brother to reciprocate.",o,o,neu,neu
"Hey, if you ever want to go out with Monica, you have my blessing.",s,s,neu,neu
"Oh-ho, and mine!",oth,s,hap,hap
No-no wait-wait! I can't just let you hang up! Just please talk to me.,c,c,fea,fea
Well I only have one thing to do today. I guess I could push it back.,s,s,neu,neu
"Yeah! Now, why do you want to kill yourself?",q,q,sad,sad
"It's just that I uh, have been working for ten years now at this meaningless, dead-end job and nobody here even knows I exist!",ans,ans,sad,sad
Chandler?,oth,q,neu,neu
I-I'm sorry?,ap,ap,sad,sad
"No look, I-I'm sure that people know you exist!",s,s,sad,sad
Oh yeah?,b,b,neu,sad
I work in a cubicle surrounded by people.,s,s,neu,neu
I've been talking to you for five minutes now about killing myself and no one's even looked up from their desk.,s,s,sad,sad
Hang-hang on.,c,c,neu,neu
Hey everybody!,g,g,neu,neu
"Uh, I'm gonna kill myself!",s,s,sad,sad
I got nothing.,s,s,neu,neu
"Apparently, there's like a million guys out there that can play Mac, and there's only this one robot and this one guy who controls it!",o,o,sur,sur
I didn't know he could get me fired!,s,s,hap,sur
What am I going to do?,q,q,fea,fea
"Well y'know Joey, you're a pretty charming guy.",o,o,neu,neu
"Thanks, but I kinda have a problem to deal with here.",s,s,sad,fea
"No sweetie, you've got to win over the guy that controls C.H.E.E.S.E.! You've got to kiss some serious robot ass!",o,o,neu,neu
That's not a bad idea.,o,ag,neu,neu
"Okay, but if I got to turn on the charm tomorrow I'm not wasting anymore of it over here with you guys.",s,o,neu,neu
"Well, actually I got a little bit saved for you Pheebs.",s,s,neu,hap
