text,DA_prediction,DA,emo_prediction,emotion
"I'm not wrong! I wish I was. I'm sorry. Bet that barium enema doesn't sound so bad now, huh?",dag,dag,sad,sad
I know.,ag,a,neu,neu
Let's try a look of far off wonderment.,oth,oth,neu,neu
"Okay, we'll-we'll gaze into our future and we'll think about our marriage and the days to come.",ag,ag,hap,hap
Chandler!,oth,g,ang,sur
What is the matter with your face?!,q,q,ang,sur
"I mean this picture is supposed to say ""Geller and Bing to be married,"" not ""Local woman saves drowning moron!""",o,o,ang,ang
Hey!,g,g,hap,ang
Don't laugh at him!,c,c,ang,ang
He's,s,s,neu,neu
We're gonna find love!,s,s,hap,hap
Definitely!,ag,ag,hap,hap
"Yeah, I'm pretty confident about that.",ag,ag,neu,neu
That's what makes it so easy for me to be 80% happy for Monica and Chandler!,o,s,ang,hap
It would be nice to have a little guarantee though.,o,o,neu,neu
What do you mean?,q,q,neu,neu
"Well y'know, some people make deals with a friend, like if neither of them are married by the time they're 40, they marry each other.",o,ans,neu,neu
You mean a backup?,q,q,neu,neu
Exactly!,ag,ans,hap,hap
"Yeah, yeah I got that.",ag,ag,neu,neu
You do?,q,q,sur,neu
Hm-mmm,b,ans,neu,neu
Who?,q,q,neu,neu
Yeah!,ans,ans,hap,hap
Are you serious?!,q,q,sur,sur
"Yeah, I locked him years ago!",ans,ans,hap,hap
"Wh  So  If neither of you are married by the time you're 40, you're gonna marry Joey.",q,q,sur,sur
"Yep, we shook on it. Yeah but believe me that is not how he wanted to seal the deal.",ans,ans,neu,neu
"Oh, seriously?",q,q,sur,sur
"Yeah uh, what am I gonna do?",q,q,fea,neu
"Yeah, I'm sorry man. You wanna go watch?",ap,ap,neu,neu
Yeah!,ans,ans,hap,hap
Good morning.,g,g,neu,neu
"Hi Tag! Hey, so did you have fun with uh, with Joey last night?",q,q,hap,hap
Oh yeah! We went to the Knicks game.,ans,ans,hap,hap
Ohh that's nice.,o,o,hap,hap
Then we went to this bar and he hooked us up with all these women!,s,s,hap,hap
Wo-women? You mean like old women?,q,q,dis,dis
"Well kinda old, like 30.",ans,ans,neu,neu
Oh.,b,b,neu,neu
"And I never used to be able to just talk to girls in bars, but I got like 20 phone numbers last night.",s,s,neu,sur
"That's great! Wow man, so Joey must've really taught you some stuff huh?",q,q,sur,sur
A little.,ans,ans,neu,neu
Yeah?,b,b,neu,sur
How you doin'?,q,q,neu,neu
"Phoebe, we are so proud of you! You're amazing!",o,o,hap,hap
I know.,ag,ag,neu,neu
So does it really hurt as bad as they say?,q,q,hap,hap
What did you just say?,q,q,sur,sur
You roll another hard eight and we get married here tonight.,ans,ans,hap,hap
Are you serious?!,q,q,sur,sur
Yes! I love you! I've never loved anybody as much as I love you.,ans,ans,hap,hap
I've never loved anybody as much as I love you.,s,s,hap,hap
"Okay, so if an eight comes up, we take it as a sign and we do it!",oth,oth,hap,hap
What do you say?,q,q,neu,neu
Okay!,ag,ag,hap,hap
Okay! Come on! Let's go! All right!,c,c,hap,hap
Okay! That's a four! And where-where's the other one?,q,q,ang,ang
It went under the table.,ans,ans,neu,neu
"Nobody move! Okay, you look that way; I'll look this way!",c,c,ang,ang
Here it is! Here it is!,s,s,hap,hap
That could be a four or a five. It's your call.,s,s,neu,neu
It's a four.,s,s,neu,neu
I think so too.,ag,ag,neu,neu
Well that's it. I'm done. Whew! There come the meat sweats.,s,s,hap,hap
"Well Joey, we're all we're all very proud of you.",s,s,hap,hap
"Yes, I believe we can expect a call from the President any moment now.",s,s,neu,neu
Is there anything we can do for you?,q,q,neu,neu
"No just, nobody press on my stomach.",ans,ans,neu,neu
You can keep those pants by the way.,o,s,neu,neu
Whoa hey wh-wh-what do you got there? What is that? Pie?,q,q,sur,sur
"Yeah, you want some?",q,q,neu,neu
"Ah, just cut me a little sliver.",ans,ans,hap,hap
A little bigger.,s,s,neu,neu
Little bigger.,s,s,neu,neu
What?!,q,q,sur,sur
Are you afraid you're gonna run out?!,q,q,ang,ang
Cut me a real piece!,s,c,ang,ang
"Phoebe, oh my God! Wh-wh-what are you doing here?",q,q,sur,sur
"I need to talk to you, it's pretty urgent. It's about Monica and Chandler.",s,ans,neu,neu
Oh my God!,oth,oth,sur,sur
"Of course, of course.",ag,ag,neu,neu
"Umm, would you please excuse me for a moment?",q,q,neu,neu
"Umm, do you know each other's hometowns?",q,q,neu,neu
Why don't you  Wh-what's going on?,q,q,fea,fea
"Well, umm, not much.",ans,ans,neu,neu
"But, I was just thinking that since those guys just got engaged that maybe it would be nice if they had some privacy, y'know?",q,q,neu,neu
"So, could I just move in with you for a couple days?",q,q,neu,neu
"Umm, okay, yeah, sure. But wh-what's wrong with Monica and Chandler?",q,q,neu,neu
Nothing..Why?,q,q,neu,neu
"Phoebe, you said it was urgent!",s,ans,sur,ang
Oh yeah it is! I'm going to the movies and it starts in like five minutes.,s,s,neu,neu
Do you realize I have a classroom full of students?,q,q,ang,ang
"Oh, I'm sorry. I'm so rude. Does anyone want to come to the movies?",q,q,neu,neu
"Look, look, there's got to be a way we can work past this.",s,s,sad,sad
"Okay, I can't imagine, I can't imagine my life without you.",s,s,fea,fea
"Without, without these arms, and your face, and this heart.",s,s,sad,sad
"Your good heart Rach, and, and....",s,s,sad,sad
No.,ans,dag,neu,neu
"I can't, you're a totally different person to me now.",dag,dag,sad,sad
"I used to think of you as somebody that would never, ever hurt me, ever.",s,s,sad,sad
"God, and now I just can't stop picturing with her, I can't, it doesn't matter what you say, or what you do, Ross.",s,s,sad,sad
"It's just changed, everything.",s,s,sad,sad
Forever.,s,s,sad,sad
"Yeah, but this can't be it, I mean.",dag,dag,sad,sad
Then how come it is?,q,q,sad,sad
"Windows are clean, candels are lit.",s,s,neu,neu
"Uh, belt's to tight, gotta change the belt.",s,s,fea,hap
Did I turn the fish?,q,q,neu,neu
"No, cause I made lasagne.",ans,ans,neu,neu
Am I out of control?,q,q,ang,ang
Just a touch.,ans,ans,neu,neu
"Mon, I don't understand.",s,s,neu,neu
"I mean, you've been dating this guy since like, what... his midterms?",q,q,sur,sur
"I mean, why all the sudden are you so... Oh.",q,q,sur,sur
What?,q,q,sur,neu
Could tonight be the Night?,q,q,hap,hap
I don't know.,ans,ans,neu,neu
Look he's a great guy and I love being with him but... you know.,s,s,hap,hap
"Things happen, and they happen.",s,s,hap,hap
You don't plan these things.,s,s,neu,neu
"So, did you shave your legs?",q,q,neu,neu
Yeah.,ans,ans,neu,neu
Ross!,g,g,hap,ang
"Okay, Raymond, Joey you're up.",oth,oth,neu,neu
Hi!,g,g,hap,hap
"Okay, uh well, let's try one. Whenever you guys are ready.",o,o,neu,neu
Uh-oh.,b,b,fea,fea
Is there a problem?,q,q,neu,neu
"Well this is noodle soup and uh, I've been working with tomato.",ans,ans,neu,neu
"But that's okay, no problem.",ag,ag,neu,neu
No problem.,ag,ag,neu,neu
"Hmm, noodle soup.",ans,oth,neu,neu
"Y'know, that's-that's fine, but the line is, ""Hmm, soup.""",s,s,neu,neu
"Oh, what did I say?",q,q,sur,sur
"Hmm, noodle soup.",ans,ans,neu,neu
How's that different? Oh! Yeah!,q,q,sur,sur
"All right, let's try one.",o,ans,neu,neu
"Hmm, noodle soup.",ans,oth,neu,neu
Okay. Let's do it again.,c,c,neu,neu
Okay.,ag,ag,neu,neu
"Hmm, soup. I mean, noodle soup. I mean soup!",s,s,ang,ang
COME ON!!!!,c,c,ang,ang
Y'know what? We need to move on.,q,q,ang,ang
"No! No! I-I can do it one more time! See? Look! Hmm, noodle soup. Damnit!",ans,ans,ang,ang
Okay. Just give us a second. Ross!,c,c,neu,neu
Yeah?,b,ag,neu,neu
Give her some money.,oth,oth,neu,neu
I really think they're out of rooms.,o,o,neu,neu
"They're not!! Ross, they're just saving them for the important people!! Okay?! What-what if I was the president?!",q,q,ang,ang
"Well then we'd be in a lot of trouble, you don't know where any countries are.",s,ans,fea,neu
Okay.,ag,ag,neu,neu
"Uh, say would you umm  Would you mind checking again to see if any umm, private rooms may have opened up?",q,q,neu,neu
This is a hospital.,ans,ans,neu,neu
Y'know what?,q,q,neu,neu
I'd have to say I really don't care for your tone.,s,s,ang,ang
And this is not the only hospital in this city and we have no problem to Whoa!,s,s,sur,ang
Oh gosh!,oth,oth,sur,sur
What-what?,q,q,sur,sur
Ow! Ow! Contraction. Ow-ow! Ow-ow!,s,s,sur,sur
Would you like to see a semi-private room?,q,q,neu,neu
"Yeah, it couldn't hurt to look.",ans,ans,neu,neu
"I'm just sayin' if dogs do experience jet lag, then, because of the whole um, seven dog years to one human year thing, then, when a dog flies from New York to Los Angeles, he doesn't just lose three hours, he loses like a week and a half.",s,s,neu,neu
That's funny. Who are they?,q,q,hap,hap
"The blond woman is my ex-wife, and the woman touching her is her... close, personal friend.",ans,ans,neu,neu
You mean they're lovers.,q,q,neu,sur
If you wanna put a label on it.,ans,ans,neu,neu
"Wow, uh, anything else I should know?",q,q,sur,sur
"Oh God, Ross, I cannot do this.",dag,dag,sad,sad
"Okay, quick and painful.",oth,oth,neu,neu
"Oh God... Okay. Alright. Alright. Okay. Ross, please don't hate me.",o,ap,fea,fea
"Oh, what? What-what?",q,q,sur,sur
Y'know Marcel?,q,q,neu,neu
...Yeah?,ans,ans,neu,neu
"Well, I kind of... I kind of lost him.",s,s,sad,sad
Hi Pheebs!,g,g,hap,hap
Hi!,g,g,hap,hap
How are ya?,q,q,neu,neu
Good.,ans,ans,neu,neu
"Umm Pheebs, remember when we were in the coffee house we decided that I was going to keep the uh, the cute guy's cell phone?",q,q,neu,neu
Yeah.,ans,ans,neu,neu
And remember how I said I was going to keep it in my purse so that if it rang I could just pick it up?,q,q,neu,neu
Yeah!,ans,ans,hap,hap
And do you remember going into my purse and stealing the phone?!,q,q,ang,ang
"Ooh, now you lost me.",ans,ans,fea,fea
You stole the phone!,q,q,ang,ang
No I didn't!,ans,ans,ang,ang
"No? So you're saying that if I called it, it wouldn't ring?",q,q,ang,ang
"No. Umm, okay. But while you dial, let me show you the features of my new ringing handbag. Oh, it does work!",ans,ans,hap,fea
Phoebe!,g,g,ang,ang
It's not here.,s,s,neu,neu
"Puzzler. A bit of a puzzle. Why don't you um, check the copy room, maybe you left the contracts in there?",q,q,neu,neu
How could I have left them in the copy room?,q,q,neu,neu
I don't know Tag! How can your genitals make phone calls? Okay? It's not a perfect world! Just go please.,ans,ans,ang,ang
Fine.,ag,ag,neu,ang
How ya doin'? Welcome. Good to see ya!,g,g,hap,hap
This will be your phone.,q,s,neu,neu
"That's great. But uh, I'm not really expecting a lot of calls.",s,s,neu,neu
No you answer it and take pledges.,dag,dag,neu,neu
But I'm the host!,s,s,hap,sur
"No, Gary Collins is the host. You'll be answering the phones.",ans,dag,neu,neu
"You don't seem to understand. See, I was Dr. Drake Remoray.",o,o,neu,neu
"Well, here's your phone doctor.",s,s,neu,neu
Hey guys.,g,g,neu,neu
Hey Gunther. Hi. I mean you're going out on a date with the noisy guy upstairs?,g,g,sur,sur
"Well, he's very charming.",o,o,neu,neu
"I know, he's too charming, but if you two start going out, then it's just gonna make it so much harder for me to hate him.",ag,ag,dis,dis
"Well, you're just gonna have to try.",s,s,neu,neu
"Joey, where are the",q,q,neu,neu
"I don't know, Chandler is supposed to be passin'  em around...",ans,ans,neu,neu
"Okay, ten blocks down. Five to go.",s,s,neu,ang
Oh wait! Stop! Stop! Stop!,c,c,sur,hap
Oh I'm sorry! Do you need a break?,ap,ap,sur,sur
My boots in tan! Hey! Can you get a little closer so I can see the price?,q,q,hap,hap
I can see it from right here. It'll cost you one husband.,ans,ans,hap,hap
"Okay, I'm sorry. I think I can walk the rest of the way now. Just-just give me my boots.",ap,ap,sad,sad
Come on more!,c,c,ang,ang
Oh God!,oth,oth,sur,hap
"Yeah, you like that don't you?",q,q,neu,neu
Oh yeah right there!,ans,ans,hap,hap
You want it there? You take it there baby!,q,q,hap,hap
Uh Phoebe?,q,q,neu,sad
"Yeah, say my name. Say it! And now I'm going to cover you back up, and umm we're never doing this again.",ans,ans,hap,hap
Happy?! Is that what I'm supposed to be Vic? Happy?,q,q,ang,ang
"Well, why don't you tell me what you're supposed to be!",q,q,ang,ang
Huh?,b,oth,sur,neu
Because I sure as hell can't figure it out!,s,s,ang,ang
I talk to you and it's nothin'.,s,s,ang,neu
"You look at me, and nothin'.",s,s,neu,neu
Nothing.,ans,s,neu,neu
"You guys make me fly! High! Okay, we're gonna pick it up here, tomorrow.",s,s,hap,hap
"Well, that was ah...",oth,oth,neu,neu
What?! What are you doing?!,q,q,sur,sur
Do you know what just happened?,q,q,ang,ang
Yeah. We-we had sex and then we fell asleep.,ans,ans,neu,neu
No. We were in the middle of sex and,dag,dag,neu,neu
"Nooo! No, that's not true. No, best time ever! Yeah, you rocked my world!",dag,dag,hap,hap
"Don't worry, Chandler, it's not a globe of the United States.",o,o,neu,neu
Hey you guys I'm gonna go out and take a walk.,s,s,neu,neu
"Phoebe, why is your bag moving?",q,q,sur,sur
"Oh, it's not!",ans,ans,neu,neu
"Seriously, it's moving!",s,s,sur,sur
What the hell is in there?,q,q,sur,sur
It's just my knitting that's all! Yes! I knit this. I'm very good.,ans,ans,neu,neu
There will come a time in each of your careers when you'll have a chance to screw over another soap opera actor.,s,s,neu,neu
"I had such an opportunity in the recent, present.",s,s,neu,neu
"And I'm ashamed to say that I took it, I advised a fellow actor to play a role, homosexually.",s,s,sad,sad
"Yeah, we both auditioned for the part, and uh, as it turned out, they ah, they liked the stupid gay thing and cast him.",ans,ag,neu,ang
"And now, he's got a two year contract opposite Susan Luchhi, the first lady of daytime television, and me, me I'm stuck here teaching a bunch of people, most of whom are too ugly to even be on TV.",s,s,sad,sad
"I'm sorry, I'm sorry, I'm sorry.",ap,ap,sad,sad
Thank you.,g,a,neu,neu
Rach?,g,g,sur,sur
I'll be out in a second.,s,s,neu,neu
Oh. It's just so unexpected! I I uh Boy I'll tell you it's just such an honor to be nominated for a,s,s,hap,hap
"Honey, we have to go. Our reservations are at 8:00.",s,s,neu,neu
in Reservations at 8:00 by Neil Simon. Thank-thank you Neil. Thank you for the words.,oth,oth,neu,neu
"Okay honey, you can finish this later we're gonna be late. We gotta go.",o,o,neu,neu
"Please, don't play the music. Just uh one more.",c,c,hap,hap
I can't believe you don't want to know.,s,s,sur,sur
"I mean, I couldn't not know, I mean, if, if the doctor knows, and Carol knows, and Susan knows....",s,s,hap,hap
And Monica knows...,s,s,neu,neu
"Wha, heh, how could you know, I don't even know!",s,s,sur,sur
"Carol called me to thank me for the lasagna, I asked, she told me.",s,s,neu,neu
So what's it gonna be?,q,q,hap,hap
"Wait oh hey huh, oh great now he knows, and I don't know!",dag,dag,ang,ang
"I'm sorry, I'm just excited about being an aunt!",ap,ap,hap,hap
Or an uncle...,oth,oth,neu,neu
Hey Phoebe!,g,g,hap,hap
Hi Pheebs!,g,g,hap,hap
Pheebs!,oth,g,hap,hap
Fine!,ag,a,ang,ang
"Phoebe, what's the matter?",q,q,neu,neu
"Nothing, I'm sorry, I'm just, I'm out of sorts.",ans,ans,sad,sad
"Oh, right, that's me!",ag,ag,sur,sur
"Hey, Chandler, that table place closes at 7, come on.",s,g,neu,neu
Fine.,ag,a,neu,neu
"Phoebe, what is it?",q,q,neu,neu
"All right, you know Paolo?",q,q,neu,neu
"I'm familiar with his work, yes...",ans,ans,neu,neu
"Well, he made a move on me.",s,s,ang,ang
"Whoa, store will be open tomorrow!",oth,oth,sur,sur
"More coffee over here, please!",c,oth,hap,hap
Hey.,g,g,neu,neu
"Hey. What, what are you doing here?",q,q,sur,sur
"Well, I-I thought a lot about what you said, and um, I realilized duh, all right maybe I was a little judgmental.",ans,ans,sad,sad
"Yeah, oh, but oh...",oth,ag,neu,neu
"Look now, Phoebe remember, hey, their just fulfilling their Christmas....",oth,oth,neu,neu
Destiny.,s,s,neu,neu
Sure.,ag,ag,neu,neu
Yes.,ans,ag,neu,neu
All right.,ag,a,neu,neu
Okay. Yikes! That one doesn't look very fulfilled.,s,s,sur,sur
"Oh, that's, that's ah, one of the old ones, he's just taking it to the back.",s,s,neu,neu
"You keep the old ones in the back, that is so ageist.",o,o,ang,ang
Well we have to make room for the fresh ones.,s,s,neu,neu
"So, what happens to the old guys?",q,q,sad,sad
"Well, they go into the chipper.",s,ans,neu,neu
"Why, do I have a feeling that's not as happy as it sounds? No! Nooooo!!!",q,q,sur,fea
Hey! Hey!!,g,oth,hap,sur
Light still out?,q,q,neu,neu
Yeah.,ans,ans,neu,neu
Oh. Maybe they're- napping.,s,s,neu,neu
"Oh please, they're having sex.",s,s,sur,sad
Shut up!,c,c,ang,ang
"So, whaddya think George is like?",q,q,neu,neu
I think he's shy.,ans,ans,neu,neu
Yeah?,b,q,neu,sur
Yeah. I think you have to draw him out. And then- when you do- he's a preppy animal.,o,ans,neu,neu
"Hi! Hi, I'm Ross, you don't know me, but I'm a big, big fan of yours. I mean,",s,s,hap,hap
Aren't you with that girl over there?,q,q,neu,neu
"Well, yeah, kinda.",ans,ans,neu,neu
"Um, but that's okay, see we have an understanding, um, see we each have this list of five famous people, so I'm allowed to sleep with you.",s,s,neu,neu
"No, no, no, it's flattery.",dag,dag,neu,hap
"Oh no, no, no, wait, wait, Isabella.",c,c,sur,hap
"Don't, don't just dismiss this so fast.",oth,oth,fea,fea
I mean this is a once in a lifetime opportunity...,o,o,neu,neu
"Yeah, for you. Is that the list?",q,q,neu,neu
"Um, yeah.",ans,ans,neu,neu
May I see it?,q,q,neu,neu
"Um, no.",ans,ans,sad,fea
Come on!,c,c,ang,hap
"But, okay.",oth,oth,neu,neu
I'm not on the list!,s,s,sur,sur
"Um, see, but that's not the final draft.",s,s,neu,neu
It's laminated!,s,s,ang,ang
"Yeah, um, okay see, you were, you were on the list but my friend, Chandler brought up the very good point that you are international, so I bumped you for Wynona Rider, local.",s,s,neu,neu
Y'know it's ironic...,s,s,neu,neu
...because I have a list of five goofy coffee house guys and yesterday I bumped you for that guy over there.,s,s,neu,neu
We're just gonna be friends.,s,s,neu,neu
Get out of here you lurker! Go on! Get!,s,oth,ang,ang
Hey Pheebs!,g,g,hap,hap
Ohh! You made up!,oth,oth,sur,sur
"Yeah, I couldn't be mad at him for too long.",ag,ag,neu,neu
"Yeah, she couldn't live without the Chan Love.",ag,s,neu,hap
"Ohh, get a room.",c,c,dis,dis
We have one.,s,s,neu,neu
I know. Use it.,s,s,neu,dis
"Oh Mon, listen I have to ask!",oth,oth,sur,sur
"Okay, Joey Tribbiani invited me back to his apartment, now does he do this with a lot of girls?",q,q,neu,neu
"Yeah, a lot. A lot, a lot!",ans,ans,sad,neu
"Ohh! And I'm one of them!! Wow! Oh, I just cannot believe this! I mean, Joey Tribbiani!",s,s,sur,sur
"Well, y'know it's none of my business, but aren't you married?",q,q,neu,neu
Yeah. Oh I just wish we could not be married for a little bit! Y'know I just wish we could be like on a break!,ans,ans,ang,ang
Ross! I think she is trying to make something happen with you to get back at me!,o,o,ang,ang
So that's the only reason she could be here huh?,q,q,neu,neu
It couldn't have anything to do with the fact that-that maybe I'm a good listener and I uh I put on a,ans,ans,neu,neu
"Ross, I am telling you that she is using you to get back at me!",s,s,ang,ang
"I think I can take care of myself, I'll talk to you later.",o,o,neu,neu
Good-bye.,g,g,neu,neu
Whoa!,oth,oth,sur,sur
"Uh, that was your sister actually.",s,s,neu,neu
She-she thinks that you're just using me.,s,s,neu,neu
So?,q,q,neu,neu
I'm sorry.,ap,ap,sad,sad
What are you doing here?!,q,q,sur,sur
"I-I, came to fill your ice cube trays.",s,ans,neu,neu
What?!,q,q,sur,sur
"Umm, okay, okay, look.",oth,oth,neu,neu
I took this picture from your fridge.,s,s,neu,ang
"Okay, because I know that this is my Father.",s,s,ang,ang
"Yeah, this is Frank Buffay and you are standing right there next to him.",ans,s,neu,ang
"Now, look I deserve to know where I came from.",s,s,sad,ang
All right?,oth,oth,neu,ang
So if you can help me find my Father then you should!,s,s,ang,ang
"Otherwise, you're just mean!",o,o,ang,ang
"So, just tell me the truth!",oth,oth,ang,ang
"All right, the man in the picture is Chuck Magioni.",s,s,neu,neu
My Father is Chuck Magioni?,q,q,sur,sur
"No, no, that's just Chuck Magioni, I-I sold him a house last year!",ans,ans,neu,neu
"And I'm very sorry, but I don't know where your Father is, and that's the truth.",ap,ap,sad,sad
Oh.,b,b,neu,sad
"But umm, you're right.",ag,ag,neu,neu
I think that a person should know where they come from.,s,s,neu,neu
"Wh-which is why I ah, ahh, okay.",oth,oth,neu,neu
I'm your mother.,s,s,neu,neu
Heh?,oth,oth,sur,sur
"Y'know I wanted to tell you yesterday, but I just, I kinda felt all floopy, and...",s,s,sad,sad
What's happening to your accent?,q,q,sur,sur
Come again?,c,c,sur,sur
What's-what's this nonsense?,q,q,fea,fea
"All right, I'm-I'm not English.",s,s,sad,sad
I'm from Long Island.,s,s,neu,neu
"I was really nervous and the accent just uh, just came out.",s,s,sad,sad
I'm sorry.,ap,ap,sad,sad
"So, if we could just get back to the lecture.",s,s,neu,neu
"Umm, were there any questions?",q,q,neu,neu
About paleontology.,q,q,neu,neu
"All right, look I was just trying to make a good first impression.",s,s,ang,ang
"Obviously, I screwed up.",s,s,sad,sad
But what you guys think of me is really important because I'm-I'm hoping to get a permanent job here.,o,o,neu,neu
So if you just give me another chance to make a good impression,s,s,neu,neu
Ross!! Are you crazy?! I am,q,q,ang,ang
"Well, hello Rachel!",g,g,sur,sur
"Where you going, Joe?",q,q,neu,neu
For a walk.,s,ans,neu,neu
Oh. You mind if I join you?,q,q,neu,neu
"Actually, that will be long. You know, I really need to organize my thoughts.",s,ans,neu,neu
Your thoughts? Plural?,q,q,sur,sur
"Allright, fine, I only have one thought! It's about the hot nanny, I gotta see her!",ans,ans,hap,hap
"I'm afraid I can't let you do that, Joe.",s,s,neu,neu
Now YOU'RE telling me I can't see her??,q,q,ang,ang
You guys are killing me!,s,s,hap,sad
She's forbidden fruit!,o,s,dis,sad
"It's like ... like she's the princess and I'm the stable boy ... Why are you doing this, huh?",q,q,sad,sad
Did Ross tell you not to let me go over there?,q,q,neu,neu
"Yes, as a matter of fact he did, so I can't let you go.",ag,ans,ang,neu
Huh. Interesting. Now there are obstacles. Hot nanny and me against the world. This is the kind of stuff great novels are made of.,s,s,ang,ang
Great novels?,q,q,sur,sur
Fine ... mediocre porn,ans,ans,neu,neu
"Okay, I think we can get the evaluation back before they see it, but we're gonna have to get into Mr. Zelner's office.",o,o,neu,neu
"Now, he doesn't get in until 10, so he's no problem, but his assistant, Betty, she comes in early to eat her breakfast at her desk.",s,s,neu,neu
That's kinda sad.,s,s,sad,sad
"Yeah, well Betty is kinda sad. Which is why I believe I can lure her away with these chocolates. Now, while I distract her,",ag,ag,neu,neu
Got it!,oth,oth,hap,hap
Let's roll!,c,c,hap,hap
"Hello Rachel, you uh, got a minute?",q,q,neu,neu
"Yeah, sure Mr. Zelner, for you anything minute. Okay. Fine. Abort the plan, abort the plan.",ans,ans,neu,neu
"Uh actually, I'd like to speak with both of you.",s,s,neu,neu
"Okay. Uh, well can we, can we get you anything Mr. Zelner? Maybe some chocolates?",q,ag,neu,neu
"Cassie, are you finding everything okay in there?",q,q,neu,neu
Yeah! Thank you so much for letting me stay here.,ans,ans,hap,neu
Oh! No problem! I,oth,oth,hap,hap
What?,q,q,sur,sur
You are iron.,s,s,neu,neu
You are steel!,s,s,hap,hap
"Let me ask you something, how come when I call your computer support line, I have to wait an hour and a half?",q,q,ang,ang
"I told you, we're adding new operators all the time. Could we concentrate on my training?",ans,ans,neu,neu
"I mean why, of all people would you want to go out with Chip?!",q,q,ang,sur
"Look, you and I went to different high schools...",ans,ans,neu,neu
"Okay, that doesn't help me, because we went to the same high school.",o,o,neu,neu
"You went to one where you were popular, and you got to ride off Chip's motorcycle, and wear his letterman jacket.",s,s,neu,neu
I went to one where I wore a band uniform they had to have specially made.,s,s,sad,sad
They had to have that specially made?!,o,o,sur,sur
It was a project for one of the Home Ec classes.,s,s,neu,neu
"Oh my God, they told us that was for the mascot!",s,s,sur,sur
"Back then, I thought that I would never, ever get the chance to go out with a Chip Matthews, and now he's-he's called me up and asked me out.",o,o,sur,sur
And the fat girl inside of me really wants to go.,s,s,sad,hap
I-I owe her this.,s,s,neu,neu
I never let her eat.,s,s,neu,neu
"Oh, you go out with him.",s,s,neu,neu
"Oh, really?!",q,q,sur,sur
"Yeah. Just, if it's possible, could you leave him somewhere and go have sex with another guy?",q,ans,neu,neu
I'll try.,s,s,neu,neu
"Hey! Tall guy! Hey, listen, I wanted to talk to you about that girl that you're dancing with.",g,g,neu,neu
"Yeah, yeah, okay.",ag,ag,neu,neu
"Uh, look buddy, I came with that girl, and I had this plan to kiss her at the new years countdown   I'm trying to win her over, so I was wondering if..",s,s,hap,hap
"Oh come on man, you can dance with my partner, she's real, uh, mellow!",s,s,ang,ang
"Well, I was hoping after tonight that maybe I could you know",s,s,neu,neu
"Ross, get over it! It's not like she hates you.",c,oth,ang,ang
Yeah but,ans,oth,sad,sad
"Ross, she's not weird, she just wants her stuff to be one of a kind.",o,o,neu,neu
Huh. Y'know what's not one of a kind? A twin!,q,q,ang,ang
"Ooh, Phoebe's here! Okay, let's turn out all the lights and we'll just watch the movie!",s,s,hap,hap
"Okay. Hey Ooh, cool sheets!",ag,ag,hap,hap
