text,DA_prediction,DA,emo_prediction,emotion
Then we have to await the data from recent MRI scans and DNA testing which call into question information gathered from years of simple carbon dating.,s,s,neu,neu
"Look at that woman sitting by the pool getting tan... so leathery and wrinkled, I'm so",o,o,sad,sad
I'm not your brother.,s,dag,ang,neu
What about my children Drake?! Huh!? No!! No!! No! God!,q,q,ang,ang
Why dont we try massaging the breast to stimulate the flow.,o,o,neu,neu
Are you kidding me?!,q,q,ang,ang
Its just so frustrating! Why doesnt she want my breast?!,q,q,ang,ang
I dont know! Maybe shes crazy!,ans,ans,ang,ang
"Hey Joey, I got some beer for you.",s,s,neu,neu
"Uh, don't you mean ""for whom?""",s,s,neu,neu
"Sure, listen I was gonna order some pizza, you wanna share one?",q,q,neu,neu
"Pizza, heh, its not like I never had that before...ba dum bum cheshhh.",s,ans,hap,neu
Is there something wrong?,q,q,neu,neu
"All right, All right, let's just get this out in the open okay?",ag,ans,neu,neu
You're hot.,o,o,neu,neu
I'm lovable.,s,s,neu,neu
Clearly there's a vibe going on between us.,o,o,neu,neu
"But, we're roommates and it's a huge mistake for us to continue down this road.",o,o,neu,neu
Joey...,g,s,neu,neu
"Oh no it's not, no it's not. It's a first date. I'm",o,o,fea,fea
"Ho-oh, he's gonna get some!",s,s,hap,hap
Of the glare from the streetlight out of his apartment.,s,s,neu,neu
"Y'know so umm, he's closed the drapes there so he can have a nice, pleasant conversation with your little sister.",o,o,neu,neu
"Well, I'm off to bed!",s,s,neu,neu
You were so funny with that waiter! You're such a nut!,o,o,hap,hap
"Y'know, breadstick fangs are always funny.",o,a,hap,hap
"No, you make them funny. You're the funny one!",o,o,hap,hap
"Uhh, look Katie, uh listen, we-we need to talk.",s,s,fea,fea
Okay?,q,ag,neu,neu
"Umm, look I like you.",o,o,fea,fea
"I-I really do, I like you a lot.",s,a,neu,fea
Okay?,q,ag,neu,ang
"But sometimes when you, when you playfully punch me like that it-it feels like someone's hitting me with a very tiny but very",o,o,hap,hap
"Aww, like I could hurt you. Are you making fun of my size? Don't make fun of me because of my size!",dag,dag,sur,sur
"Oh, Joey! Sorry!",ap,ap,sur,sur
They made you head of the department!,s,s,hap,hap
"No, I get to teach one of his advanced classes! Why didn't I get head of the department?",q,q,hap,hap
"Oh! Hey Rach, listen umm",g,g,neu,neu
Yeah.,ans,b,neu,neu
"I got a big date coming up, do you know a good restaurant?",q,q,neu,neu
"Uh, Paul's Caf. They got great food and it's really romantic.",ans,ans,neu,neu
"Ooh, great! Thanks!",a,g,hap,hap
"Yeah! Oh, and then afterwards you can take her to the",o,o,neu,neu
"You sure are naming a lot of ways to postpone sex, I'll tell ya",s,s,hap,neu
"Ooh, I miss dating.",s,s,sad,sad
Gettin' all dressed up and going to a fancy restaurant.,s,s,neu,neu
"I'm not gonna be able to do that for so long, and it's so much fun!",s,s,hap,hap
I mean not that sitting at home worrying about giving birth to a sixteen pound baby is not fun.,o,o,neu,neu
"Hey, y'know what?",q,q,neu,neu
Huh?,b,b,sur,neu
Why don't I take you out?,q,q,neu,neu
"What?! Joey, you don't want to go on a date with a pregnant lady.",s,ans,sur,sur
Yes I do!,dag,dag,hap,hap
"And we're gonna go out, we're gonna have a good time, and take your mind off of childbirth and c-sections and-and giant baby heads stretching out",o,o,hap,hap
Okay! I'll go with ya! I'll go! I'll go with ya.,ag,ag,hap,hap
I'll be fun.,o,o,neu,neu
All right?,oth,ag,neu,neu
Hi!,g,g,hap,hap
Hey!,g,g,hap,hap
"Joey, I gotta tell ya, I've been thinking",s,s,neu,neu
"Oh, you know, the writing was good, and the director is good, and... and my co-star's good",o,o,hap,hap
"God, you have to tell me what happens tomorrow!",s,s,hap,hap
"Ow, I'm just going over the script now! You wanna read lines with me?",q,q,sur,sur
"Me? Oh, no, I am not an actress.",ans,ans,dis,dis
"Oh, all right, I can ask Monica.",ag,a,neu,neu
"Oh screw her, that part is mine!",s,s,ang,ang
"Right... ok, so just from the top of the page, right here.",s,s,neu,neu
"Okay. . Hello Drake, I'm surprised to see you here.",s,s,sur,sur
I can't believe you married him.,s,s,sur,sur
But what choice did I have. He was keeping my sister in a,s,s,ang,ang
So what about us? Everything we feel for each other.,q,q,sad,sad
It's over! You,s,ans,ang,hap
How can I?,q,q,sur,sur
"Knowing I'll never hold you in my arms again, or touch your skin, or feel your lips, knowing I'll never make love to you?",q,ans,sad,sad
How can I accept that...,o,o,sad,sad
I can never kiss you again when it's all I can do not to kiss you right now.,o,o,hap,sad
Kiss me.,oth,s,hap,hap
What?,q,q,sur,sur
"Come on, you know, Thanksgiving. Ooh, you got the bigger half. What'd you wish for?",q,q,hap,hap
The bigger half.,s,ans,neu,neu
I'd like to propose a toast.,o,o,hap,hap
"Little toast here, ding ding.",s,s,hap,hap
"I know this isn't the kind of Thanksgiving that all of you all planned, but for me, this has been really great, you know, I think because it didn't involve divorce or projectile vomiting.",o,o,hap,hap
"Anyway, I was just thinking, I mean, if you'd gone to Vail, and if you guys'd been with your family, if you didn't have syphilis and stuff, we wouldn't be all together, you know?",o,o,sad,ang
So I guess what I'm trying to say is that I'm very thankful that all of your Thanksgivings sucked.,s,s,hap,hap
That's so sweet.,o,s,hap,hap
"And hey, here's to a lousy Christmas.",s,s,sad,hap
And a crappy New Year.,s,s,sad,hap
"Here, here!",oth,b,hap,hap
"Now, hold on!",c,c,ang,ang
Hold on!,c,c,ang,ang
"Look, look, your daughter and I are supposed to leave tonight for our honeymoon, now-now you-you tell her that I'm gonna be at that airport and I hope that she'll be there too!",s,s,ang,ang
"Oh yeah, I said Rachel's name, but it didn't mean anything, Okay?",dag,dag,ang,ang
She's-she's just a friend and that's all!,o,a,ang,ang
That's all!,s,s,sad,sad
Now just tell Emily that I love her and that I can't imagine spending my life with anyone else.,s,o,neu,ang
"Please, promise me that you'll tell her that.",s,s,sad,sad
"All right, I'll tell her. Come on bugger face!",ag,ag,ang,ang
Call me.,c,c,neu,neu
"You spend half your life in the bathroom, why don't you ever go out the bloody window!",o,o,ang,ang
What happened?!!,q,q,sur,sur
"Well, I don't know!!",ans,ans,sur,sur
We fell asleep! That is all.,s,s,neu,neu
"Yeah. Yep. Yeah. All right, well uh, I'd better go.",ag,s,neu,neu
I think that would be best.,ag,ag,neu,neu
"Yeah. All right, I'll talk to you later.",s,s,neu,neu
Okay. But not about this!,s,s,ang,ang
No! Never! Never! Bye.,s,ag,ang,ang
No touch! No touch!,s,s,neu,neu
"Umm maam, do you have a minute? I kind of have some bad news. I dont think I can move to Tulsa.",s,s,sad,sad
What?,q,q,sur,sur
"Its a funny story, actually.",ans,ans,neu,neu
"I kind of fell asleep in the meeting this morning so when I said Id move to Tulsa, I didnt really know what I was saying.",s,s,neu,neu
You fell asleep?,q,q,sur,sur
"But only because I was up all night worried about this meeting, aint that funny?",ans,ans,fea,fea
Irony?,q,oth,sur,sur
"Not a fan, alright .",ans,s,sad,neu
"See, heres the thing.",s,s,neu,neu
I went home and told my wife about Tulsa and she wont go.,s,s,neu,neu
"See, me, I love Tulsa!",o,o,hap,hap
Tulsa is heaven!,o,o,hap,hap
Tulsa is ItalyPlease dont make me go there!,s,s,hap,fea
"Chandler, I ",s,oth,neu,hap
No no no!,dag,dag,fea,fea
"Look, Carol, can I call you Carol?",q,q,neu,neu
Wh-why would I when your name is Elaine?,s,s,hap,hap
"Oh what a great picture of your son, strapping!",o,o,hap,hap
"Thats a picture of your daughter, isnt it, well shes lovely.",s,s,hap,hap
I like a girl with a strong jaw.,o,o,sad,sad
Ill call you from Tulsa.,s,s,neu,neu
Hi.,g,g,neu,neu
Hey.,g,g,neu,neu
How are you?,q,q,neu,neu
"I'm not too bad. Fortunately, blue's my colour. How-how did you know I was here?",q,q,neu,neu
Because... I'm Monica Geller. It was my credit card you were using.,ans,ans,neu,neu
That I was not expecting.,s,s,neu,sur
"I want you to know, it wasn't me who turned you in.",o,o,neu,neu
Oh. Thanks.,g,g,neu,neu
"No, thank you! You have given me so much! I mean, if it wasn't for you, I would never have gotten to sing",o,o,hap,hap
"Well, actually, you only got to sing 'Memo-'.",s,s,neu,neu
I just can't believe you're in here.,s,s,sur,sur
"I mean, what am I gonna do without you?",q,q,sad,sad
Who's gonna crash the embassy parties with me?,q,q,sad,sad
Who's gonna take me to the,q,q,neu,sad
"Uh... Oh, Mindy, you are so stupid. Oh, we are both so stupid.",o,o,dis,dis
What do you mean?,q,q,neu,neu
Smell familiar?,s,s,neu,neu
Oh no.,ans,s,fea,fea
"Oh, I am so sorry.",ap,ap,sad,sad
"No me, I am so sorry...",ap,ap,sad,sad
Oh my.,oth,oth,sur,sur
"Well, there's no way I'm gonna get a shot.",s,s,fea,fea
"Maybe they can take the needle and thquirt it into my mouth, you know, like a thquirt gun.",o,o,neu,fea
"Doctor, can I see you for just a minute please? My brother has a slight phobia about needles.",s,s,neu,neu
Did you tell him about my thquirt gun idea?,q,q,neu,neu
"My brother, the PhD would like to know if there's any way to treat this orally.",s,s,neu,neu
"No, under these circumstances it has to be an injection, and it has to be now.",dag,dag,neu,neu
Tho?,oth,oth,neu,neu
Ohhh.,oth,s,fea,fea
"That's good, have a seat.",s,s,neu,neu
"Um, the doctor says it's gotta be a needle.",s,s,neu,neu
"You're just gonna have to be brave, ok?",o,o,neu,neu
Can you do that for me?,q,q,neu,neu
Ok.,ag,ans,neu,neu
Ok. Oh boy. You are doin' so good. You wanna squeeze my hand?,o,o,neu,neu
Yes!,ag,ag,hap,fea
"All right, Ross, don't squeeze it so hard.",s,c,ang,neu
"Honey, really, don't squeeze it so hard!",s,s,ang,ang
Let go of my hand!,c,c,ang,ang
You're gonna love me so much. I got Sting tickets!!,o,o,hap,hap
Oh my God! I do love you! How did you do it?!,q,q,hap,hap
Well let's just say,s,s,neu,neu
"Oo, where are the seats?",q,q,neu,hap
"Uh, middle balcony.",ans,ans,neu,neu
You're a mean old woman.,o,o,ang,ang
No! Wait no! Shut up I mean don't cry! Let me get my checkbook!,s,s,sad,sad
"Look honey, you don't have to do this, okay?",c,c,sur,sur
It's the strength you have inside that means the most to me.,o,o,hap,hap
"You're loyal, you're honest, and you have integrity!",o,o,hap,hap
That's the kind of strength that I want in the man that I love!,o,o,hap,hap
That means nothing to me. Come on!,o,o,ang,ang
"Oh! Hey, Mr. Treeger.",g,g,neu,fea
: What are you doing?,q,q,neu,neu
Ummm. Oh! I'm sorry. It's a little old but,ap,ap,hap,hap
: No! You're clogging up the chute that I spent a half-hour unclogging!,dag,dag,ang,ang
I'm sorry. I didn't I don't come in here a lot.,ap,ap,sad,sad
": Oh yeah, of course you don't!",ans,ag,sur,ang
":  Cause you're a little princess! ""Daddy, buy me a pizza. Daddy, buy me a candy factory. Daddy, make the cast of",o,o,dis,dis
": You think you could make a mess and the big man in coveralls will come in here and clean it up, huh?",s,s,ang,ang
"Well, why don't think of someone else for a change?",q,q,ang,ang
"Okay, I'm sorry.",ap,ap,sad,sad
Hello!,g,g,hap,hap
What's this?,q,q,neu,neu
Oh right its that girl's phone number.,ans,ans,neu,neu
"Yeah-yeah, there it is, just a phone number a really hot girl gave me.",s,s,hap,hap
"It's no big deal, I mean it is her home phone number, but... Whoa!",o,o,sur,sur
"Whoa-whoops, I almost lost this baby!",s,s,sur,hap
"Yeah, the lovely Amanda gives me her number and I-I go and drop it.",s,s,ang,ang
Thank you.,g,g,neu,neu
I don't know how any of these got opened?!,q,q,sur,sur
You opened them all?,q,q,sur,sur
"I know! I know! I am a terrible person! I mean, Chandler is never going to trust me with anything ever again!",o,o,hap,hap
Oh hey! You got my parent's gift!,s,s,hap,hap
Yeah. What is that?,q,q,neu,neu
"Well, I don't know. I think it does something to salami.",ans,ans,sad,sad
Hey! How'd it go?,q,q,sad,sad
Yeah. What-what did Tag say?,q,q,neu,neu
Tag is not the father! And Joey knows now?,q,ans,ang,sad
"I do Rach. I do, and I so happy for you.",s,ag,hap,hap
"Oh wow, you didn't even try to unhook my bra!",s,s,sur,sur
So are you ever gonna tell whoever it is?,q,q,neu,neu
"No, I will. I'm just not up for it tonight.",ans,ans,neu,neu
"Hey Rach listen, no matter what this guy says I want you to know you're not gonna be alone in this.",s,s,hap,hap
I'm not?,ans,ag,sur,sur
Listen I uh  It's a scary world out there especially if you're a single mom.,o,o,sad,fea
"Y'know, I always felt like you and I have this-this special bond.",o,o,neu,neu
"So, Rachel Green will you marry me?",q,q,hap,hap
Thank you.,g,ans,neu,neu
If I can't have it you can't have it!,o,o,ang,ang
"I can't believe her, y'know it's just it's so typical.",s,s,dis,dis
"Now Monica, I know you're upset, but don't forget.",s,s,neu,neu
"There is going to be a wedding, you are going to throw the bouquet, and",s,s,neu,neu
Paris?,oth,oth,neu,neu
We will take a moonlit walk on the Rue de la .,s,o,neu,neu
Keep talking.,c,b,neu,neu
"Then we will sprinkle rose pedals on the bed and make love. Not just because it's romantic, but because I can!",o,o,hap,hap
I love you!,s,o,hap,hap
Yes!,ag,s,hap,hap
I win again!,s,s,hap,hap
Ha-ha!,oth,oth,hap,hap
That's like 500 bucks you owe me!,s,s,hap,hap
Whoo-ho-hoo!,oth,oth,hap,hap
$500 that is a loooot of electricity!,o,o,hap,hap
Whoo-ho-ho!,oth,oth,hap,hap
I gotta buy some food.,s,s,sad,neu
"Okay, give me a chance to win my money back. Okay? Sudden death, one goal, $1,000.",s,s,neu,neu
You serious?,q,q,sur,sur
Oh yes!,ans,ans,ang,ang
"Okay, get ready to owe me!",s,s,hap,hap
Okay.,ag,ag,neu,neu
"Okay, here we go. Ready?",q,q,neu,neu
No! No! No! No  one can beat me.,dag,dag,ang,ang
"See? Now, that's why only the little fake men are supposed to do all the kicking.",o,o,dis,fea
Who is that?!,q,q,sur,sur
"Don't worry, I'm brave!",o,o,sad,sad
I am brave!,o,o,fea,fea
I I am brave!,o,o,fea,fea
No-no-no-no!!,dag,oth,fea,fea
Can you tell me who is there please?,q,q,neu,neu
Hi!,g,g,hap,hap
Hi. Do you know what time it is?,q,q,neu,neu
It's candy time! My roommate says that they taste like little drops of heaven.,s,ans,hap,hap
Oh please! Did you hear that? Little drops of heaven.,s,s,hap,hap
4:00 A.M.,s,s,neu,neu
"So, can I get some candy?",q,q,hap,neu
"I am sorry, but some of us have to",ag,ans,sad,neu
"Umm, listen I am sorry, but I'll put some out first thing in the morning.",ap,ap,sad,sad
"Well okay, I'll swing by later. Do you live in this building?",q,q,neu,neu
Um-hmm.,b,ans,neu,neu
Mm! Seems like I would've remembered you!,s,s,sur,sur
Mm! Night Gar'!,oth,g,hap,neu
Aaron! You gotta let me go. The guy's hammered!,s,s,hap,hap
"I'm sorry Joey, as long as he's here and he's conscious we're still shooting.",ap,dag,neu,neu
You wouldn't happen to have a very big fork?,o,o,neu,neu
"So I uh, I just talked to the director. That's it, we're done for the day.",s,s,neu,neu
Well have we finished the scene?,q,q,sur,sur
Yeah! You you were wonderful.,ans,ans,hap,hap
As were you.,o,o,neu,neu
"So I got your car, it's right outside.",s,s,neu,neu
"Oh, thank you. You're welcome.",g,g,neu,hap
No-no-no! We gotta go! Come on! Here we go.,dag,o,fea,fea
Is that my ass?,q,q,hap,hap
What about these? These look the same?,q,q,neu,neu
Definitely!,ag,ans,hap,hap
Not as each other!,s,o,sur,neu
"Oh, then no.",ag,ag,neu,neu
Hey!,g,g,hap,hap
Hi!,g,g,hap,ang
You look amazing. I'm the luckiest man in the world.,o,o,hap,hap
"Ohh, you're about to get a little luckier.",s,s,hap,hap
Let me see the earrings.,s,s,neu,neu
"Oh, honey, the earrings",s,s,neu,neu
They look great! Does your boyfriend have the best taste or what?,q,q,hap,hap
My boyfriend really does have good taste!,ans,ans,hap,hap
Thanks for picking out the earrings man.,s,s,neu,neu
Mm-Hm,oth,oth,neu,neu
"I know that there's no hole there, I just really liked that picture.",s,o,hap,neu
Oh my God! Look at this!,s,s,sur,sur
"Okay, but there",s,s,neu,neu
I don't care! The wires have come loose in your head!,s,s,ang,ang
I just thought that if I could follow the wire I could find out what it did.,o,o,neu,neu
And did you?!,q,q,sad,sad
"No. It disappears back there behind that baseboard. For a minute there, I thought it went downstairs.",ans,ans,neu,neu
But it didn't. Say hello to Mrs. Chatracus.,s,s,neu,neu
Oh my God.,oth,oth,sur,sur
Hello darling.,g,g,neu,neu
"Hello, Mrs. Chatracus.",g,g,neu,neu
"Okay, is everybody clear? We're gonna pick it up and move it. Now all we need is teamwork, okay? We're gonna",s,s,neu,neu
"Ross, I really don't think",dag,dag,neu,neu
Lift!! And slide!,s,s,hap,hap
"Okay, here we go.",s,s,neu,neu
"All right everyone, lift! And slide!!",c,c,hap,hap
"All right Carl, we're next. Now remember, what is not gonna be?",s,s,neu,neu
Another,oth,oth,neu,neu
That's right! And what are you not gonna do?,q,q,neu,neu
"Well, I'm not gonna talk because",ans,ans,neu,neu
"I mean, I realize that his feelings may never completely go away, but",o,o,sad,sad
"Oh?my Gawd, I-I understand.",ag,ag,sad,sad
"I-I am so sorry, I'll go.",ap,ap,sad,sad
"Good-bye Monica , I wish you a lifetime of happiness with him.",g,g,sad,sad
"Chandler, you call me when this goes in the pooper.",s,c,neu,neu
I found my identical hand twin!,s,s,hap,hap
"Ohh, you are",s,s,neu,neu
No!,ans,dag,ang,neu
But she just came up here!,s,s,ang,sur
That was Joey!,s,s,sur,neu
I wonder where she is. That is so weird.,s,s,neu,neu
"Yeah, well, she's probably talking to Richard.",s,s,neu,neu
Would you stop that!,s,s,ang,ang
Do you wanna know the first thing she said when she came back from her lunch with Richard?,q,q,neu,neu
She didn't feel anything for him.,ans,ans,neu,neu
She loves you!,o,o,ang,sad
Really?,q,b,sur,sur
"Yes! Now, she feels terrible! She really wants to make up! You gotta find her.",o,s,ang,ang
Okay.,ag,ag,neu,neu
Good. I should really start wearing hats!,s,s,neu,neu
"I mean, why should I let them meet him?",q,q,neu,neu
"I mean, I bring a guy home, and within five minutes they're all over him.",s,s,neu,dis
"I mean, they're like- coyotes, picking off the weak members of the herd.",o,o,hap,hap
Listen.,c,c,neu,neu
"As someone who's seen more than her fair share of bad beef, I'll tell you: that is not such a terrible thing.",o,o,neu,neu
"I mean, they're your friends, they're just looking out after you.",o,s,neu,neu
"I know. I just wish that once, I'd bring a guy home that they actually liked.",o,o,sad,sad
"Well, you do realise the odds of that happening are a little slimmer if they never get to meet the guy..",o,o,neu,neu
No-no-no-no. Hey!,g,g,sur,sur
"Anyway, I should go. Okay, bye.",g,g,neu,neu
Hey sweetie.,g,g,neu,neu
"Hi sweetie. So, what was with all the whispering?",q,q,sad,neu
I can't tell you. It's a secret.,ans,ans,neu,neu
Secret? Married people aren't supposed to have secrets between one another. We have too much love and respect for one another.,o,o,ang,ang
Awww. But still no.,dag,dag,neu,neu
"No I'm serious, we should tell each other",o,o,neu,neu
"Really? Okay, so why don't you tell me what happened to Ross Junior year at",o,o,neu,neu
"Oh no-no, I can't do that.",dag,dag,fea,fea
"If you tell me, I'll tell you what Phoebe said.",s,s,neu,neu
Okay.,ag,ag,neu,neu
Okay.,ag,ag,neu,neu
"So, Ross and I are going to",s,s,neu,neu
Oh my God. He threw up?,q,q,dis,dis
"No, he visited a little town south of throw up. So what was Phoebe's secret?",q,q,neu,neu
"Oh, Nancy Thompson from Phoebe's old massage place is getting fired.",ans,ans,neu,neu
That's it?! I gave up my,s,s,ang,hap
That's right! You lose sucker!! Please still marry me.,o,o,hap,hap
Oh hey! How was your audition?,q,q,hap,hap
"I'm sorry, do I know you?",q,q,neu,neu
What are you doing?,q,q,neu,neu
"Nothing, I'm just practicing blowing you off because I'm gonna be a big movie star!",ans,ans,hap,sur
Oh! You got it?!,q,q,sur,sad
"Well no, not yet. But the audition went really good.",ans,ans,hap,hap
What was it for?,q,q,neu,neu
"Oh, it's this big budget period movie about these three Italian brothers who come to America around the turn of the century.",s,ans,neu,neu
It's really classy!,o,o,ang,hap
"Oh, and the director is supposed to be the next next Martin Scorcese.",s,s,hap,hap
The next next?,q,q,neu,neu
"Yeah, there's this guy from Chicago who's supposed to be the next Martin Scorcese, all right?",ans,ans,neu,neu
But then this guy's right after him.,s,s,neu,neu
Hello!,g,g,hap,hap
They loved me!,s,s,hap,hap
Oh my God!,oth,s,sur,hap
"Are you kidding me? I never rent a movie without it! Oh. Uh, okay uh let me call you back.",s,s,sur,sur
What's the matter?,q,q,neu,neu
They want me to be totally naked in the movie!,ans,ans,sur,sur
Wow!,b,b,sur,sur
I know! My grandmother's gonna see this!,s,s,hap,hap
Grandma's gonna have to get in line.,s,s,hap,hap
Oh please! It was such a big class! You never even noticed me!,o,o,hap,hap
"What? Of course I did! You uh, you sat next to Sleepy Sleeperson.",dag,dag,sur,sur
Who?,q,q,neu,neu
"Oh uh, I had trouble remembering everyone's name, so I-I kinda came up with nicknames.",ans,ans,neu,neu
Like the guy on the other side of you was Smelly von Brownshirt.,s,s,dis,neu
"Oh yeah. So umm, did you have a nickname for me?",q,q,neu,neu
"Umm, no. No.",ans,ans,neu,neu
Yes you did! What was it?,q,q,hap,sur
"Umm, it's Cutie McPretty.",ans,ans,neu,neu
Ohh that's so sweet!,o,s,hap,hap
"Listen, I gotta tell ya, I-I'm having a great time!",s,s,hap,hap
"Y'know how before you said it might be weird, the whole student teacher thing, and to be frank I thought it would be too, but it's not.",o,o,sur,sur
I mean it's not at all.,o,o,neu,neu
Dr. Geller!,g,g,hap,hap
Burt!,g,g,hap,hap
"Okay, so we got some more good rejections, lots of stuff to work on.",s,s,neu,neu
"Okay, shoot.",ag,ag,neu,neu
"Okay, um, oh, the zoo commercial.",s,s,neu,neu
I didn't get it?,q,q,sur,neu
"No. They said you 'Weren't believable as a human being.' So, you can work on that.",ans,ans,neu,hap
"Okay, what else?",q,q,neu,neu
"Um, the off-Broadway play people said 'You were pretty but dumb.'",ans,ans,neu,neu
Oh.,b,b,neu,sad
"Oh no wait, I'm sorry, that's 'pretty dumb.'",o,o,neu,neu
Hey.,g,g,neu,neu
How's the maniac?,q,q,neu,neu
"Oh, well he's yummy. We did a little kissin'.",ans,ans,hap,hap
"Phoebe, what are you doing?",q,q,neu,sur
"Oh, no, no, no, no. You know what, he's not into that stuff anymore. He quit for me.",ans,ans,neu,neu
"Pheebs, this guy has been obsessed with your sister, for God knows how long, okay, you don't just give up something like that.",o,o,dis,dis
"Look, he gave me his night vision goggles and everything.",s,s,hap,hap
You're taking the word of a guy who has night vision goggles?,s,s,sur,sur
"What, he's not still following her. Do you think he is still following her?",q,q,sur,sur
"Pheebs, wake up and smell the restraining order.",s,s,neu,dis
What are you saying I should do?,q,q,fea,neu
"I think, that if you really like this guy, you should just trust him.",ans,ans,neu,neu
"Thank you, Monica.",g,g,neu,hap
"Orrr, you could follow him and see where he goes.",o,o,neu,neu
"Oh, that's what I would do, forget mine.",s,ag,neu,sur
Hey guys check it out! My mom sent me the paper!,s,s,hap,hap
"Ooh, let's see it!",s,s,hap,hap
She's not crazy is she?,q,q,sur,sur
No.,ans,ans,neu,neu
"So uh, how you doin'?",q,q,neu,neu
There he is!,s,s,hap,hap
There's our star!,s,s,hap,hap
"So, so, what'd ya think?",q,q,neu,neu
Almost as good as that play with the two naked girls on the see-saw.,s,ans,neu,hap
I-I wasn't in that.,dag,dag,sad,sad
"Wow, I have the spirit of an old Indian women living in mine.",s,s,neu,neu
So then you know?,q,q,hap,hap
"The mailman was downstairs, so I brought up your mail.",s,s,neu,neu
"Oh, good. Thanks.",g,g,neu,neu
Now what is Fabutec?,q,q,neu,neu
"Okay, all right don't judge me to much.",s,s,fea,fea
Okay?,q,s,neu,neu
"Um, but I saw this info-mercial, and um, I swear to you I have never-ever bought anything on TV before, except for this mop.",s,s,neu,neu
"But there was this stuff on leg waxing, it just, it looked so amazing....",s,s,hap,hap
"Oh, it's incredible! I so want to be a Waxine girl.",o,o,hap,hap
I know!!,ag,ag,sur,hap
God. Do think it really doesn't hurt?  Cause how can they do that?,q,q,hap,fea
Hello! Organic substances recently discovered in the depths of the rain forest!,ans,ans,hap,hap
They have the best stuff in there.,o,o,neu,neu
"Comin' through. Move, move.",s,s,ang,ang
"Oh, 'scuse me. I was kinda using that machine.",s,s,hap,hap
"Yeah, well, now you're kinda not.",s,dag,neu,dis
But I saved it. I put my basket on top.,s,s,neu,ang
"Oh, I'm sorry, is that your basket? It's really pretty. Unfortunately, I don't see suds.",dag,dag,ang,ang
What?,q,q,sur,sur
"No suds, no save. Ok?",ans,ans,ang,ang
What's goin' on?,q,q,neu,neu
"Hi, uh, nothing. That horrible woman just took my machine.",ans,ans,dis,dis
Was your basket on top?,q,q,neu,neu
"Yeah, but, there were no suds.",ans,ans,neu,neu
So?,q,s,neu,neu
"Well, you know, no suds, no save.",o,o,neu,neu
"No suds? Excuse me, hold on a second. That's my friend's machine.",s,s,ang,ang
"Hey, hey, hey, her stuff wasn't in it.",dag,dag,neu,neu
"Hey, hey, hey, that's not the rule and you know it.",dag,dag,ang,ang
Cause it's good money! But that doesn't change the fact that this is an evil blood sucking corporate machine!,o,o,ang,ang
"Well, I think this is a great place to work!",o,o,hap,hap
"Ok, are they listening?",q,q,ang,ang
Varrrrrroom!,oth,oth,hap,hap
Hey!,g,g,hap,hap
Watch it lady!,c,s,hap,ang
Varrrrrrrrrrom!,oth,oth,hap,hap
