text,DA_prediction,DA,emo_prediction,emotion
also I was the point person on my company's transition from the KL-5 to GR-6 system.,s,s,neu,neu
You must've had your hands full.,o,o,neu,neu
That I did. That I did.,ag,ag,neu,neu
So let's talk a little bit about your duties.,c,s,neu,neu
My duties? All right.,ag,ag,sur,sur
"Now you'll be heading a whole division, so you'll have a lot of duties.",s,s,neu,neu
I see.,ag,ag,neu,neu
But there'll be perhaps 30 people under you so you can dump a certain amount on them.,o,o,neu,neu
Good to know.,s,s,neu,neu
We can go into detail,o,o,neu,neu
No don't I beg of you!,dag,dag,ang,fea
"All right then, we'll have a definite answer for you on Monday, but I think I can say with some confidence, you'll fit in well here.",o,o,neu,neu
Really?!,q,q,sur,sur
Absolutely. You can relax,ans,ans,neu,neu
But then who? The waitress I went out with last month?,q,q,neu,sur
You know? Forget it!,o,o,sad,sad
"No-no-no-no, no! Who, who were you talking about?",q,q,sur,sur
"No, I-I-I-I don't, I actually don't know",ans,ans,sur,fea
Ok!,ag,b,ang,neu
"All right, well...",s,oth,neu,neu
"Yeah, sure!",ans,b,hap,neu
"Hey, Mon.",g,g,neu,neu
Hey-hey-hey. You wanna hear something that sucks.,q,q,neu,neu
Do I ever.,s,oth,neu,hap
Chris says they're closing down the bar.,s,s,sad,sad
No way!,dag,dag,sur,sur
"Yeah, apparently they're turning it into some kinda coffee place.",s,s,neu,neu
Just coffee! Where are we gonna hang out now?,q,q,dis,dis
Got me.,oth,oth,sur,sad
Can I get a beer.,q,q,neu,neu
"Hey, did you pick a roommate?",q,q,neu,neu
You betcha!,oth,oth,hap,hap
Is it the Italian guy?,q,q,neu,neu
"Um-mm, yeah right!",ag,ans,hap,hap
"Oh my God, oh my God! Poor Monica!",s,s,sur,sur
"What, what, what?!",q,q,sur,sur
What?!,q,q,sur,sur
He was with her when he wrote this poem.,s,s,neu,neu
"Look, 'My vessel so empty with nothing inside.",s,s,neu,neu
"Now that I've touched you, you seem emptier still.'",o,s,hap,neu
"He thinks Monica is empty, she is the empty vase!",o,o,sur,sur
"Oh, totally. Oh, God, oh, she seemed so happy too.",o,o,sad,sad
Done.,ag,ag,neu,neu
Hey!,g,g,hap,sur
Hi!,g,g,hap,hap
What are you doing here?,q,q,sur,sur
"Ah y'know, this building is on my paper route so I...",s,s,neu,neu
Oh.,b,b,neu,neu
Hi.,g,g,neu,neu
Hi.,g,g,neu,neu
How'd did it go?,q,q,neu,neu
"Oh well, the woman I interviewed with was pretty tough, but y'know thank God Mark coached me, because once I started talking about the fall line, she got all happy and wouldn't shut up.",s,s,hap,hap
I'm so proud of you.,ap,ap,hap,hap
Me too!,ag,ag,hap,hap
"Listen, I'm ah, I'm sorry I've been so crazy and jealous and, it's just that I like you a lot, so...",ap,ap,sad,sad
I know.,ag,ag,neu,neu
Yeah.,ans,b,neu,neu
Yeah.,ans,b,neu,neu
Ameri-can.,s,oth,neu,neu
Ameri-ccan.,ans,oth,neu,neu
Ameri-can. Y'know it's a,s,s,neu,neu
Everybody!!,oth,oth,sur,sur
Good job Joe! Well done! Top notch!,ap,ap,hap,hap
You liked it? You really liked it?,q,q,sur,sur
"Oh-ho-ho, yeah!",ans,ans,hap,hap
Which part exactly?,q,q,neu,neu
The whole thing! Can we go?,ans,ans,neu,neu
"Oh no-no-no, give me some specifics.",c,c,neu,ang
"I love the specifics, the specifics were the best part!",o,o,hap,hap
"Hey, what about the scene with the kangaroo? Did-did you like that part?",q,q,neu,neu
I was surprised to see a kangaroo in a World War I epic.,ans,ans,sur,sur
You fell asleep!!,s,s,ang,ang
There was no kangaroo!,s,s,ang,ang
They didn't take any of my suggestions!,s,s,ang,ang
That's for coming buddy.,o,o,neu,neu
I'll see you later.,s,s,neu,neu
Don't go!,c,c,fea,sad
I'm sorry.,ap,ap,sad,sad
I'm so sorry!,ap,ap,sad,sad
Look!,c,c,sur,sur
This guy fell asleep!,s,s,sur,ang
He fell asleep too!,s,s,ang,ang
Be mad at him!,o,o,ang,ang
"Or, call an ambulance.",o,o,ang,ang
"Okay, look, I think we have to tell Rachel she messed up her dessert.",o,o,neu,neu
"What?! What is with everybody? It's Thanksgiving, not...Truth-Day!",q,q,ang,ang
"Yes, and it is my dying wish to have that ring.",o,o,neu,neu
"See, if I'm not buried with that ring then my spirit is going to wander the nether world for all eternity",o,o,neu,neu
"Okay, that's enough honey!",dag,s,ang,neu
I don't know. Let me see the ring.,s,s,neu,neu
"Great! Okay, here.",ag,ag,hap,hap
All right.,ag,oth,neu,neu
Thank you. Thank you. Thank you! And,g,a,hap,hap
What've you been up to?,q,q,neu,neu
"Oh, you know, the usual, teaching aerobics, partying way too much.",ans,ans,neu,neu
"Oh, and in case you were wondering, those are my legs on the new James Bond poster.",s,s,neu,neu
Can you hold on a moment? I have another call. I love her.,c,s,neu,hap
I know.,ag,ag,neu,neu
I'm back.,s,s,neu,neu
"So, are we gonna get together or what?",q,q,neu,neu
"Um, absolutely. Uh, how 'bout tomorrow afternoon? Do you know uh, Central Perk in the Village, say, five-ish?",ans,ans,neu,neu
"Great, I'll see you then.",s,ag,hap,neu
Ok. Ok. Having a phone has finally paid off.,s,s,hap,hap
"Even though you do do a good Bob impression, I'm thinkin' when she sees you tomorow, she's probably gonna realize, ""Hey, you're not Bob.""",o,o,neu,neu
"I'm hoping that when Bob doesn't show up, she will seek comfort in the open arms of the wry stranger at the next table.",o,o,neu,neu
Oh my god. You are pure evil.,o,o,dis,dis
"Ok, pure evil , horny and alone . I've done this",s,s,ang,ang
Nobody!,ans,oth,ang,ang
Nobody respects the bucket!,s,o,ang,ang
You wouldn't believe what people put in here!,s,s,ang,ang
Look!,c,c,sur,ang
"Okay, does this look like a garbage can to you?",q,q,ang,ang
No.,ans,ans,neu,neu
This is my wedding.,s,s,neu,neu
"All right, y'know what? We really are late! Let's go! Let's go! Let's go!!",s,s,ang,ang
Fine. You'll-you'll watch it on video when we get back.,s,s,neu,neu
Here you go Phoebe! Here you go Phobo! Phewbedo! Phaybobo.,s,s,hap,hap
Thank you.,g,g,neu,neu
Thank you.,g,g,neu,neu
"All right, let's go! Bye, Pheebs!",g,g,hap,hap
"Bye, Pheebs!",g,g,hap,hap
London baby!!,oth,oth,hap,hap
"Oh, do you need a hug? You don't have to bring me anything!",o,o,hap,hap
Hey!,g,g,hap,neu
Hey! So Estelle lined up a bunch of auditions for me tomorrow and I'll have my health insurance back in no time.,s,s,hap,hap
"That's great, but shouldn't you be on the toilet right now?",q,q,dis,dis
What?!,q,q,sur,sur
What's wrong with you?,q,q,dis,dis
Nothing!,ans,ans,neu,neu
"Well, I-I got this blinding pain in my stomach when I was lifting weights before, then I uh passed out and uh, haven't been able to stand up since.",s,s,fea,fea
"But um, I don't think it's anything serious.",o,o,neu,neu
This sounds like a hernia. You have to you-you go to the doctor!,s,o,dis,sur
"No way!  Kay look, if I have to go to the doctor for anything it's gonna be for this thing sticking out of my stomach!",ans,dag,sad,fea
That's a hernia.,s,s,dis,dis
Why did I have to start working out again? Damn you 15s!,q,q,ang,ang
I love your place! Where is this guy from?,q,q,sur,hap
Uh that's an eighteenth century Indian artifact from Calcutta.,ans,ans,neu,neu
"Oh wow! So, you're more than just dinosaurs.",o,o,sur,sur
So much more.,ag,ag,neu,neu
"Well, well to sum up, we're having fun, you look young.",s,s,neu,neu
Okay,ag,ag,neu,neu
But that's not enough. So  So here's a key to my apartment.,s,s,neu,neu
Really?!,q,q,sur,sur
Really.,ans,ans,hap,neu
You don't think this is too fast.,s,o,neu,neu
Get Out!,c,c,ang,ang
"Ross, can I talk to you for a minute?",q,q,neu,neu
"Yes, please! So, what's going on?",ans,ans,neu,neu
"Uh, well... Joey and I broke up.",s,s,sad,sad
"Oh my God, wh-what happened?",q,q,sur,sur
"Joey is a great guy, but we're just... so different! I mean, during your speech he kept laughing at homo erectus!",ans,ans,sad,sad
I knew that was him!,o,o,ang,ang
"Anyway I just, uh, I think it's for the best.",o,o,sad,sad
"Hey, you ok?",q,q,neu,neu
I guess.,ans,ans,sad,sad
There was hum... there was another reason that I thought it was time to end it with Joey.,s,s,neu,neu
I started to realize that I was having feelings for someone else.,o,o,neu,neu
"Ok Geller. Last day of the conference, you know what happens to the keynote speaker.",s,s,neu,neu
"Oh, professor Clerk we're kind of in the middle of a conversation, here.",s,s,neu,neu
"Yeah, can you guys just throw him in the pool later?",q,q,neu,neu
Or we could throw you both in,o,o,hap,hap
"Ok, gentlemen!",oth,oth,ang,ang
Please!,oth,oth,ang,ang
Aren't we a little old for this?,o,o,ang,ang
"I mean, we're scientists, right?",o,o,neu,neu
We're academics.,s,s,ang,ang
And most importantly I... you-you will have to catch us first.,s,s,hap,hap
"GO, GO, GO!",c,c,hap,hap
"Go, go, go!",c,c,hap,hap
"Oh yeah, now everybody wants to be under this hat!",o,o,hap,hap
Oy!!,oth,oth,sur,dis
What's with all this sand?,q,q,sur,sur
"Oh, yeah, Bob said there might be flood damage.",s,s,neu,neu
"Yeah, either that, or he has a really big cat.",o,o,neu,neu
"Okay, see that blind guy right there? I'm gonna bash his head in later.",s,s,ang,ang
"Oh umm, my big scene is coming up. Big scene coming up.",s,s,hap,hap
"If you said, ""Big lima bean, bubbling up."" Would she understand the difference?",q,q,neu,neu
Rach? What are you doing?,q,q,neu,neu
"Oh boy, I just can't watch. It's too scary!",o,o,fea,fea
It's a diaper commercial.,s,s,neu,neu
"Oh yeah well, you know me, babies, responsibilities, ahhh!!!",s,s,sad,fea
Pizza delivery!,oth,oth,hap,hap
I'll get it! I will get that!,s,s,hap,hap
Hi!,g,g,hap,hap
Hi!,g,g,hap,hap
"Hey, you wanna get something to eat or uh, do you wanna see how long we can throw this ball back and forth? Huh?",q,q,neu,neu
"Uhh, the ball thing.",ans,ans,neu,neu
Yeah?,b,b,neu,neu
"Hey Ross, wouldn't it be great if we could go two straight hours without dropping it?!",q,q,hap,hap
"Uhh,",b,ans,neu,neu
Okay!,ag,ag,hap,hap
Uh-oh.,b,b,fea,fea
What?,q,q,sur,neu
I have to pee. And Rachel's in the bathroom!,ans,ans,sad,sad
"Man, I didn't think we were gonna make it!",o,o,sur,sur
"I know! Don't switch hands, okay?",o,o,fea,fea
Hey.,g,g,neu,neu
Hey!,g,g,hap,neu
How did it go with Erin?,q,q,neu,neu
"Oh, unbelievable! We had the best time!",s,s,hap,hap
"Yay!! Oh so, you're not, you're not mad at us anymore?",q,q,hap,hap
No!,ans,ans,ang,hap
No!,ans,ans,ang,hap
No!,ans,ans,ang,hap
You guys were totally right!,o,o,hap,hap
This is so much better than the first time we went out.,o,o,hap,hap
Y'know?,oth,oth,neu,neu
"That was so awkward, we were really nervous.",o,o,neu,neu
Didn't you sleep together?,q,q,neu,neu
"Yeah, that really calms me down.",ans,ans,neu,neu
And!,oth,b,hap,hap
We have so much in common!,s,s,hap,hap
"She loves sandwiches, sports, although she is a Met fan, not much of an issue now but if we were ever to have kids, well that's a",s,s,neu,hap
"Oh my God! Listen to you talkin' about having kids. Oh my Joey. Oh, please don't get married before I do.",o,o,sur,sur
Okay.,ag,ag,neu,neu
How does she do that?,q,q,sur,sur
I cannot sleep in a public place.,o,o,neu,neu
Would you look at her? She is so peaceful.,q,q,sad,hap
Oh! What what what! ...Hi.,g,g,sur,sur
"It's okay, y'know, you just nodded off again.",s,s,neu,neu
What's going on with you?,q,q,sur,sur
I got no sleep last night!,s,ans,sad,ang
Why?,q,q,sur,neu
"My grandmother has this new boyfriend, and they're both kind of insecure in bed.",ans,ans,dis,dis
"Oh, and deaf.",oth,oth,neu,neu
"So they're constantly, like, having to reassure each other that they're having a good time.",s,s,neu,neu
You have no idea how loud they are!,s,s,dis,dis
"Well, if you want, you can stay with Rachel and me tonight.",o,o,neu,neu
Thanks.,g,g,neu,hap
Ew! What is that? Something exploded!,q,q,dis,dis
"It's just her water breaking. Calm down, will you?",ans,ans,neu,neu
"Water breaking, what do you mean? What's that, water breaking?",q,q,sur,sur
"Breathe, breathe, breathe.",oth,oth,neu,neu
"Are you insane? I mean Joey, is going to kill you, he's actually going to kill you dead.",s,o,ang,sur
Okay! You don't think I thought of that?,s,s,ang,ang
How can you not know which one?,q,q,sur,sur
I mean that's unbelievable.,o,o,hap,hap
"I mean, was it Gina?",q,q,neu,neu
Which one is Gina?,q,q,neu,neu
"Dark, big hair, with the airplane earrings.",ans,ans,neu,neu
"No, no, no, that's Dina.",s,s,neu,neu
"You see you can't tell which one is which either, dwha!!",s,ag,sur,sur
"I don't know, you thought  See you Saturday' was funny.",s,s,neu,neu
"Look honey, Mark is in fashion okay, I like having a friend that I can share this stuff with.",o,o,neu,neu
You guys would never want to go to a lecture with me.,s,s,neu,neu
Pa-haa!! I would love to go with you.,o,o,hap,hap
Really!?,q,q,sur,sur
"Yeah, hey I-I have clothes, I even pick them out.",ans,ans,neu,neu
"I mean for, for all you know I could be a fashion..... monger.",s,s,neu,neu
"Okay. Honey, I would love for you to go with me. What?",o,o,hap,hap
"What should I wear, now I'm all nervous.",q,q,fea,fea
": I know, we did it!! Hey, that was incredible, huh?!",oth,o,hap,hap
"I know, it was amazing! I mean, we totally nailed it, it was beautiful.",ag,ag,hap,hap
": Thank you, listen, thanks a lot Tribbiani, . Oh my God, look at the time, I gotta catch the bus to the ball.",s,s,hap,hap
"Oh well, okay, good luck.",g,g,hap,hap
: Yeah.,oth,oth,neu,neu
Unless you wanna practice the Foxtrot again? Or-or the Tango?,o,o,neu,neu
": Ahh, thanks but no. You see I-I think I'm ready to dance with girls.",o,o,neu,neu
Okay.,ag,ag,neu,neu
: Yeah.,oth,b,neu,neu
Go get  em Treeger.,c,c,neu,neu
": Right. Hey, ahh, you wanna come? Marge has a girlfriend.",q,q,neu,neu
Really?,q,b,sur,sur
": Yeah, you could dance real good with her, she's the same size as me.",s,ans,neu,neu
"No, I'm good.",dag,dag,neu,neu
"Oh God, this is so nerve wracking! How-how do you do this?",q,q,sur,sur
"Well, unfortunately, I don't get many callbacks so",ans,ans,neu,neu
Is it a good sign that they asked us to hang around after the audition?,q,q,neu,sur
Who knows?,s,s,neu,neu
"Okay uh, we have narrowed it down to Raymond, Ben, Kyle, and Joey. The rest of you, thank you very much.",s,s,neu,neu
Yes!! I knew it!! Bye-bye! So long! Later!,g,g,hap,hap
Oh this is great! I might actually get to play Ben's dad!,s,s,hap,hap
Yeah!,ans,b,hap,hap
"Actually, that can't happen.",dag,dag,neu,neu
"Yeah because you all have such different looks, we're putting you with Raymond and Kyle with Ben.",s,o,neu,neu
So it'll be either you two or you two.,o,o,neu,neu
"Man, this is gonna be kinda weird.",o,dag,sad,sad
"Yeah, it is.",ag,ag,neu,neu
"No, we-we're gonna be like best friends, that's why it's gonna be weird.",o,o,neu,neu
"Okay, come on, I can't get married until I get something old, something new, something borrowed, and something blue.",o,o,sad,sad
"Okay, all right, all right, all right! Okay! Okay, here's something, here's something blue and new.",ag,ag,hap,hap
Please!,oth,oth,ang,ang
Are you kidding?,q,q,sur,ang
"I-I hurt three huge men, I gave a guy a bloody nose I mean I-I'm not proud of it but, I really am.",s,s,ang,ang
"And it's all because of you, wonderful, amazing you.",o,o,hap,hap
I think you've got concussion.,o,o,fea,fea
"No, no, I'm serious. Thank you.",s,dag,neu,hap
You're welcome. I'm sorry. Did I hurt you?,q,q,fea,fea
"It's worth the pain. Y'know what, you know what? It's not.",ans,ans,sad,sad
Wow! That Mike thing was interesting! I don't know what's gonna happen with Phoebe and David.,o,o,sur,sur
"I do! Want a hint? huh? ""I do"" ""I do"".",s,s,hap,hap
"Ok, I'm sensing that this is some kind of word play, because you are pink with barely controlled glee.",o,o,neu,neu
David is going to propose to Phoebe.,s,s,neu,hap
What? Why?,q,q,sur,sur
"Chandler, we have talked about this.",s,s,neu,ang
You are not supposed to give people advice!,dag,c,ang,ang
Now couldn't you just have made some sort of inappropriate joke?,o,o,ang,ang
I,oth,oth,neu,neu
They've only been going out for a few weeks and Phoebe is completely hung up on Mike!,s,s,ang,ang
"She'll say ""No"", David's heart will be broken, it will be too hard for them to recover from and then Phoebe will end up alone",o,o,ang,ang
"Man, that's some",oth,oth,sur,sur
"Oh, that's not what you want...",s,s,neu,neu
"This is my father, Paul Stevens. Dad, this is Ross Geller.",s,s,neu,neu
It-it's great to meet you Paul.,g,g,hap,hap
I usually prefer Elizabeth's boyfriends to address me as Mr. Stevens.,s,o,neu,neu
"Of course, of course, Mr. Stevens.",ag,ag,neu,neu
"So Ross, what your problem?",q,q,ang,ang
Eh-wh Excuse me?,oth,ans,sur,sur
Why can't you get a girlfriend your own age?,q,q,ang,ang
That's funny. Umm . It's not funny.,ans,ans,fea,fea
I,oth,oth,neu,neu
Okay.,ag,oth,neu,neu
"I can, I can see that.",s,s,neu,neu
"Umm, but I think if you give me umm, one chance I can, I can change your mind.",o,o,fea,fea
Okay.,ag,ag,neu,neu
What?,q,q,sur,neu
Okay. I'll give you one chance to change my mind. You got one minute.,s,ans,neu,ang
Daddy!,oth,oth,sur,sur
"Oh well, it's not on TV yet.",s,s,neu,neu
"Well, then it's not on the wall yet.",s,s,neu,neu
"Okay, fine, I will bring you a tape, huh?",s,s,neu,neu
"So umm, now do you have any of Matt Lauer's clothes here? Maybe? Just ones that haven't been cleaned yet?",q,q,neu,neu
Ooooohh!,b,oth,sur,sur
"Oh yeah, I'm sure. And all of a sudden his hands weren't the problem anymore.",ag,o,neu,neu
Was it...?,q,q,sur,sur
"Oh, boy scouts could have camped under there.",ans,ans,neu,neu
"""Ooo,"" what?",q,q,sur,sur
Uma Thurman.,ans,ans,neu,neu
Oh!,b,oth,sur,sur
The actress!,s,s,sur,sur
Thanks Rach.,g,g,neu,neu
So what are you gonna do?,q,q,fea,sur
You have to tell her!,o,o,hap,hap
You have to tell her!,o,o,hap,hap
"It's your moral obligation, as a friend, as a woman, I think it's a feminist issue!",o,o,neu,ang
Guys?,oth,oth,sur,ang
Guys?,oth,oth,sur,ang
"Oh, yeah, you have to tell her.",ag,ag,neu,neu
Feminist issue. That's where I went!,s,s,neu,neu
She is gonna hate me.,o,o,fea,fea
"Yeah, well...",oth,oth,neu,neu
Will you marry me?,q,q,fea,fea
It's the big night! We wanted to wish you good luck!,s,s,hap,hap
"Yeah, yeah you have the ring?",q,q,neu,neu
"Yeah, right here in my pocket. Pheebs?",ans,ans,neu,neu
Oh! Oop!,oth,oth,sur,sur
"Okay, now will you guys get out of here? I want this is to be a surprise and she's gonna know.",s,o,neu,neu
Yeah-yeah you guys. Get out of here!,s,ag,neu,neu
Hi guys.,g,g,neu,neu
You are beautiful.,o,o,hap,hap
"Oh, thank you! What's going on?",q,q,hap,hap
We're just really very excited about this charity event that we have to go to.,ans,ans,neu,neu
"Okay umm, Ross?",g,oth,neu,neu
"I'm-I'm really warm, so I'm going to be taking off my sweater.",o,s,neu,neu
"Now, I'm just letting you know that this is",s,s,neu,neu
Yep! That's hilarious!,o,o,hap,hap
I'm sorry. I'm done. I'm done.,ap,ap,neu,neu
"Y'know, last night was embarrassing for you too.",s,s,neu,neu
"No, not really. I mean you've seen me naked hundreds of times.",dag,dag,neu,neu
Uh-huh. But it was a first for the rest of my building.,s,s,neu,neu
"Okay. All right, that's true! But y'know I just don't embarrass that easily.",ag,o,hap,neu
What?! You totally get embarrassed!,q,q,sur,sur
"No, I don't! Ross, I think I'm just a more secure person than you are.",ans,ans,neu,neu
Is that so?,q,q,neu,neu
Yeah.,ans,ans,neu,neu
Hey lady! I don't care how much you want it! Okay?! I am,s,s,ang,dis
I can't believe it!,s,s,sur,sur
I did it!,s,s,hap,hap
I rode a bike!,s,s,hap,hap
I never thought I'd be able to do that!,o,o,hap,hap
Thank you Ross.,g,g,hap,hap
"Oh hey, don't thank me, thank yourself. You're the one who faced her fears and ultimately overcame them.",s,s,hap,hap
"Hey, both you guys should be up there with me.",o,o,neu,neu
"I mean, you two are-are my  I mean, I'm lucky to have just one good",s,s,neu,neu
Thanks man.,a,a,neu,neu
I gotta go check something over here.,s,s,neu,neu
What a baby.,o,s,hap,sad
Total wuss!,oth,oth,sad,sad
"Okay, we have a lot of options here, a number of prototypes for you to try on.",s,s,neu,neu
Wow! This looks great!,o,a,hap,hap
"Yeah! Okay, this one is a mushroom cap. Umm, this one is made of bologna.",s,s,hap,hap
And-and-and-and-and the toothpicks?,q,s,hap,dis
You kissed another woman!,s,s,ang,ang
Call it even?!,oth,oth,neu,neu
Okay!,ag,oth,hap,hap
"Well, I'm gonna go get these in some water.",s,s,neu,neu
Wait you stole those from these people's wedding?,q,q,sur,sur
"No-no, I took them from the hotel lobby.",ans,ans,neu,neu
"Yeah, they think they can charge me for some dirty movie and a bag of Mashuga nuts, they got another think coming.",s,s,neu,ang
Hey!,g,g,hap,sur
My sweater!,s,s,sur,sur
I've been looking for this for like a month!,s,s,sur,sur
Oh my God!!,oth,oth,sur,sur
Oh my God!,oth,oth,sur,sur
Happy?! Is that what I'm supposed to be Vic? Happy?,q,q,ang,ang
"Well, why don't you tell me what you're supposed to be!",q,q,ang,ang
Huh?,b,b,sur,sur
Because I sure as hell can't figure it out!,s,s,ang,ang
I talk to you and nothin'.,s,s,ang,ang
"You look at me, and it's nothin'.",s,s,ang,ang
Nothing.,ans,oth,neu,ang
"Tasty! I'm really starting to feel like you guys have a history, it's-it's nice.",o,o,hap,hap
I have a question about this scene.,s,s,neu,neu
Yes?,b,ag,neu,neu
"Well, I don't understand why Adrienne's attracted to Victor.",q,q,sad,dis
"Peel the onion. First of all, he's good looking.",ans,ans,neu,neu
Yeah.,ans,ag,neu,neu
I think my character's gonna need a little bit more of reason than that.,o,o,neu,neu
"Oh, hey, how about this one.",q,s,neu,neu
"Ah, it's says so in the script!",s,s,ang,ang
"Y'know ah, I-I don't know why my character likes you either, I mean it says in the script here that you're a bitch.",o,s,dis,ang
It doesn't say that in the script.,s,s,ang,ang
It does in mine!,s,s,ang,ang
I can't,dag,dag,neu,ang
Yeah! You gotta tell a girl before you tape her. Such a rookie mistake.,o,o,ang,ang
Y'know who has a great video camera?,q,q,neu,neu
Greg and Jenny?,q,ans,neu,neu
Do you still wanna call  em? I wanna call  em.,q,q,neu,neu
Let's call  em.,ans,ans,neu,neu
Yeah! Ask them if they brought their friends any souvenirs!,s,s,hap,hap
Hello? Eighth street deli?,g,g,neu,neu
"Hey, hang up! You get food poisoning just talkin' to that place.",s,s,dis,dis
"Uh sorry, wrong number.",ap,ap,fea,fea
Here you go.,s,s,neu,neu
Hello? It's the deli again!,s,s,sur,sur
All right! I'll have a sandwich!,s,s,hap,hap
I don't think this number's right!,o,o,sad,sad
Oh come on!!,oth,oth,sur,sad
"Gotta go. I miss you too, I love you, but it's getting real late now",s,s,sad,sad
"Hey Ma. Listen, I made the appointment with Dr. Bazida, and... Excuse me? Did you know this isn't Ma?",q,q,sur,sur
Her name's Ronni. She's a pet mortician.,ans,ans,neu,neu
Sure. So how long you been...,q,q,neu,neu
"Remember when you were a little kid, I used to take you to the navy yard and show you the big ships?",s,s,neu,neu
Since then?!,q,q,sur,sur
"No, it's only been six years.",ans,ans,neu,neu
I just wanted to put a nice memory in your head so you'd know that I wasn't always such a terrible guy.,o,o,neu,neu
...Joe.,oth,oth,neu,neu
Y'ever been in love?,q,q,neu,neu
...I d'know.,ans,ans,neu,neu
Then y'haven't. You're burning your tomatoes.,s,s,ang,neu
You're one to talk.,s,s,neu,dis
"Joe, your dad's in love big time. And the worst part of it is, it's with two different women.",s,s,neu,neu
Oh man. Please tell me one of 'em is Ma.,o,o,dis,dis
"Of course, course one of 'em's Ma. What's the matter with you.",s,s,sur,sur
"Everything's gonna be all right. Okay, Dick?",o,o,neu,neu
"Hello, I am Guru Saj--Whoa!! That's supposed to be a duck right?  Cause otherwise, this is waaay out of my league.",s,s,sur,sur
"Hey, Rach, how was work?",q,q,neu,neu
"Oh, great. Although I did sit down where there wasn't a chair.",ans,ans,hap,neu
"By the way, Ross dropped by a box of your stuff.",s,s,neu,neu
"Oh, well, I guess I had that one coming.",s,s,neu,neu
"I'm just gonna throw it out, it's probably just a bunch of shampoo and...",o,s,neu,neu
Something wrong?,q,q,neu,neu
No. Nothing.,ans,ans,neu,neu
"And then, and then you said that thing about, about bringing the Mesozoic era in the 21st century.",s,s,neu,neu
"Yeah, that's it?",ans,b,sur,sur
Yeah.,ans,oth,neu,neu
"Dude, I am sorry about what I said!",ap,ap,sad,sad
"No, no, you're right, it is a ridiculous name!",ag,ag,dis,dis
It's not that bad.,s,s,neu,neu
"Yes it is! From now on, I have no first name.",dag,dag,ang,ang
"So, you're just Bing?",q,q,neu,neu
Because we won our apartment back!,ans,ans,hap,hap
"What? Ace is high! Jack, queen, king, ace!",q,s,hap,sur
"No! Ace is low! Ace, two, three, four!",s,s,ang,ang
I don't know. Ooh! Ooh! Look it! Ah-ha!,s,s,sur,sur
"All right, cut, let's pick again, pick again.",o,o,neu,neu
Okay.,ag,ag,neu,neu
Come on apartment! Come on apartment! Oh! I know queen is high!,o,s,hap,ang
"Uh-huh, not as high as  It worked! King!",dag,dag,sur,sur
Yeah baby!,ans,b,hap,hap
"But, we pick again! We pick again!",o,o,hap,hap
Why?!,q,q,sur,neu
I don't know!,ans,ans,sur,fea
Tickets please! That's courtside baby!,s,s,hap,hap
"Seriously, good game though. Good game. What are they so mad about? They get the apartment back!",q,q,ang,sur
No they didn't!,ans,ans,hap,hap
"You know, I don't think we brought enough stuff. Did you forget to pack the baby's anvil?",q,q,neu,neu
It's gonna be worth it.,o,o,neu,neu
"It's a known fact that women love babies, all right?",s,s,neu,neu
Women love guys who love babies.,o,o,neu,neu
It's that whole sensitive thing.,s,s,neu,neu
"Quick, aim him at that pack o' babes over there.",oth,oth,neu,neu
Maybe one of them will break away.,o,o,neu,neu
