Text,DS_r1_emotion
|I don't have too. I can just look at you.|,Disagreement
"|All right girls, and man. Let's see your final tallies. Ohhhh, Debbie, 321 boxes of cookies, Very nice.|",Command
|Not nice enough.|,Statement Opinion
"|Charla, 278. Sorry, dear, but still good.|",Apology
"|So, how'd the lasagne go over?|",Question
|Really?!|,Acknowledge
|Good.|,Acknowledge
|So you owe me three pretty things.|,Command
"|Yeah, I've been thinking a lot about you too.|",Agreement
|It's hard this whole platonic thing.|,Statement Opinion
|It's a word!|,Statement Non Opinion
"|Yeah, I do think it's better this way. Yeah, we're being smart. Yes, I'm sure.|",Agreement
|You really sure?|,Question
|I'll call you back.|,Command
"|So, are you really gonna go out with that nurse man?|",Question
"|Well uh, you and I are just goofing around, I thought, why not goof around with him.|",Statement Opinion
"|Y'know, I don't know if you've ever looked up the term goofing around in the dictionary... Well, I have, and the technical definition is, two friends who care a lot about each other and have amazing sex and just wanna spend more time together.|",Statement Opinion
"|But if you have this new fangled dictionary that gets you made at me, then we have to, y'know, get you my original dictionary.|",Command
|I am|,Others
|I think you're better than you think you are.|,Statement Opinion
"|Really? Okay, so|",Backchannel
|Know when to stop.|,Command
"|Y'know, I sensed that I should stop. So we're okay?|",Question
"|Yeah. All right, I'm gonna go tell Dan that it's not gonna happen. Don't do the dance.|",Command
|Right!|,Agreement
"|Ow!-Ow!-Ow! Ow! Ow! Ow! Ow! Ow! Ow! Y'know, ow!|",Others
|Hey!-Hey! What's going on?|,Greeting
|She broke my arm.|,Statement Non Opinion
|He touched my fanny.|,Statement Non Opinion
"|No, she touched mine first!|",Disagreement
|That's my job!|,Statement Non Opinion
|Are you being British?!|,Question
|No. Not anymore.|,Disagreement
|Why are you shopping here? You don't live in this neighborhood. Were you here waiting for me?|,Question
"|Yeah, huh. I'm just uh, you know I'm just picking up some things for a party.|",Acknowledge
|Barley? What kind of party serves barley?|,Question
"|Well, I'm sorry if my friends aren't as sophisticated as yours.|",Apology
|Where is this party?|,Question
|Here in Chelsea.|,Statement Non Opinion
|Who's party is it?|,Question
|A woman's|,Others
|What woman?!|,Question
|Chelsea.|,Acknowledge
"|Either you're seeing somebody behind my back, which would make you the biggest jerk on the planet.|",Disagreement
"|Or, else you're pretending that you're seeing somebody, which just makes you so pathetic that I could start crying right here in the cereal aisle.|",Statement Opinion
|So like which of these two guys do you want to be?|,Question
|Can I be that guy?|,Question
|Great story again! The yarns that you weave! Woo-hoo-hoo!|,Statement Opinion
"|Y'know uh, actually I-I-I should get going.|",Statement Non Opinion
|Oh no-no-no! Stay! Stay! Because you-you should you-you-you should stay!|,Command
"|Wow. Oh, I am really flattered, but I just I don't feel that way about you.|",Disagreement
"|Oh no-no-no, that's not--No-no-no!|",Disagreement
|Did you just flick me?|,Question
"|OK, well, you wouldn't let me finish and I was jus- [Monica flicks her back] Ow. That hurt [flicks Monica]|",Acknowledge
"|Oh! All right. Now, let's not do this!|",Command
|Happy thoughts! Happy thoughts!|,Statement Non Opinion
"|OK, now I'm gonna kick some ass.|",Command
|Ow! Ow! Ow!|,Others
"|Alright, now I will let go if you both stop.|",Command
|Fine!|,Agreement
|Fine!|,Agreement
"|There we go.You know what, if we were in prison, you guys would be, like, my bitches.|",Statement Opinion
"|Okay, buddy-boy. Here it is. You hide my clothes, I'm wearing everything you own.|",Command
|Oh my God!|,Statement Non Opinion
|Look at me! I'm Chandler! Could I|,Command
"|Whew, it's hot with all of this stuff on.|",Statement Opinion
"|I ah, I better not do any, I don't know, lunges.|",Statement Non Opinion
|Hi.|,Greeting
|Hi.|,Greeting
"|Hi, listen, I'm sorry about before.|",Apology
|I don't need to have a game room.|,Statement Opinion
"|I mean when I was a kid I only played those games because I couldn't get girls, and now I|",Statement Opinion
|Stop it Chandler. I'm sorry too.|,Apology
|Really?|,Question
|Yeah! Oh yes!|,Backchannel
|Ohh.|,Backchannel
"|Listen, we don't have to make that a guest room, we can think of something to do with the room together.|",Command
|That's a great idea! We can|,Agreement
|Totally!|,Agreement
|We don't have to come up with this now.|,Statement Opinion
|Oh good.|,Backchannel
"|Yeah, and I am okay with being a pushover.|",Statement Opinion
|That's great. Good for you guys.|,Agreement
|I am not high maintenance!|,Disagreement
|I am not a pushover!|,Statement Opinion
|Who said you were?|,Question
|You did!|,Disagreement
"|Oh, I'm flaky. I'll say anything.|",Statement Opinion
"|Ok, I know this is gonna sound really stupid, but I feel that if I can do this, you know, if I can actually do my own laundry, there isn't anything I can't do.|",Statement Opinion
|That does not sound stupid to me.|,Disagreement
"|You know, it's like the first time I had to make dinner for myself, after Carol left me?|",Statement Non Opinion
"|I'm sorry, that's all the time we have.|",Apology
|Next on Ross... Uh-oh.|,Others
|What uh-oh?|,Question
"|Uh-oh, uh-oh, the laundry's done.|",Statement Non Opinion
"|It's, uh, it's a song.|",Statement Non Opinion
|The laundry song that we sing.|,Statement Non Opinion
"|Uh-oh the laundry's done, uh-oh, uh-oh.|",Statement Non Opinion
"|Ross, what's the matter?|",Question
"|Nothing, nothing. Lee-lo, the laundry's done.|",Statement Non Opinion
|Why are you here?|,Question
"|Well, Sid and I are trying again and we had trouble last time because apparently we...|",Statement Non Opinion
"|No no no... I mean,|",Disagreement
|Oh! Someone's a little cranky today cuz they have to do it in a cup! Oh! They gave you the kiddy size .|,Statement Opinion
|What!?|,Question
|This was fun! But I've got an invasive vaginal exam to get to!|,Statement Opinion
"|I'd love to stay, but I have eh... got a hot date...|",Statement Opinion
|Please... go! Just let me know if you need a hand!|,Command
|I think it just fell off.|,Statement Opinion
"|I don't want to be single, okay? I just... I just- I just wanna be married again!|",Statement Opinion
|And I just want a million dollars!|,Statement Opinion
|Rachel?!|,Greeting
|Yeah.|,Backchannel
"|Look, these clowns are trying to take us for a ride and I'm not gonna let 'em!|",Statement Opinion
|And we're not a couple of suckers!|,Statement Opinion
"|I hear ya, Mugsy!|",Backchannel
"|But look, all these rooms are fine okay?|",Command
"|Can you just pick one so I can watch--have a perfect, magical weekend together with you.|",Command
"|Okay,|",Backchannel
|Nothing! It's over! Dammit! This is regularly scheduled programming!|,Statement Opinion
|Can we turn the TV off? Okay? Do we really want to spend the entire weekend like this?|,Question
"|Oh, I'm sorry, am I getting in the way of all the room switching fun?|",Apology
"|Hey, don't blame me for wigging tonight!|",Command
"|Oh, who should I blame? The nice bell man who had to drag out luggage to 10 different rooms?|",Statement Opinion
"|I don't know, how about the idiot who thought he could drive from Albany to Canada on a half a tank of gas!|",Statement Opinion
|Do not speak ill of the dead.|,Command
"|We're supposed to uh, be spending a romantic weekend together, it-it, what is the matter with you?|",Question
"|I just want to watch a little television. What is the big deal? Geez, relax mom.|",Command
|What did you say?|,Question
"|I said, ""Geez, relax Monnnnn.""|",Command
"|Y'know, maybe it's best that we never got to do it again.|",Statement Opinion
"|Yeah, it kinda makes that-that one night special. Y'know, technically we still|",Statement Opinion
"|I'm gonna go to the bathroom, maybe I'll see you there in a bit?|",Statement Non Opinion
|Kay!|,Acknowledge
|Can I ask you something?|,Question
"|Uhh, no.|",Disagreement
"|Felicity and I, we're watching|",Statement Non Opinion
|No.|,Disagreement
"|I mean, the giant is like five years younger than me, y'know, you think I'll ever get there?|",Question
|Yes.|,Agreement
|Thanks man.|,Acknowledge
|Okay man.|,Backchannel
|But what about how much taller he is than me?|,Question
"|I mean, there's no way I can make myself taller now, y'know?|",Statement Opinion
"|And who knows what science will come up with in the future, but Chandler, what if I die an unsuccessful, regular sized man?|",Question
"|Hey, Monica, wow you've been in the bathroom for like a half-hour.|",Statement Non Opinion
|I know!|,Acknowledge
"|Had the beef-tips, huh?|",Statement Non Opinion
"|Good-bye and God speed, Hope Brady.|",Others
|Not so fast Wesley!|,Command
|Ramoray!|,Acknowledge
"|That's right Wesley! I just stopped by to say that, you're not a real doctor! And that woman's brain, is fine!|",Disagreement
|Oh! Thank God!|,Acknowledge
|Hope! Hope!|,Command
|Drake!|,Greeting
"|You're not dying Hope, you're gonna live a long, healthy life. With me.|",Statement Opinion
|Oh Drake.|,Acknowledge
|Okay!|,Acknowledge
|Here we go!|,Others
|Okay!|,Backchannel
"|Hi, Joey!|",Greeting
|It's Rachel!|,Statement Non Opinion
"|Umm, I am free tomorrow night.|",Statement Non Opinion
"|Yeah, sure, sure I can bring some sandwiches.|",Agreement
"|OK, we got the cole slaw, we got the buns...|",Statement Non Opinion
"|We've got the ground-up flesh of formerly cute cows and turkeys, ew...|",Statement Opinion
|Men are here.|,Statement Non Opinion
"|Mom, would you relax.|",Command
"|That was 10 blocks from here and, the, the woman was walking alone at night, I would never do that.|",Statement Opinion
"|Mom, c'mon, stop worrying.|",Command
"|This is a safe street, this is a safe building, there's nothing|",Statement Opinion
|Hi.|,Greeting
"|Hi, hi can I help you?|",Greeting
"|Yeah, I'm looking for Phoebe, does she still live here?|",Question
"|Uh, no she doesn't but I can, I can get a message to her.|",Disagreement
"|Great. Uhh, just tell her her husband stopped by.|",Command
|What?|,Question
"|Hey, how, how did you do that?|",Question
"|Alright, somebody.|",Command
"|OK, I'll go. OK, senior year of college... on a pool table.|",Acknowledge
|Whoooaa!|,Backchannel
|That's my sister.|,Statement Non Opinion
|OK... my weirdest place would have to be... the women's room on the second floor of the New York CIty public library.|,Statement Opinion
|Oh my God! What were you doing in a library?|,Question
"|Pheebs, what about you?|",Question
|Oh... Milwaukee.|,Acknowledge
|Um... Ross?|,Acknowledge
"|Disneyland, 1989, 'It's a Small World After All.'|",Statement Non Opinion
|No way!|,Disagreement
|The ride broke down.|,Statement Non Opinion
"|So, Carol and I went behind a couple of those mechanical Dutch children... then they fixed the ride, and we were asked never to return to the Magic Kingdom.|",Statement Non Opinion
"|Oh, Rachel.|",Acknowledge
|Hey!|,Greeting
|Hey!|,Greeting
"|Oh, is the play over?|",Question
|Yeah. Where were you?|,Question
"|Thank you for your patience, you're the next caller.|",Statement Non Opinion
|You were the next caller five hours ago. You must be going crazy.|,Statement Opinion
|Nah. I kept myself busy.|,Acknowledge
"|Oh, okay, yeah. I put your stuff in her room, and her stuff in your room.|",Acknowledge
"|Well there's yore. And uh, y'know, yesteryear.|",Statement Non Opinion
"|Yeah no, I'm telling you Rachel has such a great eye for this stuff.|",Statement Opinion
"|Ross, y'know if you ever decide you need to redecorate--And I think that you should.|",Statement Opinion
"|You should, you should ask Rachel to help.|",Command
|Oh honey he doesn't need my help.|,Statement Opinion
"|Oh, come on! I think he's ready to get rid of, what did you call it? The cheap knock-offs and dinosaur junk.|",Statement Opinion
|Really?!|,Backchannel
"|Hey, y'know what?|",Greeting
"|Since you have such a great sense of what I need, uh ooh, here's-here's 60 bucks, why don't you take Phoebe down to that Colonial flea market of yours and get me some stuff.|",Command
"|Y'know what? I don't, I don't think Phoebe really wants to come.|",Statement Opinion
|No! I do want to!|,Disagreement
"|Oh, she does want to.|",Statement Non Opinion
|She does want to.|,Statement Non Opinion
|Yeah!|,Agreement
"|Wow, you have really pretty feet.|",Statement Opinion
|These old things.|,Statement Opinion
"|Would you mind spending some time on my siadic area, it's been killing me today.|",Command
"|You mean the--Okay by siadic, you mean the towel covered portion.|",Acknowledge
|Yeah.|,Backchannel
"|Sure, yeah, no I can do that, yeah, because umm, y'know, the muscles in the siadic area can get y'know, real nice and tight.|",Agreement
"|So umm, tell me Rick, how umm, how did you injure the area.|",Question
"|Oh, a 16-hour sit-in for Greenpeace.|",Acknowledge
|Oh.|,Backchannel
|Ow! Did you just bite me?|,Question
|No!|,Disagreement
"|Um, that's it.|",Backchannel
|No.|,Disagreement
|Crew guy.|,Statement Non Opinion
|Yeah.|,Backchannel
|Why have you been following me?|,Question
"|I mean, all week long everywhere I look there's you.|",Statement Opinion
"|You wouldn't return my calls, you sent back my letters....|",Statement Non Opinion
|What?|,Question
"|One more chance Ursula, please?|",Command
|Okay.|,Backchannel
"|Okay, and then this is the coffee house. This is where I play my music.|",Statement Non Opinion
|Good deal.|,Agreement
|Here you go.|,Acknowledge
|Thank you.|,Acknowledge
|Hi!|,Greeting
"|Hi! All right, let's go shoppin'!!|",Greeting
"|Um, y'know, before we go ah, there's something I need to say.|",Statement Non Opinion
"|Oh, okay.|",Backchannel
"|I've kinda of had this ah, this crush on you.|",Statement Opinion
"|But since you were with Ross, I-I didn't do anything about it.|",Statement Non Opinion
"|But, now that you're not, I'd really like to ask you out sometime.|",Statement Opinion
"|So-so that's-that's what I'm doing, now.|",Statement Non Opinion
|Wow! Umm....|,Backchannel
|I dropped a cup.|,Statement Non Opinion
"|Hello, tiny embryos.|",Greeting
"|Well, I'm-I'm Phoebe Buffay, hi!|",Greeting
|I'm-I'm-I'm hoping to be your uterus for the next nine months.|,Statement Opinion
"|You should know, that we're doing this for Frank and Alice, who you know, you've been there!|",Command
"|Umm, y'know they want you so much, so when you guys get in there, really grab on.|",Command
"|Okay, and-and I promise that I'll keep you safe and warm until you're ready to have them take you home, so... Oh!|",Acknowledge
"|And also, umm next time you see me, I'm screaming, don't worry, that's what's supposed to happen.|",Command
|Ready?|,Question
|Uh-huh. Good luck.|,Acknowledge
|Then we have to await the data from recent MRI scans and DNA testing which call into question information gathered from years of simple carbon dating.|,Statement Non Opinion
"|Look at that woman sitting by the pool getting tan... so leathery and wrinkled, I'm so|",Command
|I'm not your brother.|,Disagreement
|What about my children Drake?! Huh!? No!! No!! No! God!|,Disagreement
|Why don't we try massaging the breast to stimulate the flow.|,Command
|Are you kidding me?!|,Disagreement
|It's just so frustrating! Why doesn't she want my breast?!|,Statement Opinion
|I don't know! Maybe she's crazy!|,Statement Opinion
"|Hey Joey, I got some beer for you.|",Statement Non Opinion
"|Uh, don't you mean ""for whom?""|",Disagreement
"|Sure, listen I was gonna order some pizza, you wanna share one?|",Question
"|Pizza, heh, its not like I never had that before...ba dum bum cheshhh.|",Statement Opinion
|Is there something wrong?|,Question
"|All right, All right, let's just get this out in the open okay?|",Greeting
|You're hot.|,Statement Opinion
|I'm lovable.|,Statement Opinion
|Clearly there's a vibe going on between us.|,Statement Opinion
"|But, we're roommates and it's a huge mistake for us to continue down this road.|",Statement Opinion
|Joey...|,Others
"|Oh no it's not, no it's not. It's a first date. I'm|",Disagreement
"|Ho-oh, he's gonna get some!|",Statement Opinion
|Of the glare from the streetlight out of his apartment.|,Others
"|Y'know so umm, he's closed the drapes there so he can have a nice, pleasant conversation with your little sister.|",Statement Non Opinion
"|Well, I'm off to bed!|",Statement Non Opinion
|You were so funny with that waiter! You're such a nut!|,Statement Opinion
"|Y'know, breadstick fangs are always funny.|",Statement Opinion
"|No, you make them funny. You're the funny one!|",Disagreement
"|Uhh, look Katie, uh listen, we-we need to talk.|",Command
|Okay?|,Question
"|Umm, look I like you.|",Statement Opinion
"|I-I really do, I like you a lot.|",Statement Opinion
|Okay?|,Question
"|But sometimes when you, when you playfully punch me like that it-it feels like someone's hitting me with a very tiny but very|",Statement Opinion
"|Aww, like I could hurt you. Are you making fun of my size? Don't make fun of me because of my size!|",Command
"|Oh, Joey! Sorry!|",Apology
|They made you head of the department!|,Statement Non Opinion
"|No, I get to teach one of his advanced classes! Why didn't I get head of the department?|",Question
"|Oh! Hey Rach, listen umm|",Greeting
|Yeah.|,Backchannel
"|I got a big date coming up, do you know a good restaurant?|",Question
"|Uh, Paul's Cafe. They got great food and it's really romantic.|",Statement Opinion
"|Ooh, great! Thanks!|",Acknowledge
"|Yeah! Oh, and then afterwards you can take her to the|",Command
"|You sure are naming a lot of ways to postpone sex, I'll tell ya|",Statement Opinion
"|Ooh, I miss dating.|",Statement Opinion
|Gettin' all dressed up and going to a fancy restaurant.|,Statement Non Opinion
"|I'm not gonna be able to do that for so long, and it's so much fun!|",Statement Opinion
|I mean not that sitting at home worrying about giving birth to a sixteen pound baby is not fun.|,Statement Opinion
"|Hey, y'know what?|",Greeting
|Huh?|,Question
|Why don't I take you out?|,Question
"|What?! Joey, you don't want to go on a date with a pregnant lady.|",Disagreement
|Yes I do!|,Agreement
"|And we're gonna go out, we're gonna have a good time, and take your mind off of childbirth and c-sections and-and giant baby heads stretching out|",Command
|Okay! I'll go with ya! I'll go! I'll go with ya.|,Agreement
|I'll be fun.|,Statement Opinion
|All right?|,Greeting
|Hi!|,Greeting
|Hey!|,Greeting
"|Joey, I gotta tell ya, I've been thinking|",Statement Opinion
"|Oh, you know, the writing was good, and the director is good, and... and my co-star's good|",Statement Opinion
"|God, you have to tell me what happens tomorrow!|",Command
"|Ow, I'm just going over the script now! You wanna read lines with me?|",Question
"|Me? Oh, no, I am not an actress.|",Disagreement
"|Oh, all right, I can ask Monica.|",Acknowledge
"|Oh screw her, that part is mine!|",Disagreement
"|Right... ok, so just from the top of the page, right here.|",Backchannel
"|Okay. . Hello Drake, I'm surprised to see you here.|",Greeting
|I can't believe you married him.|,Statement Opinion
|But what choice did I have. He was keeping my sister in a|,Statement Opinion
|So what about us? Everything we feel for each other.|,Question
|It's over! You|,Statement Non Opinion
|How can I?|,Question
"|Knowing I'll never hold you in my arms again, or touch your skin, or feel your lips, knowing I'll never make love to you?|",Statement Opinion
|How can I accept that...|,Question
|I can never kiss you again when it's all I can do not to kiss you right now.|,Statement Opinion
|Kiss me.|,Command
|What?|,Question
"|Come on, you know, Thanksgiving. Ooh, you got the bigger half. What'd you wish for?|",Question
|The bigger half.|,Statement Non Opinion
|I'd like to propose a toast.|,Command
"|Little toast here, ding ding.|",Statement Non Opinion
"|I know this isn't the kind of Thanksgiving that all of you all planned, but for me, this has been really great, you know, I think because it didn't involve divorce or projectile vomiting.|",Statement Opinion
"|Anyway, I was just thinking, I mean, if you'd gone to Vail, and if you guys'd been with your family, if you didn't have syphilis and stuff, we wouldn't be all together, you know?|",Statement Opinion
|So I guess what I'm trying to say is that I'm very thankful that all of your Thanksgivings sucked.|,Statement Opinion
|That's so sweet.|,Statement Opinion
"|And hey, here's to a lousy Christmas.|",Statement Opinion
|And a crappy New Year.|,Greeting
"|Here, here!|",Backchannel
"|Now, hold on!|",Command
|Hold on!|,Command
"|Look, look, your daughter and I are supposed to leave tonight for our honeymoon, now-now you-you tell her that I'm gonna be at that airport and I hope that she'll be there too!|",Command
"|Oh yeah, I said Rachel's name, but it didn't mean anything, Okay?|",Agreement
|She's-she's just a friend and that's all!|,Statement Non Opinion
|That's all!|,Acknowledge
|Now just tell Emily that I love her and that I can't imagine spending my life with anyone else.|,Command
"|Please, promise me that you'll tell her that.|",Command
"|All right, I'll tell her. Come on bugger face!|",Command
|Call me.|,Command
"|You spend half your life in the bathroom, why don't you ever go out the bloody window!|",Command
|What happened?!!|,Question
"|Well, I don't know!!|",Statement Non Opinion
|We fell asleep! That is all.|,Statement Non Opinion
"|Yeah. Yep. Yeah. All right, well uh, I'd better go.|",Acknowledge
|I think that would be best.|,Statement Opinion
"|Yeah. All right, I'll talk to you later.|",Acknowledge
|Okay. But not about this!|,Disagreement
|No! Never! Never! Bye.|,Disagreement
|No touch! No touch!|,Command
"|Umm ma'am, do you have a minute? I kind of have some bad news. I don't think I can move to Tulsa.|",Statement Opinion
|What?|,Question
"|It's a funny story, actually.|",Statement Opinion
"|I kind of fell asleep in the meeting this morning so when I said I'd move to Tulsa, I didn't really know what I was saying.|",Statement Non Opinion
|You fell asleep?|,Question
"|But only because I was up all night worried about this meeting, ain't that funny?|",Statement Non Opinion
|Irony?|,Question
"|Not a fan, alright .|",Statement Opinion
"|See, here's the thing.|",Statement Opinion
|I went home and told my wife about Tulsa and she won't go.|,Statement Non Opinion
"|See, me, I love Tulsa!|",Statement Opinion
|Tulsa is heaven!|,Statement Opinion
|Tulsa is Italy. Please don't make me go there!|,Command
"|Chandler, I...|",Statement Non Opinion
|No no no!|,Disagreement
"|Look, Carol, can I call you Carol?|",Question
|Wh-why would I when your name is Elaine?|,Disagreement
"|Oh what a great picture of your son, strapping!|",Statement Opinion
"|That's a picture of your daughter, isn't it, well she's lovely.|",Statement Opinion
|I like a girl with a strong jaw.|,Statement Opinion
|I'll call you from Tulsa.|,Statement Non Opinion
|Hi.|,Greeting
|Hey.|,Greeting
|How are you?|,Greeting
"|I'm not too bad. Fortunately, blue's my colour. How-how did you know I was here?|",Question
|Because... I'm Monica Geller. It was my credit card you were using.|,Answer
|That I was not expecting.|,Statement Opinion
"|I want you to know, it wasn't me who turned you in.|",Statement Non Opinion
|Oh. Thanks.|,Acknowledge
"|No, thank you! You have given me so much! I mean, if it wasn't for you, I would never have gotten to sing|",Acknowledge
"|Well, actually, you only got to sing 'Memo-'.|",Statement Non Opinion
|I just can't believe you're in here.|,Statement Opinion
"|I mean, what am I gonna do without you?|",Question
|Who's gonna crash the embassy parties with me?|,Question
|Who's gonna take me to the|,Question
"|Uh... Oh, Mindy, you are so stupid. Oh, we are both so stupid.|",Statement Opinion
|What do you mean?|,Question
|Smell familiar?|,Question
|Oh no.|,Acknowledge
"|Oh, I am so sorry.|",Apology
"|No me, I am so sorry...|",Apology
|Oh my.|,Backchannel
"|Well, there's no way I'm gonna get a shot.|",Disagreement
"|Maybe they can take the needle and thquirt it into my mouth, you know, like a thquirt gun.|",Statement Opinion
"|Doctor, can I see you for just a minute please? My brother has a slight phobia about needles.|",Command
|Did you tell him about my thquirt gun idea?|,Question
"|My brother, the PhD would like to know if there's any way to treat this orally.|",Question
"|No, under these circumstances it has to be an injection, and it has to be now.|",Disagreement
|Tho?|,Backchannel
|Ohhh.|,Backchannel
"|That's good, have a seat.|",Command
"|Um, the doctor says it's gotta be a needle.|",Statement Non Opinion
"|You're just gonna have to be brave, ok?|",Command
|Can you do that for me?|,Command
|Ok.|,Acknowledge
|Ok. Oh boy. You are doin' so good. You wanna squeeze my hand?|,Command
|Yes!|,Agreement
"|All right, Ross, don't squeeze it so hard.|",Command
"|Honey, really, don't squeeze it so hard!|",Command
|Let go of my hand!|,Command
|You're gonna love me so much. I got Sting tickets!!|,Statement Non Opinion
|Oh my God! I do love you! How did you do it?!|,Question
|Well...let's just say|,Backchannel
"|Oo, where are the seats?|",Question
"|Uh, middle balcony.|",Statement Non Opinion
|You're a mean old woman.|,Statement Opinion
|No! Wait no! Shut up--I mean don't cry! Let me get my checkbook!|,Command
"|Look honey, you don't have to do this, okay?|",Statement Opinion
