Text,DS_emotion
|also I was the point person on my company's transition from the KL-5 to GR-6 system.|,neutral
|You must've had your hands full.|,joy
|That I did. That I did.|,neutral
|So let's talk a little bit about your duties.|,neutral
|My duties? All right.|,neutral
"|Now you'll be heading a whole division, so you'll have a lot of duties.|",joy
|I see.|,neutral
|But there'll be perhaps 30 people under you so you can dump a certain amount on them.|,anger
|Good to know.|,neutral
|We can go into detail|,joy
|No don't I beg of you!|,fear
"|All right then, we'll have a definite answer for you on Monday, but I think I can say with some confidence, you'll fit in well here.|",joy
|Really?!|,surprise
|Absolutely. You can relax|,joy
|But then who? The waitress I went out with last month?|,anger
|You know? Forget it!|,anger
"|No-no-no-no, no! Who, who were you talking about?|",anger
"|No, I-I-I-I don't, I actually don't know|",fear
|Ok!|,joy
"|All right, well...|",neutral
"|Yeah, sure!|",joy
"|Hey, Mon.|",neutral
|Hey-hey-hey. You wanna hear something that sucks.|,anger
|Do I ever.|,joy
|Chris says they're closing down the bar.|,sadness
|No way!|,surprise
"|Yeah, apparently they're turning it into some kinda coffee place.|",neutral
|Just coffee! Where are we gonna hang out now?|,anger
|Got me.|,surprise
|Can I get a beer.|,neutral
"|Hey, did you pick a roommate?|",neutral
|You betcha!|,joy
|Is it the Italian guy?|,surprise
"|Um-mm, yeah right!|",anger
"|Oh my God, oh my God! Poor Monica!|",surprise
"|What, what, what?!|",surprise
|What?!|,surprise
|He was with her when he wrote this poem.|,joy
"|Look, 'My vessel so empty with nothing inside.|",sadness
"|Now that I've touched you, you seem emptier still.'|",disgust
"|He thinks Monica is empty, she is the empty vase!|",anger
"|Oh, totally. Oh, God, oh, she seemed so happy too.|",sadness
|Done.|,neutral
|Hey!|,joy
|Hi!|,joy
|What are you doing here?|,surprise
"|Ah y'know, this building is on my paper route so I...|",neutral
|Oh.|,surprise
|Hi.|,neutral
|Hi.|,neutral
|How'd did it go?|,neutral
"|Oh well, the woman I interviewed with was pretty tough, but y'know thank God Mark coached me, because once I started talking about the fall line, she got all happy and wouldn't shut up.|",joy
|I'm so proud of you.|,joy
|Me too!|,joy
"|Listen, I'm ah, I'm sorry I've been so crazy and jealous and, it's just that I like you a lot, so...|",sadness
|I know.|,neutral
|Yeah.|,neutral
|Yeah.|,neutral
|Ameri-can.|,neutral
|Ameri-ccan.|,disgust
|Ameri-can. Y'know it's a|,anger
|Everybody!!|,joy
|Good job Joe! Well done! Top notch!|,joy
|You liked it? You really liked it?|,joy
"|Oh-ho-ho, yeah!|",joy
|Which part exactly?|,neutral
|The whole thing! Can we go?|,anger
"|Oh no-no-no, give me some specifics.|",anger
"|I love the specifics, the specifics were the best part!|",joy
"|Hey, what about the scene with the kangaroo? Did-did you like that part?|",joy
|I was surprised to see a kangaroo in a World War I epic.|,surprise
|You fell asleep!!|,anger
|There was no kangaroo!|,surprise
|They didn't take any of my suggestions!|,anger
|That's for coming buddy.|,"The emotion shown in the sentence ""That's for coming buddy."" is **anger**.",anger
|I'll see you later.|,neutral
|Don't go!|,fear
|I'm sorry.|,sadness
|I'm so sorry!|,sadness
|Look!|,surprise
|This guy fell asleep!|,joy
|He fell asleep too!|,joy
|Be mad at him!|,anger
"|Or, call an ambulance.|",anger
"|Okay, look, I think we have to tell Rachel she messed up her dessert.|",anger
"|What?! What is with everybody? It's Thanksgiving, not...Truth-Day!|",anger
"|Yes, and it is my dying wish to have that ring.|",sadness
"|See, if I'm not buried with that ring then my spirit is going to wander the nether world for all eternity|",sadness
"|Okay, that's enough honey!|",anger
|I don't know. Let me see the ring.|,neutral
"|Great! Okay, here.|",joy
|All right.|,neutral
|Thank you. Thank you. Thank you! And|,joy
|What've you been up to?|,neutral
"|Oh, you know, the usual, teaching aerobics, partying way too much.|",joy
"|Oh, and in case you were wondering, those are my legs on the new James Bond poster.|",joy
|Can you hold on a moment? I have another call. I love her.|,neutral  
|Can you hold on a moment? I have another call. I love her.|,joy
|I know.|,neutral
|I'm back.|,neutral
"|So, are we gonna get together or what?|",joy
"|Um, absolutely. Uh, how 'bout tomorrow afternoon? Do you know uh, Central Perk in the Village, say, five-ish?|",joy
"|Great, I'll see you then.|",joy
|Ok. Ok. Having a phone has finally paid off.|,joy
"|Even though you do do a good Bob impression, I'm thinkin' when she sees you tomorow, she's probably gonna realize, ""Hey, you're not Bob.""|",fear
"|I'm hoping that when Bob doesn't show up, she will seek comfort in the open arms of the wry stranger at the next table.|",joy
|Oh my god. You are pure evil.|,anger
"|Ok, pure evil , horny and alone . I've done this|",Here are the emotions for each segment:  
"|Ok, pure evil , horny and alone . I've done this|",
"|Ok, pure evil , horny and alone . I've done this|","1. ""Ok"" - **neutral**  ",neutral
"|Ok, pure evil , horny and alone . I've done this|","2. ""pure evil"" - **anger**  ",anger
"|Ok, pure evil , horny and alone . I've done this|","3. ""horny"" - **joy**  ",joy
"|Ok, pure evil , horny and alone . I've done this|","4. ""and alone"" - **sadness**",sadness
|Nobody!|,anger
|Nobody respects the bucket!|,anger
|You wouldn't believe what people put in here!|,surprise
|Look!|,surprise
"|Okay, does this look like a garbage can to you?|",anger
|No.|,neutral
|This is my wedding.|,joy
"|All right, y'know what? We really are late! Let's go! Let's go! Let's go!!|",anger
|Fine. You'll-you'll watch it on video when we get back.|,anger
|Here you go Phoebe! Here you go Phobo! Phewbedo! Phaybobo.|,joy
|Thank you.|,joy
|Thank you.|,joy
"|All right, let's go! Bye, Pheebs!|",joy
"|Bye, Pheebs!|",joy
|London baby!!|,joy
"|Oh, do you need a hug? You don't have to bring me anything!|",joy
|Hey!|,anger
|Hey! So Estelle lined up a bunch of auditions for me tomorrow and I'll have my health insurance back in no time.|,joy
"|That's great, but shouldn't you be on the toilet right now?|",disgust
|What?!|,surprise
|What's wrong with you?|,anger
|Nothing!|,neutral
"|Well, I-I got this blinding pain in my stomach when I was lifting weights before, then I uh passed out and uh, haven't been able to stand up since.|",fear
"|But um, I don't think it's anything serious.|",neutral
|This sounds like a hernia. You have to--you-you go to the doctor!|,fear
"|No way! 'Kay look, if I have to go to the doctor for anything it's gonna be for this thing sticking out of my stomach!|",surprise
|That's a hernia.|,disgust
|Why did I have to start working out again? Damn you 15s!|,anger
|I love your place! Where is this guy from?|,"joy, anger"
|Uh that's an eighteenth century Indian artifact from Calcutta.|,surprise
"|Oh wow! So, you're more than just dinosaurs.|",joy
|So much more.|,joy
"|Well, well to sum up, we're having fun, you look young.|",joy
|Okay|,neutral
|But that's not enough. So... So...here's a key to my apartment.|,anger
|Really?!|,surprise
|Really.|,neutral
|You don't think this is too fast.|,neutral
|Get Out!|,anger
"|Ross, can I talk to you for a minute?|",neutral
"|Yes, please! So, what's going on?|",joy
"|Uh, well... Joey and I broke up.|",sadness
"|Oh my God, wh-what happened?|",surprise
"|Joey is a great guy, but we're just... so different! I mean, during your speech he kept laughing at homo erectus!|",sadness
|I knew that was him!|,anger
"|Anyway I just, uh, I think it's for the best.|",sadness
"|Hey, you ok?|",neutral
|I guess.|,neutral
|There was hum... there was another reason that I thought it was time to end it with Joey.|,sadness
|I started to realize that I was having feelings for someone else.|,joy
"|Ok Geller. Last day of the conference, you know what happens to the keynote speaker.|",anger
"|Oh, professor Clerk we're kind of in the middle of a conversation, here.|",anger
"|Yeah, can you guys just throw him in the pool later?|",joy
|Or we could throw you both in|,anger
"|Ok, gentlemen!|",joy
|Please!|,joy
|Aren't we a little old for this?|,disgust
"|I mean, we're scientists, right?|",neutral
|We're academics.|,neutral
|And most importantly I... you-you will have to catch us first.|,joy
"|GO, GO, GO!|",anger
"|Go, go, go!|",joy
"|Oh yeah, now everybody wants to be under this hat!|",joy
|Oy!!|,anger
|What's with all this sand?|,surprise
"|Oh, yeah, Bob said there might be flood damage.|",neutral
"|Yeah, either that, or he has a really big cat.|",joy
"|Okay, see that blind guy right there? I'm gonna bash his head in later.|",anger
"|Oh umm, my big scene is coming up. Big scene coming up.|",nervous
"|If you said, ""Big lima bean, bubbling up."" Would she understand the difference?|",surprise
|Rach? What are you doing?|,surprise
"|Oh boy, I just can't watch. It's too scary!|",fear
|It's a diaper commercial.|,disgust
"|Oh yeah well, you know me, babies, responsibilities, ahhh!!!|",anger
|Pizza delivery!|,joy
|I'll get it! I will get that!|,joy
|Hi!|,joy
|Hi!|,joy
"|Hey, you wanna get something to eat or uh, do you wanna see how long we can throw this ball back and forth? Huh?|",joy
"|Uhh, the ball thing.|",neutral
|Yeah?|,anger
"|Hey Ross, wouldn't it be great if we could go two straight hours without dropping it?!|",anger
"|Uhh,|",neutral
|Okay!|,joy
|Uh-oh.|,surprise
|What?|,surprise
|I have to pee. And Rachel's in the bathroom!|,anger
"|Man, I didn't think we were gonna make it!|",joy
"|I know! Don't switch hands, okay?|",anger
|Hey.|,neutral
|Hey!|,anger
|How did it go with Erin?|,neutral
"|Oh, unbelievable! We had the best time!|",joy
"|Yay!! Oh so, you're not, you're not mad at us anymore?|",joy
|No!|,anger
|No!|,anger
|No!|,anger
|You guys were totally right!|,joy
|This is so much better than the first time we went out.|,joy
|Y'know?|,neutral
"|That was so awkward, we were really nervous.|",fear
|Didn't you sleep together?|,surprise
"|Yeah, that really calms me down.|",anger
|And!|,joy
|We have so much in common!|,joy
"|She loves sandwiches, sports, although she is a Met fan, not much of an issue now but if we were ever to have kids, well that's a|",joy
"|Oh my God! Listen to you talkin' about having kids. Oh my Joey. Oh, please don't get married before I do.|",surprise
|Okay.|,neutral
|How does she do that?|,surprise
|I cannot sleep in a public place.|,disgust
|Would you look at her? She is so peaceful.|,joy
|Oh! What what what! ...Hi.|,1. Oh! What what what! - surprise  
|Oh! What what what! ...Hi.|,2. ...Hi. - neutral
"|It's okay, y'know, you just nodded off again.|",sadness
|What's going on with you?|,surprise
|I got no sleep last night!|,anger
|Why?|,neutral
"|My grandmother has this new boyfriend, and they're both kind of insecure in bed.|",disgust
"|Oh, and deaf.|",Here are the emotions for each word/sentence:  
"|Oh, and deaf.|",
"|Oh, and deaf.|",- **Oh** - surprise  ,Oh
"|Oh, and deaf.|",- **and** - neutral  ,and
"|Oh, and deaf.|",- **deaf** - sadness,deaf
"|So they're constantly, like, having to reassure each other that they're having a good time.|",disgust
|You have no idea how loud they are!|,anger
"|Well, if you want, you can stay with Rachel and me tonight.|",joy
|Thanks.|,joy
|Ew! What is that? Something exploded!|,1. disgust  
|Ew! What is that? Something exploded!|,2. surprise
"|It's just her water breaking. Calm down, will you?|",neutral
"|Water breaking, what do you mean? What's that, water breaking?|",surprise
"|Breathe, breathe, breathe.|",neutral
"|Are you insane? I mean Joey, is going to kill you, he's actually going to kill you dead.|",anger
|Okay! You don't think I thought of that?|,anger
|How can you not know which one?|,anger
|I mean that's unbelievable.|,anger
"|I mean, was it Gina?|",surprise
|Which one is Gina?|,neutral
"|Dark, big hair, with the airplane earrings.|",neutral
"|No, no, no, that's Dina.|",anger
"|You see you can't tell which one is which either, dwha!!|",anger
"|I don't know, you thought 'See you Saturday' was funny.|",anger
"|Look honey, Mark is in fashion okay, I like having a friend that I can share this stuff with.|",joy
|You guys would never want to go to a lecture with me.|,sadness
|Pa-haa!! I would love to go with you.|,joy
|Really!?|,surprise
"|Yeah, hey I-I have clothes, I even pick them out.|",joy
"|I mean for, for all you know I could be a fashion..... monger.|",surprise
"|Okay. Honey, I would love for you to go with me. What?|","joy, surprise"
"|What should I wear, now I'm all nervous.|",fear
"|: I know, we did it!! Hey, that was incredible, huh?!|",joy
"|I know, it was amazing! I mean, we totally nailed it, it was beautiful.|",joy
"|: Thank you, listen, thanks a lot Tribbiani, . Oh my God, look at the time, I gotta catch the bus to the ball.|",joy
"|Oh well, okay, good luck.|",neutral
|: Yeah.|,neutral
|Unless you wanna practice the Foxtrot again? Or-or the Tango?|,joy
"|: Ahh, thanks but no. You see I-I think I'm ready to dance with girls.|",disgust
|Okay.|,neutral
|: Yeah.|,neutral
|Go get 'em Treeger.|,joy
"|: Right. Hey, ahh, you wanna come? Marge has a girlfriend.|",joy
|Really?|,surprise
"|: Yeah, you could dance real good with her, she's the same size as me.|",The emotion shown in the sentence is **disgust**.,disgust
"|No, I'm good.|",neutral
"|Oh God, this is so nerve wracking! How-how do you do this?|",fear
"|Well, unfortunately, I don't get many callbacks so|",sadness
|Is it a good sign that they asked us to hang around after the audition?|,surprise
|Who knows?|,surprise
"|Okay uh, we have narrowed it down to Raymond, Ben, Kyle, and Joey. The rest of you, thank you very much.|",neutral
|Yes!! I knew it!! Bye-bye! So long! Later!|,joy
|Oh this is great! I might actually get to play Ben's dad!|,joy
|Yeah!|,joy
"|Actually, that can't happen.|",anger
"|Yeah because you all have such different looks, we're putting you with Raymond and Kyle with Ben.|",anger
|So it'll be either you two or you two.|,neutral
"|Man, this is gonna be kinda weird.|",surprise
"|Yeah, it is.|",joy
"|No, we-we're gonna be like best friends, that's why it's gonna be weird.|",joy
"|Okay, come on, I can't get married until I get something old, something new, something borrowed, and something blue.|",joy
"|Okay, all right, all right, all right! Okay! Okay, here's something, here's something blue and new.|",joy
|Please!|,joy
|Are you kidding?|,anger
"|I-I hurt three huge men, I gave a guy a bloody nose--I mean I-I'm not proud of it but, I really am.|",anger
"|And it's all because of you, wonderful, amazing you.|",joy
|I think you've got concussion.|,sadness
"|No, no, I'm serious. Thank you.|",joy
|You're welcome. I'm sorry. Did I hurt you?|,1. joy  
|You're welcome. I'm sorry. Did I hurt you?|,2. sadness  
|You're welcome. I'm sorry. Did I hurt you?|,3. sadness
"|It's worth the pain. Y'know what, you know what? It's not.|",anger
|Wow! That Mike thing was interesting! I don't know what's gonna happen with Phoebe and David.|,joy
"|I do! Want a hint? huh? ""I do"" ""I do"".|",joy
"|Ok, I'm sensing that this is some kind of word play, because you are pink with barely controlled glee.|",joy
|David is going to propose to Phoebe.|,joy
|What? Why?|,surprise  
|What? Why?|,anger
"|Chandler, we have talked about this.|",anger
|You are not supposed to give people advice!|,anger
|Now couldn't you just have made some sort of inappropriate joke?|,anger
|I|,Here are the emotions for each sentence in one word each:
|I|,
|I|,1. fear  
|I|,2. disgust  
|I|,3. surprise  
|I|,4. sadness  
|I|,5. anger  
|I|,6. joy  
|I|,7. neutral
|They've only been going out for a few weeks and Phoebe is completely hung up on Mike!|,joy
"|She'll say ""No"", David's heart will be broken, it will be too hard for them to recover from and then Phoebe will end up alone|",sadness
"|Man, that's some|",anger
"|Oh, that's not what you want...|",sadness
"|This is my father, Paul Stevens. Dad, this is Ross Geller.|",joy
|It-it's great to meet you Paul.|,joy
|I usually prefer Elizabeth's boyfriends to address me as Mr. Stevens.|,neutral
"|Of course, of course, Mr. Stevens.|",joy
"|So Ross, what your problem?|",anger
|Eh-wh--Excuse me?|,surprise
|Why can't you get a girlfriend your own age?|,anger
|That's funny. Umm.... It's not funny.|,"joy, neutral, sadness"
|I|,Here are the emotions for each sentence:  
|I|,
|I|,1. fear  
|I|,2. joy  
|I|,3. anger  
|I|,4. sadness  
|I|,5. disgust  
|I|,6. surprise  
|I|,7. neutral
|Okay.|,neutral
"|I can, I can see that.|",neutral
"|Umm, but I think if you give me umm, one chance I can, I can change your mind.|",fear
|Okay.|,neutral
|What?|,surprise
|Okay. I'll give you one chance to change my mind. You got one minute.|,anger
|Daddy!|,joy
"|Oh well, it's not on TV yet.|",neutral
"|Well, then it's not on the wall yet.|",neutral
"|Okay, fine, I will bring you a tape, huh?|",anger
"|So umm, now do you have any of Matt Lauer's clothes here? Maybe? Just ones that haven't been cleaned yet?|",disgust
|Ooooohh!|,surprise
"|Oh yeah, I'm sure. And all of a sudden his hands weren't the problem anymore.|",anger
|Was it...?|,neutral
"|Oh, boy scouts could have camped under there.|",disgust
"|""Ooo,"" what?|",surprise
|Uma Thurman.|,neutral
|Oh!|,surprise
|The actress!|,joy
|Thanks Rach.|,joy
|So what are you gonna do?|,anger
|You have to tell her!|,fear
|You have to tell her!|,fear
"|It's your moral obligation, as a friend, as a woman, I think it's a feminist issue!|",anger
|Guys?|,neutral
|Guys?|,neutral
"|Oh, yeah, you have to tell her.|",joy
|Feminist issue. That's where I went!|,anger
|She is gonna hate me.|,sadness
"|Yeah, well...|",neutral
|Will you marry me?|,joy
|It's the big night! We wanted to wish you good luck!|,joy
"|Yeah, yeah you have the ring?|",joy
"|Yeah, right here in my pocket. Pheebs?|",joy
|Oh! Oop!|,surprise
"|Okay, now will you guys get out of here? I want this is to be a surprise and she's gonna know.|",anger
|Yeah-yeah you guys. Get out of here!|,anger
|Hi guys.|,joy
|You are beautiful.|,joy
"|Oh, thank you! What's going on?|",joy
|We're just really...very excited about this charity event that we have to go to.|,joy
"|Okay umm, Ross?|",neutral
"|I'm-I'm really warm, so I'm going to be taking off my sweater.|",neutral
"|Now, I'm just letting you know that this is|",neutral
|Yep! That's hilarious!|,joy
|I'm sorry. I'm done. I'm done.|,sadness
"|Y'know, last night was embarrassing for you too.|",disgust
"|No, not really. I mean you've seen me naked hundreds of times.|",neutral
|Uh-huh. But it was a first for the rest of my building.|,neutral
"|Okay. All right, that's true! But y'know I just don't embarrass that easily.|",joy
|What?! You totally get embarrassed!|,surprise
"|No, I don't! Ross, I think I'm just a more secure person than you are.|",joy
|Is that so?|,neutral
|Yeah.|,neutral
|Hey lady! I don't care how much you want it! Okay?! I am|,anger
|I can't believe it!|,surprise
|I did it!|,joy
|I rode a bike!|,joy
|I never thought I'd be able to do that!|,joy
|Thank you Ross.|,joy
"|Oh hey, don't thank me, thank yourself. You're the one who faced her fears and ultimately overcame them.|",joy
"|Hey, both you guys should be up there with me.|",joy
"|I mean, you two are-are my... I mean, I'm lucky to have just one good|",sadness
|Thanks man.|,joy
|I gotta go check something over here.|,neutral
|What a baby.|,disgust
|Total wuss!|,anger
"|Okay, we have a lot of options here, a number of prototypes for you to try on.|",neutral
|Wow! This looks great!|,joy
"|Yeah! Okay, this one is a mushroom cap. Umm, this one is made of bologna.|","joy, surprise"
|And-and-and-and-and the toothpicks?|,surprise
|You kissed another woman!|,anger
|Call it even?!|,anger
|Okay!|,joy
"|Well, I'm gonna go get these in some water.|",joy
|Wait you stole those from these people's wedding?|,anger
"|No-no, I took them from the hotel lobby.|",disgust
"|Yeah, they think they can charge me for some dirty movie and a bag of Mashuga nuts, they got another think coming.|",anger
|Hey!|,joy
|My sweater!|,anger
|I've been looking for this for like a month!|,joy
|Oh my God!!|,surprise
|Oh my God!|,surprise
|Happy?! Is that what I'm supposed to be Vic? Happy?|,anger
"|Well, why don't you tell me what you're supposed to be!|",anger
|Huh?|,surprise
|Because I sure as hell can't figure it out!|,anger
|I talk to you and nothin'.|,sadness
"|You look at me, and it's nothin'.|",sadness
|Nothing.|,neutral
"|Tasty! I'm really starting to feel like you guys have a history, it's-it's nice.|",joy
|I have a question about this scene.|,neutral
|Yes?|,neutral
"|Well, I don't understand why Adrienne's attracted to Victor.|",disgust
"|Peel the onion. First of all, he's good looking.|",1. neutral  
"|Peel the onion. First of all, he's good looking.|",2. joy
|Yeah.|,neutral
|I think my character's gonna need a little bit more of reason than that.|,anger
"|Oh, hey, how about this one.|",joy
"|Ah, it's says so in the script!|",anger
"|Y'know ah, I-I don't know why my character likes you either, I mean it says in the script here that you're a bitch.|",anger
|It doesn't say that in the script.|,anger
|It does in mine!|,joy
|I can't|,sadness
|Yeah! You gotta tell a girl before you tape her. Such a rookie mistake.|,joy
|Y'know who has a great video camera?|,joy
|Greg and Jenny?|,neutral
|Do you still wanna call 'em? I wanna call 'em.|,anger
|Let's call 'em.|,anger
|Yeah! Ask them if they brought their friends any souvenirs!|,joy
|Hello? Eighth street deli?|,neutral
"|Hey, hang up! You get food poisoning just talkin' to that place.|",anger
"|Uh sorry, wrong number.|",sadness
|Here you go.|,neutral
|Hello? It's the deli again!|,anger
|All right! I'll have a sandwich!|,joy
|I don't think this number's right!|,anger
|Oh come on!!|,anger
"|Gotta go. I miss you too, I love you, but it's getting real late now|",joy
"|Hey Ma. Listen, I made the appointment with Dr. Bazida, and... Excuse me? Did you know this isn't Ma?|",anger
|Her name's Ronni. She's a pet mortician.|,disgust
|Sure. So how long you been...|,neutral
"|Remember when you were a little kid, I used to take you to the navy yard and show you the big ships?|",joy
|Since then?!|,anger
"|No, it's only been six years.|",sadness
|I just wanted to put a nice memory in your head so you'd know that I wasn't always such a terrible guy.|,sadness
|...Joe.|,neutral
|Y'ever been in love?|,joy
|...I d'know.|,neutral
|Then y'haven't. You're burning your tomatoes.|,anger
|You're one to talk.|,anger
"|Joe, your dad's in love big time. And the worst part of it is, it's with two different women.|",anger
|Oh man. Please tell me one of 'em is Ma.|,anger
"|Of course, course one of 'em's Ma. What's the matter with you.|",anger
"|Everything's gonna be all right. Okay, Dick?|",joy
"|Hello, I am Guru Saj--Whoa!! That's supposed to be a duck right? 'Cause otherwise, this is waaay out of my league.|",surprise
"|Hey, Rach, how was work?|",joy
"|Oh, great. Although I did sit down where there wasn't a chair.|",anger
"|By the way, Ross dropped by a box of your stuff.|",neutral
"|Oh, well, I guess I had that one coming.|",sadness
"|I'm just gonna throw it out, it's probably just a bunch of shampoo and...|",disgust
|Something wrong?|,anger
|No. Nothing.|,sadness
"|And then, and then you said that thing about, about bringing the Mesozoic era in the 21st century.|",surprise
"|Yeah, that's it?|",anger
|Yeah.|,neutral
"|Dude, I am sorry about what I said!|",sadness
"|No, no, you're right, it is a ridiculous name!|",joy
|It's not that bad.|,neutral
"|Yes it is! From now on, I have no first name.|",joy
"|So, you're just Bing?|",neutral
|Because we won our apartment back!|,joy
"|What? Ace is high! Jack, queen, king, ace!|",surprise
"|No! Ace is low! Ace, two, three, four!|",anger
|I don't know. Ooh! Ooh! Look it! Ah-ha!|,joy
"|All right, cut, let's pick again, pick again.|",anger
|Okay.|,neutral
|Come on apartment! Come on apartment! Oh! I know queen is high!|,joy
"|Uh-huh, not as high as... It worked! King!|",1. neutral  
"|Uh-huh, not as high as... It worked! King!|",2. joy  
"|Uh-huh, not as high as... It worked! King!|",3. joy
|Yeah baby!|,joy
"|But, we pick again! We pick again!|",joy
|Why?!|,anger
|I don't know!|,surprise
|Tickets please! That's courtside baby!|,joy
"|Seriously, good game though. Good game. What are they so mad about? They get the apartment back!|",joy
|No they didn't!|,anger
"|You know, I don't think we brought enough stuff. Did you forget to pack the baby's anvil?|",fear
|It's gonna be worth it.|,joy
"|It's a known fact that women love babies, all right?|",anger
|Women love guys who love babies.|,joy
|It's that whole sensitive thing.|,neutral
"|Quick, aim him at that pack o' babes over there.|",anger
|Maybe one of them will break away.|,sadness
"|No, no wait, for get them, we got one, hard left.|",fear
"|All right, gimme the baby.|",anger
"|No, I got him.|",joy
"|Oh, seriously you want him?|",disgust
|Hello.|,neutral
"|Well, don't, don't think me immodest, but, me?|",joy
|You wanna smell him?|,disgust
"|Oh, yeah. He's got that great baby smell. Get a whiff of his head.|",joy
|What'd I tell you? What'd I tell you?|,anger
"|Well, we are great guys.|",joy
"|Well, not really.|",neutral
"|I mean technically it's-it's not against the rules or anything, but it is frowned upon.|",disgust
