Text,DS_r1_emotion
|That's weird!|,Statement Opinion
|I'm wearing his briefs right now.|,Statement Non Opinion
|That's...kinda hot.|,Statement Opinion
|I think so too. And that little flap? Great for holding my lipstick.|,Agreement
"|Yeah, I wouldn't know about that.|",Acknowledge
|And! Y'know what Jake says? That women's underwear is actually more comfortable. And he loves the way the silk feels against his skin.|,Statement Opinion
"|Yeah well next thing you know, he'll be telling you that your high heels are good for his posture!|",Disagreement
|There is nothing wrong with Jake! Okay? He is all man! I'm thinking even more than you.|,Statement Opinion
"|Oh yeah, he looked like a real lumberjack in those pink lacys.|",Statement Opinion
|I'm just saying that only a man completely secure with his masculinity could walk around in women's underwear!|,Statement Opinion
|I don't think you could ever do that.|,Disagreement
|Hey! I|,Greeting
"|Okay, whatever.|",Acknowledge
|Lusts of the flesh.|,Others
|What?|,Question
|I don't know. A cowboy theme?|,Question
"|Hey uh, is it okay to come in?|",Question
"|Of course! Oh Joey, this ring I...it's beautiful I love it!|",Statement Opinion
"|Yeah uh look Rach, there's something I gotta tell ya.|",Acknowledge
|Hey!|,Greeting
|Hey! Are you ready to try nursing again?|,Question
"|Yeah! Hi Emma. Hey, why do you think she won't take my breast?|",Question
"|It's all right honey, it takes some babies a while to get it, but don't worry. It'll happen.|",Acknowledge
|Yowza|,Backchannel
"|Okay sweetie, you can do it. Just open up and put it in your mouth.|",Command
|Dear Lord.|,Greeting
"|I'm sorry honey, what were you saying?|",Backchannel
"|Oh uh-uh yeah, I think that...|",Statement Opinion
|Do you think my nipples are too big for her mouth?|,Question
|She looks scared.|,Statement Non Opinion
|Doesn't she look scared?|,Question
"|Y'know, I don't really know her.|",Statement Non Opinion
|Can you see my nipples through this shirt?|,Question
"|No. But don't worry, I'm sure they're still there.|",Disagreement
"|Where are you going, Mr. Suity-Man?|",Question
"|Well, I have an appointment to see Dr. Robert Pillman, career counselor a-gogo. I added the ""a-gogo.""|",Statement Non Opinion
"|Actually, tomorrow night kinda depends on how tonight goes.|",Statement Non Opinion
"|Oh, uh, listen, about tonight...|",Command
"|No, no, no, don't you dare bail on me.|",Command
|The only reason she's goin' out with me is because I said I could bring a friend for her friend.|,Statement Opinion
"|Yes, I know, but her friend sounds like such a...|",Acknowledge
|Pathetic mess?|,Statement Opinion
"|I know, but--come on, man, she's needy, she's vulnerable.|",Disagreement
"|I'm thinkin', cha-ching!|",Statement Opinion
|Thanks.|,Acknowledge
"|Look, you have not been out with a woman since Janice.|",Statement Non Opinion
|You're doin' this.|,Command
|Hi. She said yes.|,Greeting
"|Yes! Way to go, man! Still got the egg, huh?|",Agreement
"|""Happy birthday to you!""|",Greeting
|You're paying for that.|,Command
|What? No-no it's her birthday!|,Disagreement
|You've sung Happy Birthday to 20 different women today!|,Statement Non Opinion
|But it really|,Others
|You are no longer authorized to distribute birthday muffins.|,Command
|Damnit!|,Others
|Rach? Hi!|,Greeting
|Hi!|,Greeting
|Did you tell your sister to ask me out?|,Question
|Well yeah|,Agreement
|Oh wow!|,Backchannel
"|I mean, wow!|",Statement Opinion
"|I mean, I-I-I think she's cute but I-I would never have thought of going out with her, never!|",Statement Opinion
|Really?!|,Backchannel
"|Yeah but after you said it was okay, I figured, ""Why not?!""|",Disagreement
|Oh so-so not really never.|,Disagreement
|I have to say you are a much bigger person than I am.|,Statement Opinion
"|I mean after all we've been through, I just--y'know I wish I had a brother to reciprocate.|",Statement Opinion
"|Hey, if you ever want to go out with Monica, you have my blessing.|",Statement Opinion
"|Oh-ho, and mine!|",Acknowledge
|No-no wait-wait! I can't just let you hang up! Just please talk to me.|,Command
|Well...I only have one thing to do today. I guess I could push it back.|,Statement Opinion
"|Yeah! Now, why do you want to kill yourself?|",Question
"|It's just that I uh, have been working for ten years now at this meaningless, dead-end job and nobody here even knows I exist!|",Statement Opinion
|Chandler?|,Question
|I-I'm sorry?|,Apology
"|No look, I-I'm sure that people know you exist!|",Disagreement
|Oh yeah?|,Question
|I work in a cubicle surrounded by people.|,Statement Non Opinion
|I've been talking to you for five minutes now about killing myself and no one's even looked up from their desk.|,Statement Opinion
|Hang-hang on.|,Backchannel
|Hey everybody!|,Greeting
"|Uh, I'm gonna kill myself!|",Statement Opinion
|I got nothing.|,Statement Non Opinion
"|Apparently, there's like a million guys out there that can play Mac, and there's only this one robot and this one guy who controls it!|",Statement Opinion
|I didn't know he could get me fired!|,Statement Opinion
|What am I going to do?|,Question
"|Well y'know Joey, you're a pretty charming guy.|",Statement Opinion
"|Thanks, but I kinda have a problem to deal with here.|",Acknowledge
"|No sweetie, you've got to win over the guy that controls C.H.E.E.S.E.! You've got to kiss some serious robot ass!|",Command
|That's not a bad idea.|,Agreement
"|Okay, but if I got to turn on the charm tomorrow I'm not wasting anymore of it over here with you guys.|",Statement Opinion
"|Well, actually I got a little bit saved for you Pheebs.|",Statement Non Opinion
"|So do you think uh, Joey's more charming than me?|",Question
|Yeah! That's why I'm sleeping with him on the side.|,Statement Opinion
"|Yeah, you wish.|",Disagreement
"|""You wish.""|",Disagreement
|Why are you yelling?|,Question
"|Whoa, that|",Others
"|Whoa-whoa, what is it?|",Question
|Well... It's a date.|,Agreement
|A date?!|,Question
"|No, no Pheebs you-you must be mistaken, because I know you wouldn't schedule a date on the same night you have plans with a friend!|",Disagreement
"|Come on Joey, don't make me feel badly about this.|",Command
"|No, I'm gonna!!|",Disagreement
|That's right!|,Agreement
"|Yeah, you made me feel really guilty about goin' out with that girl!|",Disagreement
|Like-like-like I did something terrible to you!|,Apology
"|And now Pheebs, you're doing the same thing!|",Statement Opinion
|That--It's not the same thing! This is|,Disagreement
"|Okay, well my girl from the other night was special. She was a scientist too!|",Statement Opinion
|She was?|,Question
"|Well, she graduated from high school!|",Statement Non Opinion
"|Okay, whatever.|",Disagreement
|Y'know what?|,Statement Opinion
"|I don't have time to convince you because he's only here for four hours, and I'm gonna go see him!|",Disagreement
|Fine!|,Agreement
|Yeah!|,Agreement
|Fine!|,Agreement
|Yeah!|,Agreement
"|What are you still doin' here?! I told you, lobster ravioli!|",Command
"|Sorry I'm late, I was stuck at work. There was this big dinosaur.. thing.. anyway.|",Apology
|Hi.|,Greeting
"|Ross, you remember Susan.|",Acknowledge
|How could I forget?|,Question
|Ross.|,Others
"|Hello, Susan. Good shake. Good shake. So, uh, we're just waiting for...?|",Greeting
|Dr. Oberman.|,Acknowledge
|..Dr. Oberman. Okay. And is he-|,Question
|She.|,Others
|#NAME?|,Others
"|Yes, and she's very supportive.|",Agreement
"|Okay, that's great. No, I'm- Oh.|",Acknowledge
|Thanks.|,Acknowledge
"|Quack, quack..|",Others
|Ross? That opens my cervix.|,Others
|Barry?|,Question
|C'mon in.|,Command
|Are you sure?|,Question
"|Yeah! It's fine, it's fine. Robbie's gonna be here for hours.|",Agreement
|Huh?!|,Backchannel
"|So, how ya doin?|",Greeting
|Does she use the cups? Yes! I believe she does. Does she use the plates? Yes! I believe she does.|,Agreement
"|Oh. Thank you. Ohhh, thank you very much. Oh, thank you for coming. Uh, just a second!|",Acknowledge
"|No-no, let me in!|",Command
|Phoebe?|,Question
|Yeah!|,Agreement
|Can you just hold on for one minute?|,Command
"|No, you have to let me in right now!!|",Command
|Are you alone?|,Question
|Yes!|,Agreement
|All right.|,Backchannel
|Let go!|,Command
|No! You let go!|,Disagreement
|How come it's always us left in the field holding the ball?|,Question
|I don't know. I guess the other people just don't care enough.|,Statement Opinion
|Hey! It's starting to snow.|,Greeting
|Gimme the this!|,Command
|Let go!|,Command
|Y'know what?|,Statement Opinion
|Umm?|,Backchannel
|I bet 'ya ya I could fit in there.|,Statement Opinion
|I've got five bucks says you can't.|,Command
"|Shoot! Shoot! Shoot! Shoot, or just fall down. That's good too.|",Command
|Knick fan?|,Question
"|Oh, yeah.|",Backchannel
"|Oh, boy, do they suck.|",Statement Opinion
"|Hey, listen, lady.......whoa.|",Command
"|Look, look at your man, Ewing. Nice shot. You know what, he couldn't hit water if he was standing on a boat.|",Disagreement
|Oh yeah? And who do you like?|,Question
|The Celtics.|,Statement Non Opinion
"|The Celtics? Ha. They couldn't hit a boat if...wait. They suck, alright?|",Disagreement
"|Oh, shut up. You know, it's a rebuilding year. You... waah!|",Command
"|Wha? Wha..aa? Let me get the father. Hey, we need a father over here! We need a father!|",Command
|There is no father.|,Statement Non Opinion
"|Oh, oh, oh, sorry.|",Apology
"|Oh, uh, ok. Right this way. All the other pregnant women seem to be goin' in here.|",Command
|Ok.|,Backchannel
"|Sweetheart, just gimme- gimme another chance, okay, we'll start all over again. We'll go back to Aruba.|",Command
"|Dr. Farber, we've got a bit of an emergency here...Jason Costalano is choking on his retainer.|",Statement Non Opinion
|Oh God...|,Others
"|I'll be right there, Bernice.|",Statement Non Opinion
"|Look, please, please don't go anywhere, okay?|",Command
|Okay.|,Backchannel
"|Okay, we'll be here!|",Acknowledge
|Hating you!|,Statement Opinion
|Did you see how he was sweating when he walked out of there?|,Question
"|Listen honey, if I'm hogging the ball too much you just jump right in there and take a couple punches because I'm telling you, this feels|",Command
|Yeah... I'm pretty sure I'm still gonna marry him.|,Statement Opinion
"|What are you talking about?! Mindy, the guy is the devil! He's Satan in a smock!|",Disagreement
"|Look, I know he's not perfect, but the truth is, at the end of the day, I still really wanna be Mrs. Dr. Barry Farber, D.D.S.|",Statement Opinion
|Oh God.|,Others
|I hope you can find some way to be happy for me. And I hope you'll still be my maid of honor...?|,Statement Opinion
|And I hope Barry doesn't kill you and eat you in Aruba.|,Statement Opinion
"|Listen, Robert's gonna be here any second so, will one of you just tell him?|",Command
|Oh.|,Backchannel
"|Please, right now, no, every time I see him it's like 'Is it on the lose?' 'Is it watching me?'|",Command
"|We can't tell him, you can't go up to a guy you barely know and talk about his.... stuff.|",Command
"|He's right, even if it's to say something complementary.|",Agreement
|Hey!|,Greeting
|Hey.|,Greeting
"|So are ready for the gym? They've got this new rock climbing wall, we can spot each other.|",Question
"|No, I can spot you from here.|",Disagreement
|What?|,Question
"|Okay, listen Robert...|",Command
|I don't have time for this.|,Disagreement
"|No, that is what the game is.|",Disagreement
|Which you just gave up really quickly.|,Disagreement
|Have you seen Joey?|,Question
|What's the matter?|,Question
"|Oh, just this! Y'know what it's my fault really, because the couch is usually where we|",Apology
"|Hey, does somebody wanna hand me one of those tiles.|",Question
|What's going on?|,Question
|He's retiling my floor.|,Statement Non Opinion
|Yo!! Spackel boy! Get up!|,Command
"|Ah-ah-ah, now you started this, you will finish it.|",Command
|He started mine first!|,Disagreement
"|Build the unit Cinderelly, lay the tile Cinderelly.|",Command
|Come on Chloe! Finish up with your customer first. Come on Chloe! Come on Chloe!!|,Command
|Can I help you?|,Question
|Uh-oh.|,Others
"|Uh, y'know what, we're having second thoughts about our copying needs. And we'll need a little more time to think about it.|",Statement Opinion
"|Chloe, switch with me, there's some guys here that got a crush on you.|",Command
"|Okay, that hurt us.|",Statement Opinion
|Hi guys. I haven't seen you since this morning.|,Greeting
"|Well ah, ........y'know.|",Backchannel
"|Hey, what are you guys doing tomorrow night?|",Question
|Both of us?|,Question
|Maybe. Does that scare ya?|,Question
|Relax. It's just Issac's D.J.-ing at the Philly. You should come.|,Command
|We'll be there.|,Statement Non Opinion
"|Great. I'll ah, see ya then.|",Acknowledge
"|All right, rock on.|",Agreement
"|Umm, candles, champagne, yeah anniversaries are great.|",Statement Opinion
"|Cause you know love lasts forever, y'know.|",Statement Opinion
"|Nothing like it in this lifetime, money in the bank, so Rachel and I broke up.|",Statement Non Opinion
"|Oh God, Ross I am so sorry.|",Apology
"|Y'know what, I want to talk to you about this so much, but we should probably do it when we could really get into it, are you free for dinner tomorrow night?|",Question
"|Oh yeah, I'd love that.|",Agreement
"|Oh, great! Me too.|",Agreement
|I guess it all started when Rachel got this new job.|,Statement Opinion
|And why do you care so much?|,Question
|Because! You could get to live out my fantasy!|,Statement Opinion
|You had fantasies about Emily?|,Question
"|No! Y'know,|",Disagreement
|Is that why in junior high you were the only one that hung out with that Ukrainian kid?|,Question
"|Yeah that, plus his mom used to put sour cream on everything!|",Agreement
|Do you love her?|,Question
"|We said it was only going to be two weeks, y'know?|",Statement Non Opinion
|You love her!|,Statement Opinion
|What-what is love really?|,Question
"|Ohhh, I|",Backchannel
|I am a good kisser.|,Statement Opinion
"|Then you two can, can sneak into the cockpit, and things will start to heat up, and then a stewardess comes in... I've been watching too much porn.|",Statement Opinion
|So basically this is very easy. You read from the script and try to sell as much toner as you possibly can.|,Command
"|Okay, I can do that! Oh, by the way, I|",Agreement
|Why don't we do a trial run.|,Command
"|Oh okay. Umm, all right. Hi, this is Phoebe from Empire Office Supplies, can I speak to your supply manager please?|",Question
|I'm the supply manager.|,Statement Non Opinion
"|Umm, okay I would like to talk to you about your toner needs.|",Statement Non Opinion
"|Kathy! Kathy! Hi!! Kathy! Kathy! (She doesn't hear him and keeps running, Chandler starts chasing her as the theme to|",Greeting
"|Hey, Chandler! What are you doing here?|",Question
"|Oh, I just wanted to say, ""Hey!""|",Greeting
|Hey!|,Greeting
|Okay.|,Acknowledge
"|Oh, hey, Mon, do you still have your like old blouses and dresses from high school?|",Question
"|Yeah, I think I have some around here somewhere. Why?|",Answer
"|Well, it's just that maternity clothes are so expensive.|",Statement Opinion
"|Hey, Rach! I made a pile of your stuff over on this side of the room. If you could just......throw your purses at it.|",Command
|Bloomingdale's|,Others
"|Oh my God, are you out of a job?|",Question
"|No, but they stuck me in personal shopping. Which is just a|",Disagreement
|Okay!|,Backchannel
"|Come on, no peeking!|",Command
|Our eyes are closed and we're about to cross the street. Very good.|,Backchannel
"|Okayyyyy, open up!|",Command
|What did you want to show us? Because all I can see is this|,Question
"|Yeah, it's for our catering business!|",Answer
|I think I know that girl.|,Statement Opinion
"|All right, umm, we're not gonna really keep it this way though.|",Statement Opinion
|No?|,Question
"|No, we're gonna paint over the sword, and replace it with a baguette.|",Disagreement
|Oh!|,Backchannel
"|And also, we don't know what to do with this.|",Statement Non Opinion
"|Oh yeah, I definitely know her.|",Acknowledge
"|You don't know?! Rach, you balded my girlfriend!|",Disagreement
"|All right! Ross, do you think it's easy for me to see you with somebody else?|",Question
"|Y'know, hey! You're the one who ended it, remember?|",Statement Opinion
"|Yeah, because I was|",Agreement
|You still love me?|,Question
|Noo.|,Disagreement
|You still love me.|,Statement Opinion
"|Oh, y-yeah, so, you-you love me!|",Acknowledge
"|Noo, nnnnn. What does this mean? What do you, I mean do you wanna, get back together?|",Question
|Noo!|,Disagreement
|Maybe!|,Agreement
"|I, I don't know.|",Acknowledge
"|Ross, I still can't forgive you for what you did, I can't, I just, but sometimes when I'm with you I just, I feel so...|",Statement Opinion
|What?!|,Question
"|I just, I feel, I-I just...|",Statement Opinion
|What?|,Question
|I feel...|,Statement Opinion
"|Noo!! I don't care! I'm not, I'm not gonna playing one-on-one strip poker with you for practice!|",Disagreement
|But I made cards!!|,Statement Non Opinion
|Well! Good night. I'm going upstairs.|,Greeting
|Good night.|,Greeting
|Wanna play strip poker for practice?|,Command
|What are you doing?|,Question
|The key's stuck in the lock.|,Statement Non Opinion
|I can fix it. Hold on. Look out. Look out.|,Command
|It still doesn't work.|,Statement Non Opinion
"|Isn't it incredible?! Monica and Chandler, gettin' married.|",Statement Opinion
"|I know, they're gonna be|",Agreement
"|Ohh... I mean two best friends falling in love, how often does that happen?|",Question
|Not|,Others
|No! I'm so happy for them!|,Disagreement
|Me too! So happy for them!|,Agreement
"|Oh no! No God, definitely not jealous!|",Disagreement
"|I mean I'm probably 98% happy, maybe 2% jealous. And I mean what's 2%? That's nothing.|",Statement Opinion
|Totally. I'm like 90/10.|,Agreement
|Yeah me too.|,Agreement
"|Hey uh, have you guys scene Chandler?|",Question
"|Wh--no, but y'know who did stop in here looking for ya, Tennille.|",Statement Non Opinion
|Remember that guy from cooking school I told you about that put cilantro with everything?|,Question
"|Oh sure, Cilantro Larry.|",Agreement
"|Well, I'm gonna fill in for him as food critic for the Chelsea Reporter.|",Statement Non Opinion
"|Wow, Monica! What an amazing opportunity to influence... dozens of people.|",Statement Opinion
"|How could you say yes, what about our catering business?|",Disagreement
"|Oh no-no-no, it's only one night a week, and plus I get to take all of you out for a|",Disagreement
|Yay!!|,Agreement
"|Oh, in that case----Yay! That was me hopping on board.|",Backchannel
|Oh.|,Backchannel
"|Hey, you guys! Hey, Ross, quick question for ya. Are you ready to party?|",Question
|Hello.|,Greeting
"|Hey, it's me.|",Greeting
"|I know you can't stand to be in the same room as me, so I just thought I'd try and apologize over the phone.|",Apology
|Hello.|,Greeting
"|Look I never should have kissed your girlfriend, but I'm|",Apology
|Stop callin'!!|,Command
"|Hey! Hey! Hey! This is 92.3, WXRK, K-Rock for our $1,000 daily challenge.|",Greeting
|All right!|,Agreement
"|What is the name of your roommate who is very, very sorry and would do anything|",Question
|Joseph Francis Tribbiani are you home yet?!!|,Question
"|Umm, I think he's still out. What's wrong?|",Question
"|Well, I'll tell you Rachel Karen Green, I had plans with Joey tonight and he left me this note.|",Statement Non Opinion
"|""Pheebs, can't make it, got a date. Talk to you later. Big Daddy."" Big Daddy?|",Statement Non Opinion
|Oh that's a nickname we were trying out.|,Statement Non Opinion
"|Hey, y'know what nickname never caught on? The Ross-A-Tron!|",Question
|Hey!|,Greeting
|Oh! Here's Joseph Francis!|,Acknowledge
|Oh-Wha-Ho! What are you middle naming me for?! I left you a note!|,Question
|So what?! That doesn't give you the right to ditch me!|,Disagreement
"|Hey, you can cancel plans with friends if there is the possibility for sex!|",Statement Opinion
"|Phoebe he's right, that is the rule.|",Agreement
|I don't accept this rule.|,Disagreement
"|When we make plans, I expect you to show up.|",Command
"|Okay, I can't just be a way to kill time 'til you meet someone better!|",Disagreement
"|Y'know boyfriends and girlfriends come and go, but this is for life!|",Statement Opinion
|Did you know he was in there?|,Question
|No.|,Disagreement
|How long have we been home?|,Question
|About a half an hour.|,Answer
|Love|,Statement Opinion
"|Lights. Uh, romantic lights.|",Statement Opinion
"|Ooh, nice.|",Backchannel
"|So ah, there was this thing I wanted to talk to you about.|",Statement Non Opinion
"|Oh, right! I completely forgot about that.|",Apology
"|Well ah, I've been doing a lot of thinking, and I look at my life|",Statement Opinion
|Yeah?|,Backchannel
"|And I feel like I've conquered the business world, and I feel like I've conquered the intellectual world, and now I-I have the most beautiful woman in the world.|",Statement Opinion
|Wow.|,Backchannel
|There's one thing missing.|,Statement Non Opinion
|What's that?|,Question
|It's time for me to conquer the physical world.|,Statement Opinion
|Okay.|,Backchannel
"|Monica, I want to become the Ultimate Fighting Champion.|",Statement Opinion
|You wanna what?!|,Question
"|I want to become the Ultimate Fighting Champion! It's the most intense physical competition in the world, it's banned in 49 states!|",Statement Opinion
|What are you talking about?|,Question
"|Okay, my trainer, Ho Chi, is teaching me a combination of Gee Koon Doe and Brazilian street fighting, I've even had my own octagon training ring designed.|",Statement Non Opinion
|And I suppose you used a ring designer for that.|,Statement Opinion
|Yeah.|,Backchannel
"|Monica, I want you there in the front row when I win.|",Statement Opinion
|I want you close enough to smell the blood.|,Command
|What do you think?|,Question
|My parents will be so happy.|,Statement Opinion
|Okay to come in?|,Question
"|Yeah, come on, eat, whatever you want. Dr. Roger got beeped again.|",Command
"|Yeah I know, guess who beeped him?|",Question
|What?!|,Question
|I'm the ruptured spleen.|,Statement Non Opinion
|Why would you do that?|,Question
|Because you shouldn't be with him. You should be with me.|,Command
|Really?|,Backchannel
"|When you were talking about Roger, that was killing me!|",Statement Opinion
"|Look, things like last night they don't just happen.|",Statement Opinion
|Or at least not to me.|,Disagreement
"|Or with the other two women, in the morning y'know I was just lying there and I couldn't wait to just go hang out with my friends, but with you I always y'know with a friend.|",Statement Opinion
|Chandler!|,Acknowledge
"|I know you probably don't want to go out with me, y'know because I make too many jokes and I've never been in a serious relationship and I guess I'm not technically a ""doctor...""|",Statement Opinion
"|There was just one woman, wasn't there?|",Question
"|No, there were two.|",Disagreement
|Including me?|,Question
|Oh yeah.|,Backchannel
|Hey!|,Greeting
|Welcome back!|,Greeting
|Hey! Can we pick up where we left off?|,Question
"|I don't know, I'm still pretty tired out from this afternoon.|",Statement Opinion
|Why?|,Question
"|Uh, the sex.|",Backchannel
|What sex?|,Question
|Our sex.|,Statement Non Opinion
|We didn't have sex.|,Statement Non Opinion
"|Well if I didn't have sex with you, I had sex with someone that looked an awful lot like|",Disagreement
|Ew! Ew! Ew! Ew! Ew! Ew!|,Disagreement
|Oh no! Oh no! Oh no! Oh no! No! No! No!|,Statement Opinion
|Oh my God Stu! I-I can't believe you did this! Now are you absolutely sure she's a hooker?|,Question
"|Either that or she's just the best, most expensive date I ever had.|",Statement Opinion
|Would you look at them. Am I ever gonna find a boyfriend again? I gonna die an old maid.|,Question
|I'm your mother.|,Statement Non Opinion
|Ehh?|,Backchannel
"|Oh, and then Monica joked that she wouldn't go out with a guy like Chandler...|",Statement Non Opinion
|Hi there.|,Greeting
"|...and he couldn't let it go, and... I don't really know what happened with that either.|",Statement Non Opinion
"|And then Ross's new girlfriend, Bonnie, shows up and Rachel convinced her to save her head.|",Statement Non Opinion
"|And then Ross and Rachel kiss, and now Ross has to choose between Rachel and the bald girl and I don't know what happened there either...|",Statement Non Opinion
"|Y'know what, hold on, let me go get Chandler.|",Command
"|Well yeah, I lied before.|",Apology
|Oh!|,Backchannel
|Oh God|,Others
|Now you know how you really feel about it.|,Statement Non Opinion
"|Oh-oh, that's a risky little game!|",Statement Opinion
|Are you really gonna do this?|,Question
|Yeah. I'm gonna have a baby. I'm gonna have a baby. I'm gonna have a baby!|,Statement Non Opinion
|With who?|,Question
"|Ah, it's still not the time.|",Statement Opinion
|You said I was boring--Ohh!|,Backchannel
|When did I say you were boring?!|,Question
"|Oh my God, I remember now! We were playing chess!|",Statement Non Opinion
|Phoebe! You and I have|,Statement Non Opinion
"|Oh, come on!|",Disagreement
"|Yes, remember that time on the frozen lake?|",Question
"|We were playing chess, you said I was boring, and then you took off your energy mask and you were Cameron Diaz!|",Statement Non Opinion
"|Okay, there's a|",Backchannel
"|All right, I'm leaving!|",Command
