Text,DS_emotion
"|Look, I know he's not perfect, but the truth is, at the end of the day, I still really wanna be Mrs. Dr. Barry Farber, D.D.S.|",joy
|Oh God.|,fear
|I hope you can find some way to be happy for me. And I hope you'll still be my maid of honor...?|,joy
|And I hope Barry doesn't kill you and eat you in Aruba.|,disgust
"|Listen, Robert's gonna be here any second so, will one of you just tell him?|",anger
|Oh.|,surprise
"|Please, right now, no, every time I see him it's like 'Is it on the lose?' 'Is it watching me?'|",fear
"|We can't tell him, you can't go up to a guy you barely know and talk about his.... stuff.|",disgust
"|He's right, even if it's to say something complementary.|",neutral
|Hey!|,joy
|Hey.|,neutral
"|So are ready for the gym? They've got this new rock climbing wall, we can spot each other.|",joy
"|No, I can spot you from here.|",anger
|What?|,surprise
"|Okay, listen Robert...|",anger
|I don't have time for this.|,anger
"|No, that is what the game is.|",anger
|Which you just gave up really quickly.|,anger
|Have you seen Joey?|,neutral
|What's the matter?|,neutral
"|Oh, just this! Y'know what it's my fault really, because the couch is usually where we|",The emotion shown in the sentence is **sadness**.,sadness
"|Hey, does somebody wanna hand me one of those tiles.|",neutral
|What's going on?|,surprise
|He's retiling my floor.|,neutral
|Yo!! Spackel boy! Get up!|,anger
"|Ah-ah-ah, now you started this, you will finish it.|",anger
|He started mine first!|,anger
"|Build the unit Cinderelly, lay the tile Cinderelly.|",joy
|Come on Chloe! Finish up with your customer first. Come on Chloe! Come on Chloe!!|,anger
|Can I help you?|,neutral
|Uh-oh.|,surprise
"|Uh, y'know what, we're having second thoughts about our copying needs. And we'll need a little more time to think about it.|",sadness
"|Chloe, switch with me, there's some guys here that got a crush on you.|",joy
"|Okay, that hurt us.|",anger
|Hi guys. I haven't seen you since this morning.|,joy
"|Well ah, ........y'know.|",neutral
"|Hey, what are you guys doing tomorrow night?|",joy
|Both of us?|,joy
|Maybe. Does that scare ya?|,anger
|Relax. It's just Issac's D.J.-ing at the Philly. You should come.|,joy
|We'll be there.|,neutral
"|Great. I'll ah, see ya then.|",joy
"|All right, rock on.|",joy
"|Umm, candles, champagne, yeah anniversaries are great.|",joy
"|Cause you know love lasts forever, y'know.|",joy
"|Nothing like it in this lifetime, money in the bank, so Rachel and I broke up.|","joy, neutral, sadness"
"|Oh God, Ross I am so sorry.|",sadness
"|Y'know what, I want to talk to you about this so much, but we should probably do it when we could really get into it, are you free for dinner tomorrow night?|",joy
"|Oh yeah, I'd love that.|",joy
"|Oh, great! Me too.|",joy
|I guess it all started when Rachel got this new job.|,neutral
|And why do you care so much?|,anger
|Because! You could get to live out my fantasy!|,joy
|You had fantasies about Emily?|,disgust
"|No! Y'know,|",anger
|Is that why in junior high you were the only one that hung out with that Ukrainian kid?|,anger
"|Yeah that, plus his mom used to put sour cream on everything!|",joy
|Do you love her?|,joy
"|We said it was only going to be two weeks, y'know?|",anger
|You love her!|,joy
|What-what is love really?|,sadness
"|Ohhh, I|",joy
|I am a good kisser.|,joy
"|Then you two can, can sneak into the cockpit, and things will start to heat up, and then a stewardess comes in... I've been watching too much porn.|",disgust
|So basically this is very easy. You read from the script and try to sell as much toner as you possibly can.|,neutral
"|Okay, I can do that! Oh, by the way, I|",joy
|Why don't we do a trial run.|,neutral
"|Oh okay. Umm, all right. Hi, this is Phoebe from Empire Office Supplies, can I speak to your supply manager please?|",neutral
|I'm the supply manager.|,neutral
"|Umm, okay I would like to talk to you about your toner needs.|",neutral
"|Kathy! Kathy! Hi!! Kathy! Kathy! (She doesn't hear him and keeps running, Chandler starts chasing her as the theme to|",joy
"|Hey, Chandler! What are you doing here?|",joy
"|Oh, I just wanted to say, ""Hey!""|",joy
|Hey!|,anger
|Okay.|,neutral
"|Oh, hey, Mon, do you still have your like old blouses and dresses from high school?|",joy
"|Yeah, I think I have some around here somewhere. Why?|",neutral
"|Well, it's just that maternity clothes are so expensive.|",sadness
"|Hey, Rach! I made a pile of your stuff over on this side of the room. If you could just......throw your purses at it.|",joy
|Bloomingdale's|,joy
"|Oh my God, are you out of a job?|",surprise
"|No, but they stuck me in personal shopping. Which is just a|",anger
|Okay!|,neutral
"|Come on, no peeking!|",joy
|Our eyes are closed and we're about to cross the street. Very good.|,joy
"|Okayyyyy, open up!|",anger
|What did you want to show us? Because all I can see is this|,anger
"|Yeah, it's for our catering business!|",joy
|I think I know that girl.|,neutral
"|All right, umm, we're not gonna really keep it this way though.|",neutral
|No?|,anger
"|No, we're gonna paint over the sword, and replace it with a baguette.|",joy
|Oh!|,surprise
"|And also, we don't know what to do with this.|",sadness
"|Oh yeah, I definitely know her.|",joy
"|You don't know?! Rach, you balded my girlfriend!|",anger
"|All right! Ross, do you think it's easy for me to see you with somebody else?|",anger
"|Y'know, hey! You're the one who ended it, remember?|",anger
"|Yeah, because I was|",neutral
|You still love me?|,joy
|Noo.|,sadness
|You still love me.|,joy
"|Oh, y-yeah, so, you-you love me!|",joy
"|Noo, nnnnn. What does this mean? What do you, I mean do you wanna, get back together?|",sadness
|Noo!|,anger
|Maybe!|,surprise
"|I, I don't know.|",sadness
"|Ross, I still can't forgive you for what you did, I can't, I just, but sometimes when I'm with you I just, I feel so...|",anger
|What?!|,surprise
"|I just, I feel, I-I just...|",sadness
|What?|,surprise
|I feel...|,Here are the emotions for each sentence:  
|I feel...|,
|I feel...|,1. **fear**  ,fear
|I feel...|,2. **disgust**  ,disgust
|I feel...|,3. **surprise**  ,surprise
|I feel...|,4. **sadness**  ,sadness
|I feel...|,5. **anger**  ,anger
|I feel...|,6. **joy**  ,joy
|I feel...|,7. **neutral**,neutral
"|Noo!! I don't care! I'm not, I'm not gonna playing one-on-one strip poker with you for practice!|",anger
|But I made cards!!|,joy
|Well! Good night. I'm going upstairs.|,joy
|Good night.|,neutral
|Wanna play strip poker for practice?|,disgust
|What are you doing?|,anger
|The key's stuck in the lock.|,anger
|I can fix it. Hold on. Look out. Look out.|,joy  
|I can fix it. Hold on. Look out. Look out.|,neutral  
|I can fix it. Hold on. Look out. Look out.|,fear  
|I can fix it. Hold on. Look out. Look out.|,fear
|It still doesn't work.|,anger
"|Isn't it incredible?! Monica and Chandler, gettin' married.|",joy
"|I know, they're gonna be|",joy
"|Ohh... I mean two best friends falling in love, how often does that happen?|",joy
|Not|,neutral
|No! I'm so happy for them!|,joy
|Me too! So happy for them!|,joy
"|Oh no! No God, definitely not jealous!|",surprise
"|I mean I'm probably 98% happy, maybe 2% jealous. And I mean what's 2%? That's nothing.|",joy
|Totally. I'm like 90/10.|,joy
|Yeah me too.|,neutral
"|Hey uh, have you guys scene Chandler?|",sadness
"|Wh--no, but y'know who did stop in here looking for ya, Tennille.|",anger
|Remember that guy from cooking school I told you about that put cilantro with everything?|,disgust
"|Oh sure, Cilantro Larry.|",disgust
"|Well, I'm gonna fill in for him as food critic for the Chelsea Reporter.|",joy
"|Wow, Monica! What an amazing opportunity to influence... dozens of people.|",surprise
"|How could you say yes, what about our catering business?|",anger
"|Oh no-no-no, it's only one night a week, and plus I get to take all of you out for a|",anger
|Yay!!|,joy
"|Oh, in that case----Yay! That was me hopping on board.|",joy
|Oh.|,surprise
"|Hey, you guys! Hey, Ross, quick question for ya. Are you ready to party?|",joy
|Hello.|,neutral
"|Hey, it's me.|",neutral
"|I know you can't stand to be in the same room as me, so I just thought I'd try and apologize over the phone.|",sadness
|Hello.|,neutral
"|Look I never should have kissed your girlfriend, but I'm|",anger
|Stop callin'!!|,anger
"|Hey! Hey! Hey! This is 92.3, WXRK, K-Rock for our $1,000 daily challenge.|",joy
|All right!|,joy
"|What is the name of your roommate who is very, very sorry and would do anything|",sadness
|Joseph Francis Tribbiani are you home yet?!!|,anger
"|Umm, I think he's still out. What's wrong?|",neutral
"|Well, I'll tell you Rachel Karen Green, I had plans with Joey tonight and he left me this note.|",anger
"|""Pheebs, can't make it, got a date. Talk to you later. Big Daddy."" Big Daddy?|",joy
|Oh that's a nickname we were trying out.|,joy
"|Hey, y'know what nickname never caught on? The Ross-A-Tron!|",joy
|Hey!|,anger
|Oh! Here's Joseph Francis!|,surprise
|Oh-Wha-Ho! What are you middle naming me for?! I left you a note!|,anger
|So what?! That doesn't give you the right to ditch me!|,anger
"|Hey, you can cancel plans with friends if there is the possibility for sex!|",disgust
"|Phoebe he's right, that is the rule.|",joy
|I don't accept this rule.|,anger
"|When we make plans, I expect you to show up.|",anger
"|Okay, I can't just be a way to kill time 'til you meet someone better!|",anger
"|Y'know boyfriends and girlfriends come and go, but this is for life!|",joy
|Did you know he was in there?|,surprise
|No.|,neutral
|How long have we been home?|,neutral
|About a half an hour.|,neutral
|Love|,joy
"|Lights. Uh, romantic lights.|",joy
"|Ooh, nice.|",joy
"|So ah, there was this thing I wanted to talk to you about.|",neutral
"|Oh, right! I completely forgot about that.|",joy
"|Well ah, I've been doing a lot of thinking, and I look at my life|",sadness
|Yeah?|,anger
"|And I feel like I've conquered the business world, and I feel like I've conquered the intellectual world, and now I-I have the most beautiful woman in the world.|",joy
|Wow.|,joy
|There's one thing missing.|,sadness
|What's that?|,surprise
|It's time for me to conquer the physical world.|,anger
|Okay.|,neutral
"|Monica, I want to become the Ultimate Fighting Champion.|",joy
|You wanna what?!|,surprise
"|I want to become the Ultimate Fighting Champion! It's the most intense physical competition in the world, it's banned in 49 states!|",joy
|What are you talking about?|,surprise
"|Okay, my trainer, Ho Chi, is teaching me a combination of Gee Koon Doe and Brazilian street fighting, I've even had my own octagon training ring designed.|",joy
|And I suppose you used a ring designer for that.|,disgust
|Yeah.|,neutral
"|Monica, I want you there in the front row when I win.|",joy
|I want you close enough to smell the blood.|,anger
|What do you think?|,neutral
|My parents will be so happy.|,joy
|Okay to come in?|,neutral
"|Yeah, come on, eat, whatever you want. Dr. Roger got beeped again.|",1. joy  
"|Yeah, come on, eat, whatever you want. Dr. Roger got beeped again.|",2. sadness
"|Yeah I know, guess who beeped him?|",anger
|What?!|,surprise
|I'm the ruptured spleen.|,disgust
|Why would you do that?|,anger
|Because you shouldn't be with him. You should be with me.|,anger
|Really?|,surprise
"|When you were talking about Roger, that was killing me!|",anger
"|Look, things like last night they don't just happen.|",anger
|Or at least not to me.|,sadness
"|Or with the other two women, in the morning y'know I was just lying there and I couldn't wait to just go hang out with my friends, but with you I always y'know with a friend.|",joy
|Chandler!|,joy
"|I know you probably don't want to go out with me, y'know because I make too many jokes and I've never been in a serious relationship and I guess I'm not technically a ""doctor...""|",sadness
"|There was just one woman, wasn't there?|",anger
"|No, there were two.|",anger
|Including me?|,surprise
|Oh yeah.|,joy
|Hey!|,joy
|Welcome back!|,joy
|Hey! Can we pick up where we left off?|,joy
"|I don't know, I'm still pretty tired out from this afternoon.|",sadness
|Why?|,Here are the emotions for each sentence:  
|Why?|,
|Why?|,1. **Why?** - **neutral**,Why?
"|Uh, the sex.|",disgust
|What sex?|,neutral
|Our sex.|,disgust
|We didn't have sex.|,neutral
"|Well if I didn't have sex with you, I had sex with someone that looked an awful lot like|",anger
|Ew! Ew! Ew! Ew! Ew! Ew!|,disgust
|Oh no! Oh no! Oh no! Oh no! No! No! No!|,fear
|Oh my God Stu! I-I can't believe you did this! Now are you absolutely sure she's a hooker?|,surprise
"|Either that or she's just the best, most expensive date I ever had.|",joy
|Would you look at them. Am I ever gonna find a boyfriend again? I gonna die an old maid.|,sadness
|I'm your mother.|,neutral
|Ehh?|,surprise
"|Oh, and then Monica joked that she wouldn't go out with a guy like Chandler...|",surprise
|Hi there.|,neutral
"|...and he couldn't let it go, and... I don't really know what happened with that either.|",sadness
"|And then Ross's new girlfriend, Bonnie, shows up and Rachel convinced her to save her head.|",anger
"|And then Ross and Rachel kiss, and now Ross has to choose between Rachel and the bald girl and I don't know what happened there either...|",surprise
"|Y'know what, hold on, let me go get Chandler.|",anger
"|Well yeah, I lied before.|",anger
|Oh!|,surprise
|Oh God|,anger
|Now you know how you really feel about it.|,neutral
"|Oh-oh, that's a risky little game!|",surprise
|Are you really gonna do this?|,surprise
|Yeah. I'm gonna have a baby. I'm gonna have a baby. I'm gonna have a baby!|,joy
|With who?|,anger
"|Ah, it's still not the time.|",sadness
|You said I was boring--Ohh!|,"anger, surprise"
|When did I say you were boring?!|,anger
"|Oh my God, I remember now! We were playing chess!|",joy
|Phoebe! You and I have|,joy
"|Oh, come on!|",anger
"|Yes, remember that time on the frozen lake?|",joy
"|We were playing chess, you said I was boring, and then you took off your energy mask and you were Cameron Diaz!|",surprise
"|Okay, there's a|",neutral
"|All right, I'm leaving!|",anger
|Because I'm not going to spend one more day with someone whose out to sabotage my every move.|,anger
|That's you Rachel!|,joy
"|Yeah, I got that.|",neutral
"|And you! I throw myself at you and you say no, how gay are you?|",anger
|You take care Jill.|,joy
"|Okay, see ya!|",joy
|Bye-bye|,joy
"|I-I can't believe Jill's gone. I can't help it, I opened a gate.|",sadness
"|How about, you're moving!!|",joy
|Look! This is ridiculous. We should be packing you!!|,anger
"|Hey, how are you guys doing?|",joy
|Great! Monica's moving!|,joy
|I am not!|,anger
|Oh really?! Then how come all your stuff is in this box?!|,anger
"|Okay, you guys. You guys I think I know what's going on here. Okay, you guys|",joy
|No Phoebe I am mad!|,anger
"|Well, deep-deep-deep down!|",joy
"|Yeah, I'm just mad!|",anger
|Then keep running.|,anger
|Okay!|,joy
"|Oh, here's that trench-coat that you wanted.|",neutral
"|Oh great! Wow! Yeah, it's comfortable.|",joy
|Yeah?|,neutral
|Oh! Here we|,surprise
"|All right, y'know what, we've been talking about London too much haven't we?|",anger
|I'm sorry.|,sadness
|It's just 'cause I couldn't be there.|,sadness
"|Cause all I ever get to do now is pregnant stuff, it just bums me out.|",sadness
|Sorry.|,sadness
|What happened?|,surprise
"|Well, y'know, a little of this, a little of that. Got myself a date tomorrow night.|",joy
"|See, didn't I tell you?! You're getting over Ross already!|",joy
|Get out!|,anger
|I just didn't see the fast song coming.|,surprise
|Shh.|,neutral
|Shh.|,neutral
"|Don't try to talk, we'll get you up to your room, we'll soak your feet, you'll be okay.|",sadness
"|Oh, thank you.|",joy
|That is so sweet!|,joy
|Yeah.|,neutral
"|No, I mean it. There are so few genuinely nice guys out there.|",sadness
"|Tell me about it, I feel like I'm holding down the fort all by myself.|",anger
|It's Joey right?|,neutral
|Yeah.|,neutral
|Wait a minute!|,anger
|No!|,anger
|I'm the nice one!|,joy
|I'm the one who danced with the kids all night!|,joy
|How...How small are your feet?|,joy
"|Uhh, do you mind sitting there. I'm-I'm saving this for my friend Ross.|",neutral
|You mean Dr. Geller?|,neutral
|Doctor? Wow! I didn't know he had a nickname.|,joy
"|Oh, he won't sit here.|",sadness
"|Only the people in the white coats sit over there, and only the people in the blue blazers sit here.|",neutral
"|Yeah, it must've fallen out a few blocks back. I just figured we hit a dog.|",The emotion shown in the sentence is **sadness**.,sadness
|Okay.|,neutral
"|Listen uh, could you put Kathy on, I wanna apologize.|",sadness
|Oh yeah man. Joey.|,joy
|Hey.|,neutral
"|Oh no it's fine, don't worry about it.|",sadness
"|Yeah-no, stop apologizing, it's okay.|",joy
|I'll talk to you tomorrow.|,neutral
"|I should uh, probably go.|",fear
|Yeah. Yes! Yeah.|,joy  
|Yeah. Yes! Yeah.|,joy  
|Yeah. Yes! Yeah.|,joy
|I forgot my purse.|,sadness
|Oh.|,surprise
"|No, I really did forget my purse.|",surprise
"|A new place for a new Ross. I'm gonna have you and all the guys from work over once it's y'know, furnished.|",joy
|I must say it's nice to see you back on your feet.|,joy
|Well I am that. And that whole rage thing is definitely behind me.|,anger
|I wonder if its time for you to rejoin our team at the museum?|,joy
"|....and 12, 22, 18, four... What?|",surprise
|I spelled out boobies.|,joy
"|Ross, but me down for another box of the mint treasures, okay. Where, where are the mint treasures?|",joy
"|Ah, we're out. I sold them all.|",neutral
|What?|,surprise
|No.|,neutral
"|No, just, just, just a couple more boxes.|",sadness
"|It-it-it's no big deal, all right, I'm-I'm cool.|",fear
|You gotta help me out with a couple more boxes!|,joy
"|Mon, look at yourself. You have cookie on your neck.|",disgust
|Oh God!|,surprise
"|So, how many have you sold so far?|",neutral
|Check this out. Five hundred and seventeen boxes!|,joy
"|Oh my God, how did you do that?|",surprise
"|Okay, the other night I was leaving the museum just as 'Laser Floyd' was letting out of the planetarium, without even trying I sold 50 boxes!|",joy
"|That's when it occurred to me, the key to my success, 'the munchies.' So I ah, started hitting the NYU dorms around midnight.|",joy
|I am selling cookies by the case.|,joy
|They call me: 'Cookie Dude!'|,joy
"|Okay, stop what you're doing, I need envelope stuffers, I need stamp lickers.....|",anger
"|Well hey, who did these resumes for ya?|",joy
|Me! On my computer.|,joy
|Hi.|,neutral
|Hey. Soaps? Shampoos? Are you really taking all this stuff?|,anger
|Why not? It's built into the price of the room.|,anger
|Yeah but you don't need----What is this?|,anger
|Thread!|,Here's the emotion for each sentence in one word:  
|Thread!|,
|Thread!|,1. **neutral**  ,neutral
|Thread!|,2. **joy**  ,joy
|Thread!|,3. **anger**  ,anger
|Thread!|,4. **fear**  ,fear
|Thread!|,5. **sadness**  ,sadness
|Thread!|,6. **surprise**  ,surprise
|Thread!|,7. **disgust**  ,disgust
|Thread!|,8. **joy**  ,joy
|Thread!|,9. **anger**  ,anger
|Thread!|,10. **neutral**  ,neutral
|Thread!|,
|Thread!|,Let me know if you'd like any adjustments!
|Score! Where are the disposable cameras?|,joy
|What disposable cameras?|,anger
|The cameras? Remember last night I told you to take them?|,anger
|No you didn't.|,anger
"|Yes! Remember? Right before we cut the cake, I went up to you and I said|",joy
"|Oh-oh yeah, you-you came up to me and asked if I could do you a favor, and my Uncle Murray came up to you and handed you a check.|",joy
"|And then you said, ""Why do they call it a check?|",anger
"|Why not a Yugoslavian?""|",anger
"|Yeah, then you did that.|",anger
|So you don't have the cameras?!|,anger
|No. Sorry man.|,sadness
|So? What? What? They're gone! Monica's gonna freak!|,anger
"|Well, I'm sure they're still somewhere here in the hotel. I'll-I'll help you look for them.|",sadness
|Great.|,joy
|In-in three minutes.|,fear
"|Uh Mr. Morse, can I speak to you for a moment?|",neutral
"|Uhh, Rachel, my parents|","The emotion shown in the sentence is ""fear."""
|Ohh! It's so nice to meet you. Hello.|,joy
"|Hello. Well, Joshua, that $500 was for groceries.|",anger
|What?|,surprise
"|This-this, no, oh no, no-no-no, this is not--that's-that's not what it is.|",fear
"|See, see, okay, I work in fashion, see and-and, this is a real dress actually.|",joy
"|It's-it's, they're-they're wearing it in Milan, so part of my job is too wear the clothes, and then I see how people respond, and then I report back to my superiors at|",joy
|Maybe in L.A?|,surprise
|Yes!|,joy
|There you go.|,neutral
"|So, have you kids eaten yet?|",neutral
"|Well, we were going to do that after--I mean umm, next.|",surprise
"|Well, we're starving, why don't we all go get something to eat?|",joy
"|Oh, yeah, well... Yeah, no use wasting this baby, just lyin' around the house.|",anger
|So... We go eat.|,neutral
|Yes.|,neutral
"|You'll wear that. We'll be eating, and of course, you'll be wearing that.|",anger
|Well I guess I should've thought about my wife and kids before I talked back to chef Geller!|,anger
|Thanks.|,joy
|Enough!|,anger
|Lean lean lean|,surprise
|Let me see that.|,neutral
|This one right here.|,neutral
|Triskaidekaphobia.|,fear
|The fear of|,fear
"|No! No, fear of the number 13.|",anger
"|It's possible, they have really sharp edges.|",disgust
"|All right Chandler, you're up.|",neutral
"|Wait a minute, I-I believe I'm entitled to use my Angel Pass for a free turn?|",surprise
|This game makes no sense!|,anger
|Y'know what? You're just upset because you're losing.|,anger
"|Oh come on Ross, I think we're all losers here.|",sadness
"|All right. Chandler, you can either spin the wheel or pick a Google card.|",neutral
|Let me think. Let me think--Oh! I don't care.|,anger
|You-you must choose Mr. Bing.|,fear
"|Either, it makes no difference.|",neutral
"|Choose, you jackass!|",anger
|I'll take a card.|,neutral
"|Okay, you picked the Gimmie card! You get all of Ross's points!|",joy
|What?!|,surprise
|This game is kinda fun.|,joy
|You don't think it's a little crazy that you get all my points just 'cause you|,anger
|I don't think the contestants are supposed to speak to each other.|,neutral
|Very funny Ross!|,joy
|Very life-like and funny.|,joy
|Okay.|,neutral
"|Oh no-no-no, I wasn't waving at you lady.|",anger
"|Whoa, maybe I was!|",surprise
"|Get in there man! Flirt back, mix it up!|",joy
"|Yeah, I-I-I'm down with that.|",joy
"|Okay, here goes.|",neutral
|How you a-doin'?|,joy
|It worked!|,joy
|She's waving me over.|,joy
"|Okay, I-I-I'll be right over.|",fear
"|Let's see, she's on the third floor|",neutral
"|Wow! She is pretty, huh?|",joy
"|Tell me about it, huh? Oh no-no-no, I'm not with her, she's just Monica! Ewwuck!|",1. anger  
"|Tell me about it, huh? Oh no-no-no, I'm not with her, she's just Monica! Ewwuck!|",2. joy  
"|Tell me about it, huh? Oh no-no-no, I'm not with her, she's just Monica! Ewwuck!|",3. disgust
|Hey!|,anger
|Hey!|,anger
"|Oh honey, I'm so sorry, you were right, this feels great!|",joy
"|See? And you don't care if people are staring, it's just for a second cause then you're gone!|",anger
|Gone! I mean its amazing Pheebs. I feel so free and so graceful. Hey! Look out for the horse! Sorry!|,1. joy  
|Gone! I mean its amazing Pheebs. I feel so free and so graceful. Hey! Look out for the horse! Sorry!|,2. fear  
|Gone! I mean its amazing Pheebs. I feel so free and so graceful. Hey! Look out for the horse! Sorry!|,3. sadness
"|Oh come on guys, it's not like I moved to Europe! I just moved across the hall! And|",joy
|Ahh! Aren't you dressed yet?|,anger
|Am I naked again?!|,surprise
|We're supposed to meet my parents in 15 minutes.|,fear
"|Yeah okay, I was just talking to the guys. Just look at them I mean, is it okay if they come visit?|",neutral
|Wh?! What about my allergies?!|,anger
"|Oh right, your allergies. All her, she hates you.|",anger
|Shoot! We're out of soda.|,anger
"|Oh, I'll go out and get you some.|",joy
|Really?!|,surprise
"|Nope! Because I'm not your boyfriend. Hey Pheebs, how did it go?|","anger, neutral, neutral"
"|Well, umm, my Mom's friend, Phoebe, is actually my birth Mom.|",surprise
|I found a dried up seashores.|,disgust
"|Sweety, what are you talking about?|",joy
"|Oh, my new Mom, who-who's a big, fat abandoner!|",anger
"|Whoa, wait, Pheebs, wait a second! Don't you wanna stay here and talk about it?|",surprise
"|No. I'm just, I wanna, I need to be alone.|",sadness
|Monica!|,joy
|Oh.|,surprise
|Open it! Open it! Open it!|,anger
|Yeah baby!|,joy
|So we never got to hear about your wedding!|,surprise
"|No, no, it was just our parents and 1 or 2 friends. It was a small wedding.|",neutral
|Hey!|,anger
"|Hello? Oh, hi Ross! See? Other people call me!|",joy
|Hey!|,anger
|Hi!|,joy
"|So, do you guys wanna come and eat dinner at the restaurant sometime in the next few weeks?|",joy
|Sure!|,joy
|I'd love to!|,joy
|Well you|,neutral
"|Well, I can't give you a massage, because my licence has been revoked again!|",anger
"|Phoebe, what happened?|",surprise
"|Well, it was an accident...You know, it's a lot of oil and sometimes the hand just slips!|",joy
|Have I got a surprise for you? Pack your bags!|,surprise
|Oh no!You guys aren't supposed to get divorced for 7 years!|,surprise
"|Umm, this is nice.|",joy
"|I know, it is isn't it?|",neutral
